session_id,customer_id,session_start,session_end,pages_viewed,device
S70000,C1603,13/01/2025 13:47,2025-01-13 15:52:00,4.0,web
S70001,C1180,2024-11-25 02:11:00,2024-11-25 02:27:00,3.0,ios
S70002,C1432,27/11/2024 12:05,2024-11-27 14:52:00,,mobile
S70003,C1429,24/09/2023 19:44,2023-09-24 19:52:00,,desktop
S70004,C1130,2024-10-16 19:13:00,2024-10-16 21:29:00,1.0,web
S70005,C1323,03/11/2024 12:42,2024-11-03 13:48:00,4.0,ios
S70006,C1278,2023-08-31 03:49:00,,1.0,android app
S70007,C1507,2024-08-09 12:11:00,2024-08-09 12:25:00,,mobile
S70008,C1796,2024-03-27 10:25:00,2024-03-27 10:20:00,3.0,android app
S70009,C1520,15/12/2024 09:16,2024-12-15 12:58:00,,mobile
S70010,C1049,17/08/2023 18:55,,5.0,mobile
S70011,C1702,19/02/2025 01:37,2025-02-19 02:04:00,3.0,android
S70012,C1033,2023-11-23 02:40:00,2023-11-23 04:43:00,3.0,ios
S70013,C1577,2024-09-11 10:25:00,2024-09-11 13:48:00,4.0,android
S70014,C1335,2024-02-15 06:01:00,2024-02-15 08:18:00,4.0,desktop
S70015,C1528,05/03/2023 20:25,2023-03-06 00:17:00,2.0,mobile
S70016,C1052,2023-07-25 12:09:00,2023-07-25 14:01:00,4.0,web
S70017,C1313,29/12/2024 03:50,2024-12-29 06:59:00,2.0,android
S70018,C1014,2023-02-25 11:43:00,2023-02-25 14:33:00,3.0,desktop
S70019,C1092,21/03/2023 12:16,2023-03-21 13:12:00,4.0,android
S70020,C1798,27/02/2023 14:32,2023-02-27 16:56:00,1.0,ios
S70021,C1300,2024-04-18 23:51:00,2024-04-19 01:47:00,3.0,web
S70022,C1395,2024-12-30 20:03:00,2024-12-30 22:29:00,5.0,android app
S70023,C1125,04/11/2023 16:06,2023-11-04 20:06:00,4.0,ios
S70024,C1323,03/04/2023 06:47,2023-04-03 07:44:00,10.0,mobile
S70025,C1622,2024-10-31 11:48:00,2024-10-31 15:16:00,,android app
S70026,,2025-02-10 06:55:00,2025-02-10 07:11:00,,android
S70027,C1478,2024-12-05 23:30:00,2024-12-06 00:21:00,3.0,ios
S70028,C1787,05/02/2025 20:42,2025-02-05 23:39:00,4.0,android
S70029,C1750,08/10/2024 07:38,2024-10-08 08:08:00,10.0,android
S70030,C1013,01/03/2024 11:59,2024-03-01 13:20:00,5.0,mobile
S70031,C1041,13/06/2023 15:59,2023-06-13 18:11:00,10.0,android
S70032,C1026,05/10/2024 05:48,2024-10-05 06:32:00,4.0,android app
S70033,C1072,01/09/2024 10:37,2024-09-01 14:16:00,5.0,mobile
S70034,C1593,06/02/2025 17:25,2025-02-06 19:58:00,4.0,web
S70035,C1687,2024-03-27 14:30:00,2024-03-27 15:33:00,3.0,android app
S70036,C1056,14/12/2024 01:21,,3.0,ios
S70037,C1035,2024-01-05 09:33:00,2024-01-05 09:43:00,2.0,web
S70038,C1461,2024-08-29 18:45:00,2024-08-29 22:07:00,5.0,mobile
S70039,C1214,2025-02-27 01:30:00,2025-02-27 04:47:00,5.0,android
S70040,C1531,02/04/2023 05:44,2023-04-02 05:57:00,4.0,web
S70041,C1518,24/08/2024 19:24,2024-08-24 20:18:00,4.0,desktop
S70042,C1327,15/09/2024 19:59,2024-09-15 23:09:00,2.0,android
S70043,C1263,09/04/2023 10:18,2023-04-09 11:10:00,,android
S70044,C1401,2024-12-21 17:11:00,2024-12-21 20:11:00,1.0,android app
S70045,C1451,2024-05-04 00:03:00,2024-05-04 01:03:00,1.0,desktop
S70046,C1776,2024-11-03 04:36:00,2024-11-03 07:07:00,,android
S70047,C1726,11/09/2023 06:49,2023-09-11 08:55:00,10.0,ios
S70048,C1237,2024-12-13 03:13:00,2024-12-13 06:47:00,1.0,web
S70049,C1645,12/05/2023 12:32,2023-05-12 15:45:00,,web
S70050,C1316,08/08/2024 06:30,2024-08-08 08:56:00,4.0,web
S70051,C1745,2023-09-26 13:01:00,2023-09-26 16:33:00,10.0,desktop
S70052,C1508,10/06/2023 02:15,2023-06-10 04:49:00,,mobile
S70053,C1289,2024-03-20 17:54:00,2024-03-20 18:49:00,2.0,android
S70054,C1249,02/07/2024 09:04,2024-07-02 09:41:00,10.0,ios
S70055,C1411,2024-01-04 15:30:00,2024-01-04 17:55:00,3.0,mobile
S70056,C1771,27/03/2023 22:08,2023-03-27 22:13:00,1.0,ios
S70057,C1586,2025-01-29 19:04:00,2025-01-29 20:32:00,3.0,android app
S70058,C1237,2024-06-22 08:11:00,2024-06-22 10:19:00,4.0,mobile
S70059,C1587,2024-12-18 20:41:00,2024-12-18 22:58:00,1.0,web
S70060,C1651,2024-01-19 02:46:00,2024-01-19 05:31:00,4.0,desktop
S70061,C1033,2024-08-27 11:50:00,2024-08-27 11:45:00,,android app
S70062,C1567,28/02/2024 02:30,2024-02-28 06:08:00,3.0,android app
S70063,C1618,22/03/2024 21:58,2024-03-23 00:06:00,10.0,desktop
S70064,C1282,09/01/2024 10:35,2024-01-09 14:04:00,3.0,web
S70065,C1107,2024-09-06 05:09:00,2024-09-06 06:47:00,1.0,web
S70066,C1215,14/08/2023 22:23,2023-08-15 02:15:00,4.0,web
S70067,C1109,06/01/2024 04:44,2024-01-06 08:04:00,10.0,web
S70068,C1588,2024-07-13 10:35:00,2024-07-13 11:19:00,1.0,ios
S70069,C1543,17/05/2024 21:01,2024-05-17 21:01:00,,desktop
S70070,C1325,2024-03-23 06:00:00,2024-03-23 07:09:00,10.0,android app
S70071,C1589,13/11/2024 04:49,2024-11-13 06:42:00,10.0,android
S70072,C1387,01/06/2023 17:49,2023-06-01 18:05:00,3.0,mobile
S70073,C1509,2024-12-31 05:38:00,2024-12-31 08:29:00,,ios
S70074,C1069,2023-08-17 07:22:00,2023-08-17 09:12:00,3.0,ios
S70075,C1536,2023-05-28 17:54:00,2023-05-28 21:11:00,3.0,android app
S70076,C1224,25/03/2024 16:39,2024-03-25 16:38:00,4.0,android
S70077,C1146,2024-05-24 03:23:00,2024-05-24 06:36:00,2.0,ios
S70078,C1111,13/01/2025 06:22,,2.0,mobile
S70079,C1205,2024-09-04 20:26:00,2024-09-04 22:40:00,2.0,desktop
S70080,C1013,04/11/2023 15:10,2023-11-04 18:05:00,5.0,ios
S70081,C1358,25/02/2024 16:42,2024-02-25 18:13:00,10.0,web
S70082,C1300,2023-11-14 23:31:00,2023-11-15 02:46:00,,desktop
S70083,C1128,30/09/2023 13:17,2023-09-30 13:41:00,5.0,ios
S70084,C1676,23/11/2024 11:20,2024-11-23 13:27:00,5.0,web
S70085,C1554,04/02/2023 14:43,2023-02-04 15:52:00,10.0,web
S70086,C1652,2023-06-04 16:15:00,2023-06-04 17:07:00,3.0,android
S70087,C1259,16/04/2023 00:59,2023-04-16 02:19:00,1.0,mobile
S70088,C1670,06/05/2023 17:22,2023-05-06 18:56:00,1.0,android
S70089,C1726,2025-01-13 21:03:00,2025-01-14 00:39:00,4.0,android
S70090,C1179,22/06/2024 17:03,2024-06-22 17:40:00,2.0,desktop
S70091,C1367,06/07/2024 15:20,2024-07-06 17:50:00,2.0,web
S70092,C1645,2024-02-17 23:19:00,2024-02-18 02:10:00,3.0,android app
S70093,C1069,2023-12-26 00:47:00,2023-12-26 04:42:00,1.0,desktop
S70094,C1106,24/11/2024 10:34,2024-11-24 13:51:00,2.0,android app
S70095,C1088,2023-04-24 20:00:00,2023-04-24 22:57:00,3.0,android app
S70096,C1596,24/11/2023 16:00,2023-11-24 18:30:00,5.0,android
S70097,C1671,2023-04-22 00:35:00,,1.0,ios
S70098,C1042,19/10/2024 17:56,2024-10-19 19:33:00,4.0,android
S70099,C1201,2024-11-27 13:31:00,2024-11-27 17:26:00,2.0,web
S70100,C1773,2024-08-31 15:51:00,2024-08-31 16:39:00,4.0,android app
S70101,C1361,24/09/2023 08:31,2023-09-24 10:40:00,2.0,ios
S70102,C1615,21/03/2024 02:37,2024-03-21 05:17:00,10.0,android app
S70103,C1307,2023-08-06 14:34:00,2023-08-06 17:50:00,1.0,android app
S70104,C1765,01/03/2025 23:35,2025-03-02 01:12:00,4.0,ios
S70105,C1014,13/03/2024 12:12,2024-03-13 13:44:00,4.0,android
S70106,C1591,2024-01-29 20:18:00,2024-01-29 22:41:00,10.0,desktop
S70107,C1300,02/02/2024 10:15,2024-02-02 13:20:00,2.0,desktop
S70108,C1170,2023-08-13 07:19:00,2023-08-13 08:23:00,,android
S70109,C1677,30/03/2024 14:17,2024-03-30 15:07:00,4.0,web
S70110,C1591,2025-01-31 18:26:00,2025-01-31 20:21:00,3.0,android app
S70111,C1289,23/08/2023 06:30,2023-08-23 08:54:00,1.0,mobile
S70112,C1064,14/08/2024 04:09,,5.0,android app
S70113,C1185,2024-12-10 13:58:00,2024-12-10 16:44:00,1.0,mobile
S70114,C1321,24/06/2023 16:07,2023-06-24 18:41:00,10.0,android app
S70115,C1578,22/09/2024 02:22,2024-09-22 03:09:00,5.0,desktop
S70116,C1459,01/01/2023 05:13,2023-01-01 06:44:00,,android
S70117,C1636,11/05/2024 09:13,2024-05-11 11:34:00,3.0,web
S70118,C1639,2024-07-16 20:31:00,2024-07-16 22:05:00,4.0,ios
S70119,C1756,08/09/2023 09:20,2023-09-08 11:34:00,5.0,ios
S70120,C1603,21/02/2023 10:10,2023-02-21 12:39:00,5.0,ios
S70121,C1037,2023-04-29 19:18:00,2023-04-29 19:15:00,5.0,ios
S70122,C1746,09/01/2023 10:58,2023-01-09 11:52:00,5.0,web
S70123,C1699,10/10/2024 00:16,2024-10-10 01:27:00,1.0,android
S70124,C1233,29/04/2024 04:48,2024-04-29 06:05:00,5.0,web
S70125,C1778,2024-03-02 00:39:00,2024-03-02 04:24:00,5.0,android app
S70126,C1790,2024-05-04 20:36:00,2024-05-04 23:26:00,3.0,android app
S70127,C1142,13/03/2024 05:38,2024-03-13 06:44:00,2.0,ios
S70128,C1252,19/03/2023 08:22,2023-03-19 08:52:00,3.0,android app
S70129,C1571,24/08/2024 15:28,2024-08-24 18:28:00,2.0,ios
S70130,C1555,30/08/2023 13:24,2023-08-30 13:35:00,1.0,android
S70131,C1726,2023-01-17 18:34:00,2023-01-17 20:26:00,,desktop
S70132,C1458,2025-02-08 23:59:00,2025-02-09 01:55:00,3.0,web
S70133,C1695,2023-11-21 18:07:00,2023-11-21 18:25:00,,android
S70134,C1428,2024-09-13 17:05:00,2024-09-13 17:31:00,3.0,ios
S70135,C1479,25/03/2024 09:31,2024-03-25 10:27:00,4.0,android
S70136,C1398,07/01/2025 07:24,2025-01-07 09:42:00,1.0,mobile
S70137,C1440,22/03/2024 11:13,2024-03-22 13:21:00,5.0,android
S70138,C1037,2024-09-20 14:41:00,2024-09-20 17:29:00,1.0,android
S70139,C1647,25/06/2024 16:22,2024-06-25 17:52:00,5.0,ios
S70140,C1396,2024-06-20 14:51:00,2024-06-20 14:46:00,10.0,ios
S70141,C1169,2023-11-03 16:47:00,2023-11-03 17:09:00,2.0,android
S70142,C1745,2024-09-01 21:43:00,2024-09-02 00:17:00,2.0,android
S70143,C1536,2023-12-21 20:55:00,2023-12-21 22:12:00,4.0,ios
S70144,C1591,2024-01-06 14:07:00,2024-01-06 18:00:00,4.0,desktop
S70145,C1327,08/09/2023 03:51,2023-09-08 07:03:00,10.0,ios
S70146,C1072,2024-10-08 19:34:00,2024-10-08 19:52:00,,ios
S70147,C1206,2023-09-17 08:16:00,2023-09-17 08:28:00,5.0,ios
S70148,C1799,10/01/2025 19:59,2025-01-10 21:38:00,10.0,ios
S70149,C1317,04/02/2024 02:58,2024-02-04 06:30:00,5.0,ios
S70150,C1017,2024-03-21 07:54:00,2024-03-21 11:39:00,2.0,mobile
S70151,C1663,01/08/2024 10:11,2024-08-01 11:46:00,2.0,android
S70152,C1217,14/12/2023 15:16,2023-12-14 15:13:00,2.0,mobile
S70153,C1577,03/05/2024 15:30,2024-05-03 17:09:00,2.0,android app
S70154,C1626,12/10/2023 07:28,2023-10-12 10:00:00,5.0,ios
S70155,C1481,2024-10-17 05:05:00,2024-10-17 07:36:00,3.0,ios
S70156,C1563,2023-05-26 07:32:00,2023-05-26 10:54:00,,android app
S70157,C1223,08/10/2023 16:29,2023-10-08 18:19:00,1.0,android app
S70158,C1546,2024-03-31 11:24:00,2024-03-31 12:35:00,3.0,mobile
S70159,C1472,16/03/2023 19:05,2023-03-16 21:24:00,10.0,android app
S70160,C1293,15/07/2024 18:53,2024-07-15 19:21:00,1.0,desktop
S70161,C1297,2024-06-15 15:21:00,2024-06-15 15:59:00,1.0,android
S70162,C1685,18/01/2024 15:37,2024-01-18 19:09:00,1.0,desktop
S70163,C1716,2024-11-15 17:54:00,2024-11-15 20:04:00,5.0,mobile
S70164,C1668,2023-08-15 04:46:00,2023-08-15 08:35:00,5.0,mobile
S70165,C1199,11/07/2023 19:02,2023-07-11 22:51:00,1.0,desktop
S70166,C1021,2024-10-16 00:58:00,2024-10-16 04:23:00,1.0,android app
S70167,C1540,2023-03-03 10:37:00,2023-03-03 12:10:00,3.0,web
S70168,C1102,2023-01-13 10:18:00,2023-01-13 11:43:00,4.0,android
S70169,C1522,26/12/2023 23:07,2023-12-27 00:49:00,5.0,web
S70170,C1201,24/03/2024 07:24,,1.0,android
S70171,C1417,2023-11-26 17:23:00,2023-11-26 18:13:00,2.0,web
S70172,C1244,2023-10-19 01:20:00,2023-10-19 02:35:00,2.0,android app
S70173,C1164,2025-01-16 18:04:00,,3.0,web
S70174,C1707,08/08/2024 07:17,2024-08-08 09:55:00,4.0,android app
S70175,C1774,2023-11-07 05:18:00,2023-11-07 06:21:00,10.0,mobile
S70176,C1582,23/02/2024 04:55,2024-02-23 07:02:00,4.0,web
S70177,C1680,04/11/2024 23:55,2024-11-05 00:34:00,4.0,ios
S70178,C1209,25/04/2024 03:08,2024-04-25 06:09:00,,android
S70179,C1648,2023-07-12 19:14:00,2023-07-12 19:59:00,,mobile
S70180,C1638,2023-09-10 01:49:00,2023-09-10 05:16:00,3.0,ios
S70181,C1700,2025-02-20 13:21:00,2025-02-20 15:53:00,3.0,mobile
S70182,C1458,31/08/2023 06:23,,5.0,android app
S70183,C1722,19/07/2023 22:23,2023-07-19 23:40:00,4.0,ios
S70184,C1008,19/09/2024 15:20,2024-09-19 15:36:00,4.0,desktop
S70185,C1184,22/08/2024 21:34,2024-08-22 22:13:00,5.0,desktop
S70186,C1394,21/01/2023 18:25,2023-01-21 18:33:00,10.0,ios
S70187,C1770,10/06/2023 16:11,2023-06-10 16:09:00,2.0,web
S70188,C1391,2025-01-17 22:07:00,2025-01-17 22:18:00,10.0,desktop
S70189,C1248,2024-08-31 12:58:00,2024-08-31 14:57:00,2.0,desktop
S70190,C1522,2023-01-01 16:31:00,2023-01-01 18:10:00,3.0,mobile
S70191,C1170,2024-07-27 15:48:00,2024-07-27 18:25:00,4.0,android app
S70192,C1004,2024-10-06 10:40:00,2024-10-06 14:24:00,3.0,android app
S70193,C1483,26/04/2024 16:41,2024-04-26 16:52:00,2.0,desktop
S70194,C1125,19/07/2024 04:49,2024-07-19 05:40:00,,android
S70195,C1356,19/12/2024 15:12,2024-12-19 16:52:00,4.0,desktop
S70196,C1316,2024-04-21 13:15:00,2024-04-21 14:16:00,3.0,desktop
S70197,C1572,2023-02-18 18:59:00,2023-02-18 22:37:00,5.0,android
S70198,C1081,25/04/2024 14:14,2024-04-25 17:09:00,5.0,android
S70199,C1564,2024-08-17 20:52:00,2024-08-17 22:03:00,10.0,mobile
S70200,C1333,11/06/2024 23:15,2024-06-12 00:04:00,3.0,desktop
S70201,C1120,23/03/2024 12:26,2024-03-23 13:07:00,3.0,desktop
S70202,C1227,2023-01-28 18:31:00,2023-01-28 21:55:00,4.0,mobile
S70203,C1228,2024-11-04 18:31:00,2024-11-04 20:42:00,10.0,ios
S70204,C1107,2024-05-30 10:59:00,2024-05-30 13:39:00,1.0,ios
S70205,C1079,2023-12-10 00:50:00,2023-12-10 02:55:00,1.0,mobile
S70206,C1481,2025-02-11 01:43:00,2025-02-11 03:47:00,3.0,desktop
S70207,C1521,20/10/2024 09:17,2024-10-20 10:37:00,,web
S70208,C1424,08/01/2024 21:02,2024-01-09 00:12:00,3.0,web
S70209,C1057,30/03/2024 22:08,2024-03-30 23:12:00,5.0,web
S70210,C1349,2024-09-07 12:10:00,2024-09-07 15:13:00,3.0,web
S70211,C1448,16/09/2024 23:49,2024-09-17 03:28:00,5.0,mobile
S70212,C1459,2025-01-28 00:43:00,2025-01-28 00:51:00,,android app
S70213,C1415,25/03/2023 00:59,2023-03-25 02:14:00,,android app
S70214,C1463,28/03/2024 19:14,2024-03-28 20:38:00,1.0,mobile
S70215,C1505,28/12/2024 05:44,2024-12-28 08:16:00,1.0,desktop
S70216,C1073,2023-06-01 12:22:00,2023-06-01 14:07:00,1.0,web
S70217,C1607,2023-06-01 14:33:00,2023-06-01 17:48:00,10.0,android app
S70218,C1139,12/06/2023 11:18,2023-06-12 13:09:00,2.0,desktop
S70219,C1721,2024-01-31 07:01:00,2024-01-31 08:20:00,2.0,web
S70220,,07/12/2023 19:19,2023-12-07 20:34:00,5.0,android app
S70221,C1680,2024-11-17 02:47:00,2024-11-17 03:40:00,,android
S70222,C1572,2023-12-26 13:31:00,2023-12-26 14:35:00,,mobile
S70223,C1565,2023-05-04 02:29:00,2023-05-04 05:20:00,3.0,android app
S70224,C1621,28/03/2024 10:13,2024-03-28 10:23:00,5.0,mobile
S70225,C1138,21/08/2024 17:53,2024-08-21 20:55:00,,mobile
S70226,C1781,2025-02-28 23:50:00,2025-03-01 01:15:00,1.0,ios
S70227,C1034,2024-03-28 05:17:00,2024-03-28 06:14:00,1.0,android app
S70228,C1233,2024-10-14 10:35:00,2024-10-14 12:58:00,1.0,web
S70229,C1060,03/04/2023 22:56,2023-04-04 00:00:00,10.0,desktop
S70230,C1159,2024-08-27 17:29:00,2024-08-27 18:17:00,2.0,desktop
S70231,C1543,2024-11-17 01:32:00,2024-11-17 05:12:00,4.0,mobile
S70232,C1454,18/11/2024 16:19,,3.0,desktop
S70233,C1327,2023-01-08 15:21:00,2023-01-08 18:17:00,3.0,desktop
S70234,C1448,2024-12-29 10:48:00,2024-12-29 14:40:00,10.0,ios
S70235,C1276,2023-07-25 22:35:00,2023-07-26 02:17:00,5.0,android app
S70236,C1034,03/01/2023 11:12,2023-01-03 12:42:00,4.0,android app
S70237,C1366,29/01/2025 12:21,2025-01-29 14:09:00,5.0,desktop
S70238,C1515,2024-09-25 20:30:00,2024-09-25 23:52:00,2.0,android
S70239,C1639,26/05/2023 13:33,2023-05-26 15:56:00,,android app
S70240,C1770,11/08/2023 19:23,2023-08-11 19:25:00,5.0,desktop
S70241,C1190,2023-02-04 14:47:00,2023-02-04 17:00:00,5.0,android
S70242,C1243,2024-12-15 00:22:00,2024-12-15 02:10:00,5.0,ios
S70243,C1695,2023-03-26 06:54:00,2023-03-26 07:36:00,,android
S70244,C1013,2023-02-16 13:38:00,2023-02-16 13:36:00,10.0,android
S70245,C1214,01/03/2024 14:11,2024-03-01 14:52:00,10.0,android
S70246,C1427,2023-03-08 04:34:00,2023-03-08 06:23:00,5.0,mobile
S70247,C1013,20/04/2023 10:24,,,web
S70248,C1387,2024-07-14 07:35:00,2024-07-14 09:53:00,4.0,android app
S70249,C1448,2024-04-05 00:52:00,2024-04-05 03:17:00,,desktop
S70250,C1500,07/07/2023 15:55,2023-07-07 17:33:00,,desktop
S70251,C1542,2024-06-17 10:14:00,2024-06-17 10:13:00,,ios
S70252,C1493,05/04/2024 18:56,2024-04-05 20:18:00,,ios
S70253,C1113,24/07/2024 04:07,2024-07-24 05:23:00,10.0,desktop
S70254,C1608,2023-10-23 23:36:00,2023-10-24 01:30:00,1.0,mobile
S70255,C1658,2023-06-24 09:05:00,2023-06-24 10:54:00,1.0,android
S70256,C1173,2023-08-17 15:06:00,2023-08-17 17:10:00,4.0,android app
S70257,C1272,2024-05-05 07:00:00,2024-05-05 10:25:00,3.0,web
S70258,C1777,2024-03-12 22:12:00,2024-03-13 00:28:00,,web
S70259,C1611,02/08/2024 01:53,2024-08-02 01:56:00,4.0,android app
S70260,C1483,2024-06-25 11:33:00,2024-06-25 14:17:00,2.0,web
S70261,C1678,09/08/2023 01:26,2023-08-09 04:44:00,5.0,web
S70262,C1179,26/07/2024 08:43,2024-07-26 09:51:00,2.0,android
S70263,C1387,28/05/2024 06:55,,4.0,android app
S70264,C1331,11/03/2024 16:59,2024-03-11 17:58:00,4.0,ios
S70265,C1349,07/05/2023 13:28,2023-05-07 14:05:00,1.0,mobile
S70266,C1768,2023-06-15 06:34:00,2023-06-15 09:52:00,3.0,android app
S70267,C1476,09/02/2024 13:21,,4.0,mobile
S70268,C1065,13/11/2024 13:02,2024-11-13 15:23:00,4.0,web
S70269,C1193,2024-02-13 15:30:00,2024-02-13 18:12:00,5.0,desktop
S70270,C1414,2024-01-16 11:36:00,2024-01-16 12:01:00,1.0,mobile
S70271,C1288,31/12/2023 14:50,2023-12-31 15:35:00,,ios
S70272,C1590,07/09/2023 23:58,2023-09-08 00:39:00,5.0,desktop
S70273,C1424,10/02/2025 10:18,2025-02-10 10:31:00,10.0,ios
S70274,C1488,13/04/2023 00:20,2023-04-13 02:56:00,3.0,mobile
S70275,C1264,2025-02-01 20:42:00,2025-02-01 20:58:00,10.0,ios
S70276,C1714,2024-03-28 15:57:00,2024-03-28 17:39:00,3.0,ios
S70277,C1372,05/11/2024 04:22,2024-11-05 04:24:00,4.0,desktop
S70278,C1097,2023-01-13 09:02:00,2023-01-13 10:25:00,2.0,ios
S70279,C1711,03/07/2023 10:44,2023-07-03 12:12:00,2.0,desktop
S70280,C1762,05/02/2025 17:41,2025-02-05 19:55:00,2.0,web
S70281,C1316,21/09/2024 23:32,2024-09-22 03:17:00,,mobile
S70282,C1323,15/07/2024 02:01,,1.0,web
S70283,C1234,05/10/2024 17:58,2024-10-05 18:13:00,10.0,android
S70284,C1463,2023-11-24 10:33:00,2023-11-24 10:51:00,3.0,mobile
S70285,C1364,03/04/2024 04:13,2024-04-03 08:07:00,1.0,web
S70286,C1783,17/12/2023 15:32,2023-12-17 17:33:00,3.0,web
S70287,C1181,26/10/2023 11:50,2023-10-26 13:23:00,4.0,desktop
S70288,C1363,2024-04-28 20:09:00,2024-04-28 20:57:00,1.0,android
S70289,C1454,2023-02-17 16:01:00,2023-02-17 19:21:00,3.0,mobile
S70290,C1736,2023-06-06 09:07:00,2023-06-06 11:51:00,2.0,web
S70291,C1307,2023-01-17 09:05:00,2023-01-17 09:35:00,2.0,mobile
S70292,C1304,14/01/2024 01:50,2024-01-14 03:01:00,4.0,desktop
S70293,C1694,23/04/2024 23:59,2024-04-24 01:05:00,4.0,web
S70294,C1530,2025-02-20 09:37:00,,1.0,ios
S70295,C1544,08/09/2023 03:25,2023-09-08 05:16:00,10.0,mobile
S70296,C1149,24/01/2024 00:33,2024-01-24 02:24:00,5.0,android
S70297,C1330,18/11/2024 03:27,2024-11-18 04:04:00,1.0,android app
S70298,C1142,2025-02-23 21:52:00,2025-02-23 22:17:00,1.0,web
S70299,C1737,28/04/2023 02:21,2023-04-28 05:42:00,5.0,web
S70300,C1429,2024-10-12 11:40:00,2024-10-12 12:40:00,4.0,android
S70301,C1670,2024-01-27 13:05:00,2024-01-27 16:32:00,5.0,desktop
S70302,C1618,2023-08-25 20:18:00,,1.0,desktop
S70303,C1587,2023-01-18 22:17:00,2023-01-18 22:27:00,10.0,android app
S70304,C1049,27/03/2024 21:41,2024-03-27 22:45:00,4.0,desktop
S70305,C1724,2023-12-31 01:02:00,2023-12-31 02:46:00,10.0,android app
S70306,C1115,12/02/2023 09:21,2023-02-12 10:50:00,4.0,android app
S70307,C1533,19/07/2024 09:02,2024-07-19 09:02:00,2.0,desktop
S70308,C1374,18/10/2024 17:37,2024-10-18 20:12:00,4.0,desktop
S70309,C1106,22/05/2023 04:40,2023-05-22 07:05:00,,desktop
S70310,C1780,04/05/2024 00:25,2024-05-04 03:36:00,4.0,android
S70311,C1105,2024-08-07 19:43:00,2024-08-07 23:11:00,1.0,android
S70312,C1114,08/02/2023 20:24,2023-02-08 23:22:00,5.0,android
S70313,C1322,2023-11-14 19:50:00,2023-11-14 20:40:00,10.0,ios
S70314,C1753,12/11/2023 19:15,2023-11-12 21:28:00,10.0,ios
S70315,C1443,2023-12-07 13:41:00,2023-12-07 14:31:00,,web
S70316,C1487,23/12/2023 23:44,2023-12-24 00:52:00,3.0,mobile
S70317,C1255,27/10/2024 16:02,2024-10-27 19:41:00,2.0,web
S70318,,25/11/2024 07:50,2024-11-25 11:14:00,5.0,mobile
S70319,C1237,02/11/2024 12:13,,4.0,web
S70320,C1556,29/07/2024 06:25,,2.0,ios
S70321,C1352,27/10/2023 15:08,2023-10-27 17:02:00,3.0,android app
S70322,C1076,2023-06-18 09:23:00,2023-06-18 10:46:00,2.0,desktop
S70323,C1327,30/11/2023 16:58,2023-11-30 18:44:00,,android app
S70324,C1470,2025-01-31 03:31:00,2025-01-31 03:48:00,4.0,mobile
S70325,C1438,2023-02-09 16:46:00,2023-02-09 18:08:00,1.0,web
S70326,C1293,15/08/2023 07:22,2023-08-15 10:46:00,2.0,desktop
S70327,C1753,08/03/2023 09:55,2023-03-08 10:39:00,,android app
S70328,C1430,20/10/2024 21:11,2024-10-20 21:28:00,4.0,mobile
S70329,C1506,2023-09-24 08:41:00,2023-09-24 12:40:00,2.0,desktop
S70330,C1037,13/10/2024 19:40,2024-10-13 19:42:00,5.0,web
S70331,C1664,2024-12-28 13:25:00,2024-12-28 16:31:00,3.0,android
S70332,C1377,2024-12-20 07:42:00,2024-12-20 11:12:00,,desktop
S70333,C1061,2024-09-14 01:49:00,2024-09-14 01:47:00,5.0,desktop
S70334,C1676,11/02/2023 23:02,2023-02-12 00:46:00,10.0,web
S70335,C1423,2023-09-24 11:13:00,2023-09-24 14:25:00,3.0,android
S70336,C1768,2024-08-28 22:35:00,,3.0,desktop
S70337,C1544,19/01/2023 08:44,2023-01-19 08:54:00,4.0,android app
S70338,C1009,2025-01-11 17:55:00,2025-01-11 21:09:00,4.0,ios
S70339,C1623,2025-02-17 17:51:00,2025-02-17 18:11:00,2.0,ios
S70340,C1557,2025-01-24 13:31:00,2025-01-24 15:09:00,5.0,web
S70341,C1207,2024-10-09 05:53:00,,5.0,web
S70342,C1516,20/11/2023 03:19,2023-11-20 06:51:00,10.0,ios
S70343,C1752,11/01/2023 21:36,2023-01-12 01:21:00,4.0,mobile
S70344,C1214,21/01/2024 03:47,2024-01-21 04:14:00,1.0,android app
S70345,C1069,24/03/2024 01:36,2024-03-24 03:18:00,4.0,mobile
S70346,C1596,2024-08-16 16:28:00,2024-08-16 18:18:00,1.0,web
S70347,C1228,04/08/2023 02:31,,,web
S70348,C1265,2023-01-15 18:32:00,2023-01-15 20:43:00,4.0,android
S70349,C1444,29/04/2023 12:26,2023-04-29 13:31:00,4.0,desktop
S70350,C1331,2024-06-30 17:06:00,2024-06-30 17:26:00,3.0,ios
S70351,C1719,2023-08-17 00:14:00,2023-08-17 01:38:00,,android
S70352,C1061,2024-10-03 17:18:00,2024-10-03 19:02:00,5.0,android
S70353,C1181,2024-01-24 19:06:00,2024-01-24 21:43:00,4.0,android app
S70354,C1777,2024-11-26 05:35:00,2024-11-26 06:57:00,2.0,android app
S70355,C1496,2023-04-09 11:03:00,2023-04-09 14:54:00,4.0,android
S70356,C1327,2023-04-14 12:16:00,2023-04-14 14:36:00,10.0,desktop
S70357,C1521,30/11/2023 08:59,2023-11-30 10:57:00,,mobile
S70358,C1438,23/02/2024 12:09,2024-02-23 14:30:00,3.0,web
S70359,C1052,2024-01-14 14:14:00,2024-01-14 17:59:00,4.0,web
S70360,C1254,2023-04-25 04:55:00,2023-04-25 05:31:00,10.0,desktop
S70361,C1640,24/12/2023 07:26,2023-12-24 09:23:00,10.0,web
S70362,C1306,21/04/2023 04:28,2023-04-21 07:16:00,10.0,web
S70363,C1764,2024-02-17 18:32:00,2024-02-17 19:57:00,10.0,desktop
S70364,C1763,2024-04-08 12:11:00,2024-04-08 14:59:00,4.0,desktop
S70365,C1352,2025-02-27 05:50:00,2025-02-27 07:14:00,10.0,web
S70366,C1385,2025-02-13 18:22:00,2025-02-13 22:19:00,4.0,desktop
S70367,C1207,2024-05-25 23:40:00,2024-05-26 02:43:00,2.0,mobile
S70368,C1704,2024-08-21 09:31:00,2024-08-21 12:12:00,3.0,ios
S70369,C1246,2023-10-14 11:02:00,2023-10-14 11:35:00,3.0,desktop
S70370,C1211,22/07/2024 01:40,2024-07-22 01:54:00,10.0,web
S70371,C1796,31/07/2024 20:32,2024-07-31 23:11:00,5.0,desktop
S70372,C1553,2024-09-23 14:07:00,2024-09-23 16:57:00,10.0,mobile
S70373,C1591,2024-04-22 07:41:00,2024-04-22 10:55:00,5.0,android app
S70374,C1154,14/08/2023 02:48,2023-08-14 03:15:00,,desktop
S70375,C1250,2023-12-11 15:06:00,2023-12-11 17:55:00,,web
S70376,C1307,2024-03-10 01:57:00,2024-03-10 04:12:00,10.0,android
S70377,C1638,12/10/2023 05:24,2023-10-12 08:23:00,10.0,desktop
S70378,C1368,26/03/2023 08:53,2023-03-26 09:01:00,10.0,mobile
S70379,C1141,2025-02-27 08:28:00,,5.0,android
S70380,C1285,2023-03-31 13:21:00,2023-03-31 17:17:00,1.0,desktop
S70381,C1787,2023-02-07 08:16:00,2023-02-07 09:18:00,2.0,android app
S70382,C1328,23/02/2025 03:23,2025-02-23 04:10:00,4.0,mobile
S70383,C1462,09/07/2023 13:16,2023-07-09 15:26:00,1.0,desktop
S70384,C1054,2023-10-18 11:43:00,2023-10-18 13:51:00,4.0,ios
S70385,C1347,06/11/2024 16:47,2024-11-06 20:37:00,,mobile
S70386,C1078,10/10/2024 04:38,2024-10-10 05:10:00,3.0,desktop
S70387,C1324,29/02/2024 23:38,2024-03-01 02:33:00,4.0,ios
S70388,C1345,20/10/2023 23:23,2023-10-20 23:42:00,,android
S70389,C1739,21/09/2023 02:42,2023-09-21 03:51:00,2.0,web
S70390,C1481,20/11/2024 18:51,2024-11-20 19:59:00,4.0,android app
S70391,C1543,2023-04-28 07:59:00,2023-04-28 10:37:00,2.0,mobile
S70392,C1653,17/01/2025 14:35,2025-01-17 15:30:00,10.0,android app
S70393,C1136,2023-02-15 08:38:00,2023-02-15 08:39:00,5.0,desktop
S70394,C1412,2024-06-02 15:53:00,2024-06-02 16:32:00,5.0,android app
S70395,C1196,2024-03-14 04:01:00,2024-03-14 06:48:00,2.0,android
S70396,C1548,09/09/2024 06:51,2024-09-09 06:56:00,5.0,android app
S70397,C1556,14/07/2024 06:28,2024-07-14 08:37:00,,mobile
S70398,C1007,2023-09-10 19:25:00,2023-09-10 21:12:00,4.0,mobile
S70399,C1655,2023-11-30 23:10:00,2023-12-01 02:45:00,2.0,android app
S70400,C1207,16/11/2023 05:52,2023-11-16 06:20:00,10.0,android
S70401,C1170,01/05/2024 21:26,2024-05-01 23:01:00,4.0,mobile
S70402,C1275,03/01/2023 22:51,2023-01-03 23:51:00,,web
S70403,C1693,2024-05-12 09:42:00,2024-05-12 13:18:00,10.0,android app
S70404,C1756,2024-11-23 03:19:00,2024-11-23 05:13:00,4.0,android app
S70405,C1148,23/03/2024 08:54,2024-03-23 12:26:00,,mobile
S70406,C1475,20/02/2025 08:00,2025-02-20 11:31:00,5.0,ios
S70407,C1090,2023-06-24 13:44:00,2023-06-24 15:03:00,,web
S70408,C1386,07/05/2023 06:22,2023-05-07 07:02:00,1.0,ios
S70409,C1112,15/07/2023 09:09,2023-07-15 11:02:00,1.0,mobile
S70410,C1681,2023-11-30 11:21:00,2023-11-30 14:04:00,2.0,desktop
S70411,C1537,2024-01-30 02:35:00,2024-01-30 03:53:00,3.0,desktop
S70412,C1765,22/07/2023 04:52,2023-07-22 07:49:00,10.0,android app
S70413,C1687,16/03/2024 23:09,,1.0,android app
S70414,C1399,01/04/2023 06:34,2023-04-01 08:21:00,3.0,desktop
S70415,C1791,2023-09-19 03:55:00,2023-09-19 06:04:00,1.0,ios
S70416,C1164,05/12/2024 11:22,2024-12-05 12:36:00,5.0,ios
S70417,C1732,2023-03-16 00:36:00,2023-03-16 01:00:00,2.0,android
S70418,C1704,14/11/2024 11:17,2024-11-14 11:42:00,2.0,ios
S70419,C1523,2023-05-16 20:23:00,2023-05-16 22:24:00,5.0,mobile
S70420,C1647,02/03/2025 04:55,2025-03-02 07:25:00,3.0,android
S70421,C1386,07/05/2024 10:00,2024-05-07 13:49:00,,mobile
S70422,C1593,12/01/2024 12:57,2024-01-12 14:24:00,2.0,android app
S70423,C1473,08/07/2024 16:40,2024-07-08 20:00:00,,android
S70424,C1753,2023-03-05 16:57:00,2023-03-05 18:31:00,,web
S70425,C1256,08/10/2023 20:56,2023-10-09 00:36:00,3.0,mobile
S70426,C1492,22/06/2024 05:44,2024-06-22 07:43:00,4.0,desktop
S70427,C1427,2023-01-14 14:10:00,2023-01-14 15:24:00,4.0,web
S70428,C1740,27/04/2024 02:09,2024-04-27 02:29:00,1.0,desktop
S70429,C1184,2024-02-05 06:13:00,2024-02-05 08:55:00,1.0,web
S70430,C1220,2023-11-11 01:44:00,2023-11-11 02:53:00,10.0,ios
S70431,C1647,2024-11-10 05:42:00,2024-11-10 08:02:00,10.0,desktop
S70432,C1480,25/09/2024 06:31,2024-09-25 06:46:00,10.0,mobile
S70433,C1025,26/06/2024 03:46,2024-06-26 05:50:00,,desktop
S70434,C1214,12/09/2023 04:26,2023-09-12 07:47:00,3.0,android
S70435,C1700,2024-04-26 05:28:00,2024-04-26 07:46:00,10.0,web
S70436,C1569,11/09/2023 07:09,2023-09-11 07:38:00,4.0,ios
S70437,C1352,24/02/2024 04:28,2024-02-24 08:09:00,4.0,ios
S70438,C1667,02/04/2024 23:27,2024-04-03 03:16:00,3.0,ios
S70439,C1285,25/03/2024 09:27,2024-03-25 10:48:00,2.0,android
S70440,C1480,21/09/2024 10:58,,5.0,web
S70441,C1573,02/06/2024 16:55,2024-06-02 18:02:00,3.0,ios
S70442,C1775,07/05/2023 18:40,2023-05-07 22:36:00,3.0,web
S70443,C1454,2023-10-27 12:34:00,2023-10-27 12:29:00,10.0,mobile
S70444,C1770,02/04/2024 20:45,,,android
S70445,C1711,2024-04-13 09:37:00,2024-04-13 10:12:00,2.0,android
S70446,C1189,03/12/2024 04:36,2024-12-03 08:11:00,4.0,android app
S70447,C1423,24/10/2023 08:38,2023-10-24 11:07:00,5.0,ios
S70448,C1539,17/09/2024 06:50,2024-09-17 09:56:00,3.0,web
S70449,C1098,16/03/2023 06:26,2023-03-16 08:45:00,2.0,ios
S70450,C1584,15/05/2024 11:40,2024-05-15 12:57:00,2.0,ios
S70451,C1193,21/05/2024 05:55,2024-05-21 08:12:00,4.0,mobile
S70452,C1125,2025-01-15 12:26:00,2025-01-15 16:18:00,2.0,mobile
S70453,C1625,2024-05-31 08:45:00,2024-05-31 10:18:00,3.0,ios
S70454,C1158,2024-09-10 00:58:00,2024-09-10 02:38:00,1.0,web
S70455,C1183,04/12/2024 10:14,2024-12-04 11:42:00,5.0,android
S70456,C1741,19/02/2024 20:27,,,web
S70457,C1585,2024-03-25 20:32:00,2024-03-25 23:43:00,5.0,android
S70458,C1287,2023-08-03 05:02:00,,10.0,mobile
S70459,C1092,2023-07-15 02:25:00,,3.0,mobile
S70460,C1790,07/05/2023 22:45,2023-05-07 23:19:00,5.0,ios
S70461,C1729,2025-03-06 06:55:00,2025-03-06 09:58:00,4.0,desktop
S70462,C1179,2023-04-20 15:28:00,2023-04-20 18:28:00,10.0,desktop
S70463,C1718,03/09/2024 00:21,2024-09-03 04:08:00,,mobile
S70464,C1228,07/09/2023 09:02,,1.0,web
S70465,C1142,01/08/2023 17:43,2023-08-01 19:56:00,1.0,ios
S70466,C1522,30/06/2024 07:12,2024-06-30 07:50:00,2.0,mobile
S70467,C1771,2023-07-24 03:41:00,2023-07-24 06:07:00,4.0,ios
S70468,C1713,23/11/2023 21:56,2023-11-23 23:31:00,2.0,web
S70469,C1000,2025-01-15 03:32:00,2025-01-15 03:44:00,3.0,desktop
S70470,C1782,17/01/2023 03:25,2023-01-17 05:48:00,5.0,web
S70471,C1401,17/02/2024 08:34,2024-02-17 12:03:00,,desktop
S70472,C1189,2023-01-12 05:15:00,2023-01-12 07:06:00,10.0,mobile
S70473,C1356,2024-03-09 04:34:00,2024-03-09 05:11:00,,desktop
S70474,C1246,01/03/2023 03:55,2023-03-01 07:27:00,,mobile
S70475,C1701,2024-09-03 07:32:00,2024-09-03 09:11:00,2.0,android app
S70476,C1593,25/06/2024 22:47,2024-06-26 02:20:00,2.0,android app
S70477,C1256,2024-09-21 20:55:00,2024-09-21 23:50:00,4.0,mobile
S70478,C1749,10/01/2024 06:04,2024-01-10 09:16:00,10.0,android
S70479,C1097,2023-04-23 11:17:00,2023-04-23 13:59:00,3.0,android
S70480,C1513,2025-03-04 21:57:00,2025-03-05 00:27:00,1.0,web
S70481,C1369,2023-09-04 18:30:00,2023-09-04 21:42:00,,desktop
S70482,C1281,11/07/2024 03:23,2024-07-11 04:19:00,3.0,android app
S70483,C1349,2024-05-11 07:16:00,2024-05-11 09:20:00,3.0,ios
S70484,C1376,2023-03-30 10:37:00,2023-03-30 11:10:00,5.0,desktop
S70485,C1284,2023-03-28 00:43:00,2023-03-28 02:20:00,10.0,mobile
S70486,C1065,2024-01-22 13:00:00,2024-01-22 16:23:00,5.0,web
S70487,C1552,27/05/2024 13:54,2024-05-27 14:09:00,10.0,android
S70488,C1627,07/07/2023 07:45,,3.0,android
S70489,C1168,2024-01-25 11:03:00,2024-01-25 11:51:00,1.0,desktop
S70490,C1325,2023-10-24 12:02:00,2023-10-24 14:27:00,4.0,web
S70491,C1551,25/05/2023 13:58,2023-05-25 16:22:00,5.0,desktop
S70492,C1542,2024-10-30 05:51:00,2024-10-30 09:08:00,10.0,android
S70493,C1244,2023-05-27 09:55:00,2023-05-27 11:39:00,4.0,android
S70494,C1087,21/05/2024 17:40,2024-05-21 20:23:00,2.0,desktop
S70495,C1267,11/09/2024 04:09,,4.0,android
S70496,C1784,11/12/2023 03:40,2023-12-11 05:45:00,5.0,desktop
S70497,C1003,2025-03-11 17:44:00,2025-03-11 18:03:00,3.0,android app
S70498,C1052,30/05/2023 13:41,2023-05-30 17:32:00,5.0,web
S70499,C1237,12/04/2023 07:21,2023-04-12 09:39:00,5.0,web
S70500,C1355,14/02/2023 13:08,2023-02-14 13:44:00,5.0,android app
S70501,C1411,2023-03-08 01:33:00,2023-03-08 03:40:00,3.0,android
S70502,C1230,24/10/2023 01:04,2023-10-24 02:08:00,5.0,android app
S70503,C1028,2023-11-27 15:54:00,,1.0,android
S70504,C1207,2024-09-20 18:31:00,2024-09-20 20:13:00,2.0,android
S70505,C1162,2024-10-29 00:25:00,2024-10-29 02:32:00,4.0,android app
S70506,C1517,2023-05-20 22:39:00,2023-05-21 02:09:00,1.0,ios
S70507,C1154,20/06/2024 02:02,2024-06-20 02:02:00,,web
S70508,C1441,31/07/2024 19:30,2024-07-31 22:14:00,1.0,android app
S70509,C1486,2024-10-19 11:11:00,2024-10-19 11:11:00,1.0,android
S70510,C1195,08/03/2024 16:25,2024-03-08 17:33:00,,mobile
S70511,C1334,2024-03-04 11:03:00,2024-03-04 13:46:00,10.0,android app
S70512,C1683,2024-06-30 06:26:00,2024-06-30 09:16:00,2.0,desktop
S70513,C1310,19/07/2024 02:48,2024-07-19 03:15:00,3.0,android app
S70514,C1627,05/02/2024 17:59,2024-02-05 21:45:00,10.0,android app
S70515,C1009,20/11/2024 05:07,2024-11-20 06:49:00,5.0,web
S70516,C1315,2023-10-25 01:28:00,2023-10-25 03:43:00,3.0,ios
S70517,C1457,2023-08-20 15:12:00,2023-08-20 18:13:00,1.0,web
S70518,C1593,2023-02-25 16:43:00,2023-02-25 19:35:00,10.0,android
S70519,C1773,09/04/2024 02:59,2024-04-09 06:13:00,2.0,ios
S70520,C1559,15/10/2023 06:37,2023-10-15 07:41:00,10.0,mobile
S70521,C1389,19/01/2023 06:39,2023-01-19 09:19:00,10.0,android app
S70522,C1368,2023-01-11 19:57:00,2023-01-11 22:45:00,1.0,web
S70523,C1453,08/06/2023 00:58,2023-06-08 04:46:00,3.0,web
S70524,C1102,23/02/2023 10:54,2023-02-23 10:59:00,4.0,desktop
S70525,C1436,26/01/2025 21:25,2025-01-26 21:55:00,3.0,desktop
S70526,C1515,01/07/2023 12:50,2023-07-01 14:33:00,1.0,android
S70527,C1598,2023-02-10 15:00:00,2023-02-10 18:22:00,4.0,desktop
S70528,C1730,09/10/2024 05:41,2024-10-09 06:16:00,,android app
S70529,C1447,2023-10-19 15:18:00,2023-10-19 17:17:00,3.0,ios
S70530,C1669,09/06/2024 10:57,2024-06-09 14:55:00,1.0,desktop
S70531,C1142,2024-10-30 14:39:00,2024-10-30 15:59:00,4.0,mobile
S70532,C1094,19/06/2024 22:34,2024-06-20 01:03:00,1.0,android
S70533,C1199,2024-06-26 19:10:00,2024-06-26 22:25:00,10.0,web
S70534,C1151,06/03/2023 07:10,,10.0,ios
S70535,C1798,17/04/2024 07:34,2024-04-17 10:13:00,4.0,android app
S70536,C1756,01/05/2023 10:11,2023-05-01 12:58:00,1.0,android
S70537,C1375,06/06/2023 19:50,,3.0,mobile
S70538,C1061,01/08/2023 05:08,,2.0,mobile
S70539,C1537,11/08/2024 14:42,2024-08-11 15:57:00,,android
S70540,C1427,2024-11-26 05:49:00,2024-11-26 07:12:00,4.0,mobile
S70541,C1176,02/12/2023 08:02,2023-12-02 11:15:00,,ios
S70542,C1552,2023-04-25 09:37:00,2023-04-25 12:50:00,10.0,mobile
S70543,C1417,2024-11-17 21:15:00,2024-11-18 00:47:00,4.0,ios
S70544,C1549,17/07/2024 21:54,2024-07-17 23:44:00,3.0,desktop
S70545,C1321,30/10/2023 15:49,2023-10-30 16:19:00,3.0,android
S70546,C1395,2024-01-12 09:15:00,2024-01-12 10:32:00,4.0,android
S70547,C1299,18/10/2024 02:32,2024-10-18 05:32:00,4.0,ios
S70548,C1640,2024-07-03 12:50:00,2024-07-03 14:53:00,4.0,android
S70549,C1215,2023-11-15 11:38:00,2023-11-15 13:15:00,3.0,android
S70550,C1305,2023-10-02 14:34:00,2023-10-02 15:26:00,1.0,web
S70551,C1448,23/02/2023 01:30,2023-02-23 02:52:00,3.0,android app
S70552,C1395,06/10/2024 18:11,2024-10-06 19:13:00,3.0,mobile
S70553,C1051,24/01/2025 08:48,2025-01-24 10:36:00,5.0,android
S70554,C1701,14/03/2024 06:25,2024-03-14 08:49:00,3.0,desktop
S70555,C1696,2024-02-25 19:53:00,2024-02-25 21:58:00,3.0,android app
S70556,C1536,2024-06-19 07:30:00,2024-06-19 08:38:00,,web
S70557,C1551,25/12/2023 11:40,2023-12-25 12:54:00,3.0,web
S70558,C1179,2024-10-27 11:41:00,2024-10-27 14:46:00,4.0,mobile
S70559,C1215,18/01/2023 08:53,2023-01-18 10:51:00,1.0,ios
S70560,C1020,2023-12-11 17:15:00,2023-12-11 18:35:00,10.0,web
S70561,C1590,06/07/2024 15:23,2024-07-06 17:31:00,1.0,android
S70562,C1174,2023-02-09 00:55:00,2023-02-09 01:20:00,2.0,android
S70563,C1370,29/01/2025 15:47,2025-01-29 19:21:00,,android app
S70564,C1557,20/04/2024 01:39,2024-04-20 03:03:00,3.0,android
S70565,C1449,2024-08-18 01:46:00,2024-08-18 02:26:00,5.0,android
S70566,C1181,2023-07-12 03:28:00,2023-07-12 06:13:00,2.0,mobile
S70567,C1533,29/05/2023 03:40,2023-05-29 06:20:00,2.0,android app
S70568,C1612,2023-03-21 07:49:00,2023-03-21 10:34:00,5.0,ios
S70569,C1666,07/01/2024 18:45,2024-01-07 22:27:00,4.0,desktop
S70570,C1655,2024-05-27 00:18:00,2024-05-27 02:26:00,1.0,web
S70571,C1296,17/07/2023 06:15,2023-07-17 07:46:00,4.0,desktop
S70572,C1404,23/04/2023 11:43,2023-04-23 12:53:00,,mobile
S70573,C1478,2024-03-06 18:26:00,2024-03-06 21:53:00,3.0,android
S70574,C1680,28/09/2023 00:07,2023-09-28 00:02:00,,android
S70575,C1218,19/02/2023 02:19,2023-02-19 04:48:00,2.0,ios
S70576,C1402,20/02/2024 00:05,2024-02-20 01:06:00,2.0,desktop
S70577,C1214,2024-09-24 21:12:00,2024-09-25 00:24:00,3.0,ios
S70578,C1079,2023-08-02 10:11:00,2023-08-02 12:40:00,2.0,desktop
S70579,C1406,08/01/2023 13:10,2023-01-08 15:07:00,4.0,desktop
S70580,C1207,28/06/2023 12:03,2023-06-28 14:14:00,5.0,mobile
S70581,C1249,2024-12-04 18:13:00,2024-12-04 19:54:00,1.0,ios
S70582,C1016,2023-03-21 12:47:00,2023-03-21 13:05:00,10.0,android
S70583,C1567,2023-10-10 04:48:00,2023-10-10 08:09:00,4.0,ios
S70584,C1300,31/01/2024 12:53,2024-01-31 15:54:00,3.0,android
S70585,C1396,21/08/2023 07:07,2023-08-21 09:20:00,3.0,mobile
S70586,C1042,2024-01-24 03:18:00,2024-01-24 05:51:00,4.0,desktop
S70587,C1105,23/02/2023 17:09,2023-02-23 20:09:00,1.0,desktop
S70588,C1480,14/07/2023 03:00,2023-07-14 05:19:00,10.0,web
S70589,C1161,2023-03-07 15:05:00,2023-03-07 15:07:00,,android app
S70590,C1762,08/12/2024 14:07,2024-12-08 14:18:00,2.0,ios
S70591,C1403,08/09/2024 18:18,,3.0,desktop
S70592,C1155,2023-11-21 14:58:00,2023-11-21 16:09:00,1.0,mobile
S70593,C1526,26/01/2025 08:02,2025-01-26 11:21:00,5.0,android app
S70594,C1787,09/12/2023 03:38,2023-12-09 06:12:00,3.0,android
S70595,C1014,2024-11-12 20:36:00,2024-11-13 00:32:00,4.0,ios
S70596,C1241,2024-01-06 00:35:00,2024-01-06 02:05:00,5.0,web
S70597,C1212,17/03/2023 19:57,2023-03-17 21:38:00,5.0,web
S70598,C1717,27/12/2024 00:00,2024-12-27 02:01:00,5.0,mobile
S70599,C1414,14/02/2025 10:26,2025-02-14 11:14:00,1.0,android
S70600,C1319,2025-02-28 14:51:00,2025-02-28 15:47:00,3.0,android
S70601,C1623,2023-08-27 20:22:00,2023-08-27 20:44:00,2.0,desktop
S70602,C1050,2023-06-11 13:14:00,2023-06-11 16:19:00,3.0,android app
S70603,C1527,09/01/2024 19:23,2024-01-09 20:02:00,2.0,mobile
S70604,C1290,2023-03-31 15:51:00,2023-03-31 18:43:00,5.0,web
S70605,,18/03/2024 07:23,2024-03-18 08:04:00,3.0,android app
S70606,C1683,2023-07-06 08:07:00,2023-07-06 10:09:00,1.0,web
S70607,C1511,2023-09-03 20:01:00,2023-09-03 20:41:00,,desktop
S70608,C1288,2023-06-03 22:11:00,2023-06-04 01:23:00,2.0,android app
S70609,C1584,23/06/2024 12:30,2024-06-23 15:45:00,3.0,android
S70610,C1082,2023-04-11 01:25:00,2023-04-11 04:50:00,4.0,mobile
S70611,C1646,29/02/2024 10:47,2024-02-29 13:41:00,1.0,mobile
S70612,C1092,09/03/2024 00:10,2024-03-09 02:03:00,3.0,desktop
S70613,C1443,2023-10-29 18:10:00,2023-10-29 18:13:00,2.0,android
S70614,C1245,17/07/2023 11:56,2023-07-17 12:02:00,4.0,web
S70615,C1260,01/04/2024 14:28,2024-04-01 18:01:00,4.0,ios
S70616,C1667,2023-10-22 02:42:00,2023-10-22 03:52:00,3.0,mobile
S70617,C1724,05/11/2023 18:02,2023-11-05 20:51:00,4.0,web
S70618,C1227,12/01/2024 15:05,2024-01-12 18:46:00,10.0,ios
S70619,C1696,2024-05-25 10:12:00,2024-05-25 11:00:00,2.0,desktop
S70620,C1035,04/06/2023 04:45,2023-06-04 05:51:00,1.0,desktop
S70621,C1234,22/05/2024 21:39,2024-05-22 22:19:00,5.0,android
S70622,C1097,24/09/2024 15:44,2024-09-24 17:45:00,1.0,mobile
S70623,C1062,2024-11-24 11:10:00,2024-11-24 11:29:00,3.0,desktop
S70624,C1730,08/02/2024 03:20,2024-02-08 03:37:00,3.0,desktop
S70625,C1706,2024-06-23 14:58:00,2024-06-23 17:59:00,2.0,android app
S70626,C1100,19/06/2024 19:45,2024-06-19 20:04:00,4.0,mobile
S70627,C1397,2024-06-20 19:51:00,2024-06-20 22:37:00,4.0,android
S70628,C1421,01/01/2025 03:25,2025-01-01 04:27:00,10.0,desktop
S70629,C1240,2025-01-16 17:55:00,2025-01-16 19:09:00,5.0,android app
S70630,C1787,13/09/2023 03:30,2023-09-13 03:38:00,10.0,mobile
S70631,C1384,19/04/2023 10:55,2023-04-19 11:52:00,3.0,android app
S70632,C1441,2023-04-27 02:04:00,2023-04-27 02:38:00,2.0,android app
S70633,C1183,2023-09-22 05:46:00,,3.0,desktop
S70634,C1769,27/09/2023 03:10,2023-09-27 06:30:00,,mobile
S70635,C1147,2023-10-27 22:51:00,,4.0,web
S70636,C1536,2024-05-27 09:23:00,2024-05-27 10:15:00,5.0,web
S70637,C1280,09/11/2023 13:28,,3.0,desktop
S70638,C1371,11/08/2023 02:58,2023-08-11 05:27:00,2.0,ios
S70639,C1325,2024-11-19 06:28:00,2024-11-19 09:05:00,2.0,mobile
S70640,C1313,18/03/2023 23:30,2023-03-19 01:34:00,4.0,web
S70641,C1074,2025-01-01 08:05:00,2025-01-01 09:47:00,5.0,desktop
S70642,C1297,2024-08-10 00:43:00,2024-08-10 02:03:00,3.0,android app
S70643,C1768,2024-02-24 12:38:00,2024-02-24 14:43:00,3.0,android
S70644,C1002,2023-11-25 09:57:00,2023-11-25 12:06:00,,mobile
S70645,C1546,22/11/2023 20:03,2023-11-22 23:44:00,2.0,android
S70646,C1650,2024-07-09 11:30:00,2024-07-09 13:17:00,3.0,android
S70647,C1339,28/01/2025 00:12,2025-01-28 02:35:00,5.0,web
S70648,C1464,18/09/2023 00:57,,3.0,desktop
S70649,C1630,06/05/2023 20:50,2023-05-06 23:47:00,2.0,mobile
S70650,C1387,03/04/2023 15:25,2023-04-03 15:20:00,4.0,android
S70651,C1155,02/04/2023 14:01,2023-04-02 14:28:00,4.0,desktop
S70652,C1166,2024-02-01 03:13:00,2024-02-01 05:35:00,10.0,android app
S70653,C1588,2024-10-27 01:07:00,,3.0,ios
S70654,C1360,2023-04-17 21:08:00,2023-04-17 22:37:00,1.0,web
S70655,C1077,2024-04-07 06:34:00,2024-04-07 07:49:00,1.0,android app
S70656,C1782,15/08/2023 02:42,2023-08-15 06:11:00,4.0,android app
S70657,C1106,2024-06-18 20:53:00,2024-06-18 23:00:00,5.0,android
S70658,C1649,27/10/2024 02:29,2024-10-27 05:35:00,1.0,desktop
S70659,C1001,16/06/2023 00:15,2023-06-16 02:26:00,4.0,android
S70660,C1523,2023-11-22 15:37:00,2023-11-22 18:54:00,10.0,desktop
S70661,C1319,2024-01-25 11:53:00,2024-01-25 12:29:00,2.0,mobile
S70662,C1539,2024-03-08 08:00:00,2024-03-08 08:05:00,3.0,mobile
S70663,C1437,01/02/2023 02:36,,4.0,mobile
S70664,C1081,2023-03-07 21:49:00,2023-03-08 00:10:00,1.0,web
S70665,C1037,2024-10-27 23:58:00,2024-10-28 03:31:00,5.0,ios
S70666,C1391,2023-11-21 09:54:00,2023-11-21 10:14:00,10.0,mobile
S70667,C1748,2023-05-13 12:46:00,2023-05-13 13:42:00,3.0,android
S70668,C1792,2023-02-28 22:57:00,2023-03-01 01:43:00,,web
S70669,C1424,24/03/2024 17:52,2024-03-24 20:50:00,2.0,web
S70670,C1765,02/06/2023 09:04,2023-06-02 09:38:00,5.0,ios
S70671,C1044,2023-05-06 13:55:00,2023-05-06 17:18:00,2.0,mobile
S70672,C1757,2023-10-14 06:17:00,2023-10-14 07:57:00,10.0,web
S70673,C1675,19/02/2025 22:11,2025-02-20 01:09:00,,mobile
S70674,,2023-11-07 21:45:00,2023-11-08 01:38:00,3.0,android app
S70675,C1061,2023-03-13 03:16:00,2023-03-13 04:17:00,10.0,android
S70676,C1187,2024-04-29 10:56:00,2024-04-29 12:04:00,2.0,web
S70677,C1398,26/10/2023 21:25,2023-10-27 00:16:00,2.0,desktop
S70678,C1006,2024-03-22 04:17:00,2024-03-22 04:18:00,1.0,mobile
S70679,C1303,09/02/2025 16:09,2025-02-09 18:18:00,5.0,mobile
S70680,C1428,10/05/2023 07:53,2023-05-10 10:40:00,2.0,android app
S70681,C1605,2023-03-05 20:27:00,2023-03-05 21:47:00,1.0,desktop
S70682,C1018,28/10/2023 04:47,2023-10-28 06:47:00,5.0,web
S70683,C1652,2023-03-17 02:27:00,2023-03-17 03:21:00,3.0,mobile
S70684,C1106,2024-06-07 08:25:00,2024-06-07 10:54:00,3.0,ios
S70685,C1452,26/02/2023 07:33,2023-02-26 11:28:00,4.0,ios
S70686,C1268,2024-09-03 11:06:00,2024-09-03 12:12:00,10.0,desktop
S70687,C1627,04/10/2024 22:21,2024-10-05 00:00:00,10.0,ios
S70688,C1675,2024-09-20 04:15:00,2024-09-20 05:23:00,1.0,android
S70689,C1343,13/10/2023 22:27,2023-10-14 02:11:00,,android
S70690,C1204,05/02/2024 10:09,2024-02-05 12:01:00,5.0,android app
S70691,C1523,2023-03-08 15:18:00,2023-03-08 15:30:00,3.0,web
S70692,C1649,10/03/2024 08:20,2024-03-10 08:15:00,10.0,ios
S70693,C1639,2023-07-12 07:06:00,,1.0,ios
S70694,C1108,19/03/2024 08:37,2024-03-19 12:30:00,2.0,ios
S70695,C1736,2023-11-19 00:27:00,2023-11-19 02:26:00,2.0,web
S70696,C1388,2023-02-04 10:41:00,2023-02-04 12:01:00,4.0,ios
S70697,C1137,22/10/2023 03:06,2023-10-22 03:42:00,4.0,web
S70698,C1319,08/12/2024 06:30,2024-12-08 10:23:00,,mobile
S70699,C1284,30/10/2024 03:59,2024-10-30 06:24:00,2.0,android app
S70700,C1074,2023-08-18 20:43:00,2023-08-18 23:11:00,10.0,android
S70701,C1024,2023-10-25 20:27:00,2023-10-25 23:23:00,4.0,ios
S70702,C1426,30/01/2025 07:40,2025-01-30 10:40:00,10.0,mobile
S70703,C1398,2023-04-18 21:00:00,2023-04-18 21:44:00,5.0,mobile
S70704,C1641,23/05/2024 17:38,2024-05-23 19:23:00,2.0,android
S70705,C1503,2024-12-01 01:40:00,2024-12-01 02:22:00,2.0,android
S70706,C1558,10/05/2024 17:27,2024-05-10 18:12:00,5.0,desktop
S70707,C1557,13/08/2024 21:47,2024-08-13 22:32:00,5.0,android app
S70708,C1294,2023-11-25 14:47:00,2023-11-25 15:23:00,2.0,android app
S70709,C1327,2024-01-20 01:07:00,2024-01-20 01:09:00,4.0,mobile
S70710,C1481,24/07/2024 16:14,2024-07-24 16:16:00,,android
S70711,C1226,15/01/2023 08:06,2023-01-15 09:15:00,,web
S70712,C1151,13/12/2024 21:20,2024-12-14 00:10:00,1.0,android app
S70713,C1077,2024-10-11 08:40:00,2024-10-11 09:18:00,3.0,android app
S70714,C1440,18/10/2023 15:19,2023-10-18 16:01:00,5.0,mobile
S70715,C1357,2024-05-25 07:15:00,2024-05-25 08:44:00,4.0,ios
S70716,C1057,01/10/2023 22:14,2023-10-02 00:22:00,10.0,desktop
S70717,C1181,2024-01-16 20:53:00,2024-01-16 23:15:00,10.0,mobile
S70718,C1699,2024-10-30 19:30:00,2024-10-30 22:23:00,10.0,android app
S70719,C1280,12/09/2023 13:48,,4.0,mobile
S70720,C1156,2024-09-09 15:02:00,2024-09-09 17:34:00,10.0,mobile
S70721,C1216,07/04/2023 21:27,2023-04-08 01:26:00,4.0,android app
S70722,C1792,29/05/2024 11:09,2024-05-29 15:00:00,2.0,android app
S70723,C1537,2024-01-07 07:04:00,2024-01-07 10:26:00,10.0,mobile
S70724,C1585,12/11/2024 22:30,2024-11-13 00:38:00,4.0,android
S70725,C1199,2023-11-24 01:16:00,2023-11-24 03:40:00,3.0,android
S70726,C1354,05/01/2023 18:13,2023-01-05 21:59:00,,android
S70727,C1272,2024-04-30 00:05:00,,2.0,web
S70728,C1760,2025-02-04 03:33:00,2025-02-04 06:38:00,3.0,android app
S70729,C1260,02/12/2023 19:25,2023-12-02 20:52:00,5.0,android app
S70730,C1014,24/07/2024 18:44,2024-07-24 21:38:00,2.0,android app
S70731,C1471,2024-04-03 08:41:00,2024-04-03 10:38:00,2.0,mobile
S70732,C1078,2023-01-19 23:39:00,2023-01-20 02:32:00,10.0,mobile
S70733,C1069,2024-01-03 05:36:00,,4.0,web
S70734,C1657,2023-01-22 10:46:00,2023-01-22 14:24:00,1.0,android
S70735,C1015,03/11/2024 11:02,2024-11-03 14:25:00,3.0,android
S70736,C1703,05/09/2024 11:30,2024-09-05 13:05:00,10.0,ios
S70737,C1475,07/08/2024 04:32,2024-08-07 07:31:00,10.0,android app
S70738,C1774,11/03/2023 16:17,2023-03-11 18:50:00,1.0,android app
S70739,C1175,2024-04-02 23:09:00,2024-04-03 02:13:00,3.0,desktop
S70740,C1631,2024-02-04 12:32:00,2024-02-04 13:59:00,1.0,android
S70741,C1528,20/02/2023 12:13,2023-02-20 13:45:00,5.0,mobile
S70742,C1383,28/01/2025 19:38,2025-01-28 20:08:00,4.0,desktop
S70743,C1024,2024-10-12 05:18:00,,2.0,android app
S70744,C1172,20/03/2023 13:40,2023-03-20 16:28:00,10.0,android app
S70745,C1249,2023-04-08 02:38:00,2023-04-08 05:15:00,10.0,desktop
S70746,C1677,2023-12-21 08:02:00,2023-12-21 10:37:00,1.0,web
S70747,C1674,07/12/2024 23:46,2024-12-07 23:56:00,,android app
S70748,C1026,2024-10-13 12:11:00,2024-10-13 13:51:00,2.0,desktop
S70749,C1354,2025-01-27 15:32:00,2025-01-27 15:45:00,2.0,ios
S70750,C1654,2024-10-23 19:01:00,2024-10-23 20:50:00,4.0,desktop
S70751,C1767,2024-06-06 17:47:00,2024-06-06 21:03:00,10.0,android
S70752,C1031,02/02/2025 20:03,2025-02-03 00:01:00,1.0,desktop
S70753,C1435,2024-02-08 16:51:00,2024-02-08 18:28:00,3.0,ios
S70754,C1444,26/07/2023 02:48,,2.0,ios
S70755,C1455,06/05/2023 04:42,2023-05-06 05:20:00,,android app
S70756,C1096,2023-05-01 14:59:00,2023-05-01 16:17:00,,mobile
S70757,C1258,19/08/2024 10:38,2024-08-19 11:12:00,1.0,ios
S70758,C1553,23/05/2023 17:09,2023-05-23 20:41:00,10.0,desktop
S70759,C1347,08/03/2025 05:13,2025-03-08 06:52:00,10.0,web
S70760,C1239,2023-09-05 02:11:00,2023-09-05 03:02:00,3.0,web
S70761,C1227,2023-12-04 12:31:00,2023-12-04 16:17:00,,mobile
S70762,C1672,25/05/2024 04:22,2024-05-25 05:45:00,2.0,desktop
S70763,C1203,2023-01-03 22:45:00,2023-01-04 02:03:00,1.0,web
S70764,C1794,08/08/2023 16:54,2023-08-08 18:14:00,10.0,ios
S70765,C1124,19/12/2023 13:07,2023-12-19 15:48:00,1.0,android
S70766,C1511,10/03/2024 05:44,2024-03-10 08:47:00,3.0,mobile
S70767,C1782,16/04/2024 22:07,2024-04-17 02:04:00,1.0,desktop
S70768,C1082,2023-09-25 02:12:00,2023-09-25 02:48:00,3.0,mobile
S70769,C1260,13/10/2023 05:31,2023-10-13 08:43:00,4.0,android app
S70770,C1466,30/10/2024 22:31,2024-10-30 23:38:00,4.0,android
S70771,C1588,13/07/2023 04:12,2023-07-13 05:58:00,4.0,desktop
S70772,C1778,20/11/2023 20:31,2023-11-20 22:03:00,3.0,android app
S70773,C1324,27/08/2023 22:31,2023-08-28 00:11:00,10.0,mobile
S70774,C1365,18/09/2023 05:58,,10.0,desktop
S70775,C1261,14/04/2023 21:57,,5.0,web
S70776,C1753,2023-11-13 23:09:00,2023-11-14 02:11:00,1.0,desktop
S70777,C1067,2023-01-13 19:16:00,,2.0,android app
S70778,C1174,09/07/2023 01:28,2023-07-09 02:37:00,5.0,web
S70779,C1576,31/08/2024 07:57,2024-08-31 10:27:00,10.0,android app
S70780,C1565,2024-05-07 08:07:00,2024-05-07 08:28:00,1.0,desktop
S70781,C1711,2024-01-14 20:32:00,2024-01-14 21:45:00,10.0,android
S70782,C1169,11/04/2024 02:39,2024-04-11 02:40:00,3.0,android app
S70783,C1299,26/12/2024 19:18,2024-12-26 22:44:00,1.0,desktop
S70784,C1771,27/05/2023 10:03,2023-05-27 13:03:00,1.0,ios
S70785,C1776,09/11/2024 10:36,2024-11-09 11:20:00,10.0,web
S70786,C1592,20/05/2023 21:54,2023-05-21 01:15:00,3.0,android
S70787,C1182,04/12/2023 07:55,2023-12-04 07:57:00,3.0,android
S70788,C1160,2024-10-18 00:55:00,2024-10-18 00:54:00,10.0,ios
S70789,C1005,2025-02-23 18:23:00,2025-02-23 22:05:00,3.0,web
S70790,,2024-01-03 22:54:00,2024-01-03 23:04:00,4.0,web
S70791,C1184,2025-01-26 21:35:00,2025-01-26 22:40:00,10.0,mobile
S70792,C1519,2024-05-18 15:38:00,2024-05-18 18:57:00,3.0,android app
S70793,C1687,2024-12-24 19:14:00,2024-12-24 20:04:00,1.0,android app
S70794,C1562,2024-02-09 09:42:00,2024-02-09 11:48:00,4.0,android
S70795,C1073,2023-07-06 15:13:00,2023-07-06 16:47:00,4.0,web
S70796,C1365,2024-04-16 18:22:00,2024-04-16 20:10:00,,android app
S70797,,2024-04-09 04:14:00,2024-04-09 05:17:00,1.0,android app
S70798,C1669,17/06/2024 23:40,2024-06-18 01:03:00,1.0,android app
S70799,C1185,12/04/2023 13:43,2023-04-12 16:03:00,3.0,web
S70800,C1048,2023-03-15 04:37:00,2023-03-15 05:05:00,4.0,ios
S70801,C1521,02/06/2023 02:15,2023-06-02 02:49:00,1.0,android app
S70802,C1600,2023-11-25 03:06:00,2023-11-25 05:19:00,4.0,web
S70803,C1696,2024-11-06 20:04:00,2024-11-06 21:24:00,1.0,web
S70804,C1362,03/09/2023 20:13,2023-09-03 23:09:00,4.0,mobile
S70805,C1142,21/02/2023 03:01,2023-02-21 04:56:00,,web
S70806,C1113,2024-05-01 10:12:00,2024-05-01 13:19:00,3.0,android
S70807,C1451,17/01/2024 21:02,2024-01-17 21:25:00,1.0,ios
S70808,C1401,02/07/2023 08:25,2023-07-02 11:59:00,4.0,android app
S70809,C1560,13/08/2024 08:33,,3.0,desktop
S70810,C1003,05/03/2025 09:45,2025-03-05 10:27:00,3.0,android app
S70811,C1123,19/01/2025 03:10,2025-01-19 06:42:00,10.0,web
S70812,C1161,2023-08-05 04:52:00,2023-08-05 06:54:00,1.0,mobile
S70813,C1427,16/01/2025 04:11,2025-01-16 05:58:00,2.0,android app
S70814,C1621,2023-08-22 05:58:00,2023-08-22 08:12:00,10.0,android app
S70815,C1440,2023-02-04 17:30:00,2023-02-04 20:30:00,10.0,mobile
S70816,C1170,13/09/2023 16:48,2023-09-13 16:48:00,5.0,android
S70817,C1342,2023-11-26 22:55:00,2023-11-27 02:12:00,1.0,desktop
S70818,C1046,30/04/2024 01:49,2024-04-30 04:36:00,5.0,mobile
S70819,C1335,14/02/2025 23:36,2025-02-15 03:32:00,2.0,mobile
S70820,C1777,2023-11-08 06:37:00,2023-11-08 06:57:00,10.0,web
S70821,C1058,2023-04-18 07:30:00,2023-04-18 09:54:00,10.0,desktop
S70822,C1488,2023-01-13 16:22:00,2023-01-13 17:17:00,,web
S70823,C1754,29/07/2024 14:33,2024-07-29 16:59:00,1.0,desktop
S70824,C1233,2023-07-30 15:39:00,2023-07-30 18:51:00,1.0,web
S70825,C1729,23/06/2023 03:14,2023-06-23 05:45:00,10.0,android
S70826,C1139,2023-04-25 13:52:00,2023-04-25 17:20:00,10.0,android
S70827,C1285,2025-01-28 17:11:00,2025-01-28 20:07:00,1.0,android
S70828,C1767,24/05/2023 12:41,2023-05-24 15:35:00,,desktop
S70829,C1614,2023-02-25 16:00:00,2023-02-25 18:08:00,4.0,android app
S70830,C1064,24/09/2024 19:13,2024-09-24 20:33:00,10.0,android
S70831,C1237,2024-04-02 02:23:00,2024-04-02 03:23:00,5.0,mobile
S70832,C1615,20/04/2023 19:14,2023-04-20 20:16:00,10.0,mobile
S70833,C1302,18/03/2023 14:53,2023-03-18 16:12:00,,web
S70834,C1244,10/07/2024 09:17,2024-07-10 11:01:00,3.0,desktop
S70835,C1055,2025-01-01 19:34:00,2025-01-01 20:31:00,5.0,desktop
S70836,C1252,26/07/2024 07:34,2024-07-26 10:01:00,,ios
S70837,C1704,2023-01-04 06:28:00,2023-01-04 10:11:00,3.0,android
S70838,C1768,15/10/2024 08:41,2024-10-15 08:57:00,1.0,android app
S70839,C1172,24/03/2024 23:51,2024-03-25 03:02:00,2.0,android
S70840,C1374,2023-08-25 17:07:00,2023-08-25 17:36:00,10.0,ios
S70841,C1046,09/04/2023 07:50,2023-04-09 08:54:00,2.0,web
S70842,C1759,02/08/2023 14:03,2023-08-02 16:04:00,4.0,ios
S70843,C1773,18/11/2024 08:36,2024-11-18 09:30:00,10.0,ios
S70844,C1172,30/09/2023 12:10,2023-09-30 14:14:00,1.0,web
S70845,C1498,2023-11-10 11:20:00,2023-11-10 13:25:00,10.0,mobile
S70846,C1256,2023-11-12 00:28:00,2023-11-12 00:36:00,5.0,android
S70847,C1614,2024-05-14 00:00:00,2024-05-14 02:37:00,3.0,web
S70848,C1406,2023-11-25 07:58:00,2023-11-25 11:33:00,2.0,mobile
S70849,C1155,2023-12-31 10:41:00,2023-12-31 11:00:00,3.0,ios
S70850,,2024-06-03 16:08:00,2024-06-03 16:17:00,5.0,mobile
S70851,C1245,2023-07-29 08:35:00,2023-07-29 11:52:00,4.0,ios
S70852,C1574,2025-01-10 03:42:00,2025-01-10 06:38:00,4.0,desktop
S70853,C1235,2023-05-08 16:01:00,2023-05-08 16:17:00,4.0,mobile
S70854,C1517,2024-11-14 17:51:00,2024-11-14 19:09:00,10.0,web
S70855,C1288,2023-07-03 18:41:00,2023-07-03 20:13:00,10.0,ios
S70856,C1302,2025-02-02 07:33:00,2025-02-02 10:22:00,5.0,ios
S70857,C1048,26/11/2023 01:51,2023-11-26 03:34:00,,web
S70858,C1776,20/05/2023 23:58,2023-05-21 03:30:00,1.0,android
S70859,C1695,2024-07-01 08:31:00,2024-07-01 11:18:00,2.0,android
S70860,C1237,2024-05-07 18:35:00,,5.0,mobile
S70861,C1493,2025-02-21 05:21:00,2025-02-21 08:07:00,4.0,ios
S70862,C1657,11/06/2024 15:47,2024-06-11 16:37:00,,ios
S70863,C1402,2023-12-29 07:29:00,,5.0,ios
S70864,C1363,2023-03-13 11:27:00,2023-03-13 14:47:00,2.0,mobile
S70865,C1263,2025-02-27 09:06:00,2025-02-27 11:33:00,10.0,android app
S70866,C1215,2023-11-25 07:13:00,,4.0,desktop
S70867,C1610,31/01/2025 01:28,2025-01-31 03:29:00,4.0,web
S70868,C1598,01/03/2025 00:24,2025-03-01 01:46:00,3.0,web
S70869,C1606,2024-02-25 13:43:00,2024-02-25 13:44:00,10.0,web
S70870,C1272,20/05/2024 01:41,2024-05-20 05:31:00,1.0,desktop
S70871,C1158,2024-11-09 22:25:00,2024-11-10 00:40:00,2.0,web
S70872,C1748,2023-08-07 07:05:00,2023-08-07 09:39:00,2.0,android app
S70873,C1575,13/04/2023 18:50,,10.0,android
S70874,C1775,2023-03-12 22:27:00,2023-03-13 01:54:00,1.0,android app
S70875,C1364,2024-12-14 02:06:00,2024-12-14 03:35:00,4.0,android app
S70876,C1755,27/08/2024 10:21,2024-08-27 10:35:00,5.0,android
S70877,C1537,2025-01-31 07:01:00,2025-01-31 10:14:00,1.0,mobile
S70878,C1019,2024-09-01 07:31:00,2024-09-01 09:12:00,1.0,ios
S70879,C1195,30/07/2023 23:07,,1.0,desktop
S70880,C1230,14/07/2023 08:43,2023-07-14 11:20:00,,android
S70881,C1026,28/02/2023 07:31,2023-02-28 07:36:00,4.0,ios
S70882,C1535,2024-05-19 19:04:00,2024-05-19 19:29:00,,desktop
S70883,C1420,22/04/2024 00:49,2024-04-22 03:53:00,3.0,android
S70884,C1655,2023-08-09 15:36:00,2023-08-09 16:24:00,4.0,ios
S70885,C1260,08/10/2024 20:13,2024-10-08 22:44:00,1.0,mobile
S70886,C1098,2023-01-29 13:06:00,2023-01-29 17:03:00,1.0,ios
S70887,C1294,05/07/2024 18:08,2024-07-05 20:27:00,,desktop
S70888,C1569,22/02/2023 00:18,2023-02-22 00:43:00,,ios
S70889,C1421,2024-01-15 16:08:00,2024-01-15 17:28:00,3.0,web
S70890,C1671,16/02/2023 15:09,2023-02-16 17:54:00,,web
S70891,C1251,09/04/2023 12:11,2023-04-09 15:37:00,4.0,android app
S70892,C1131,04/10/2023 14:44,2023-10-04 15:29:00,10.0,web
S70893,C1604,02/11/2023 04:19,2023-11-02 06:08:00,3.0,desktop
S70894,C1664,2024-03-17 17:17:00,2024-03-17 20:52:00,2.0,mobile
S70895,C1047,2024-05-04 07:09:00,2024-05-04 07:17:00,10.0,android
S70896,C1527,2024-01-04 10:03:00,2024-01-04 12:21:00,4.0,web
S70897,C1326,25/02/2025 13:21,2025-02-25 17:18:00,5.0,web
S70898,C1020,2023-05-18 18:42:00,2023-05-18 20:43:00,3.0,android
S70899,C1340,2024-09-12 00:21:00,2024-09-12 03:53:00,3.0,ios
S70900,C1058,2025-01-03 07:24:00,2025-01-03 08:53:00,,mobile
S70901,C1772,27/03/2024 19:40,2024-03-27 20:58:00,1.0,android app
S70902,C1278,03/05/2023 04:01,2023-05-03 06:45:00,10.0,ios
S70903,C1687,2024-04-06 05:58:00,2024-04-06 08:26:00,2.0,ios
S70904,C1523,2025-02-04 23:02:00,,1.0,mobile
S70905,C1507,2024-09-28 11:30:00,2024-09-28 13:44:00,1.0,desktop
S70906,C1676,15/07/2024 21:38,,4.0,android
S70907,C1108,2023-01-24 07:20:00,2023-01-24 07:15:00,1.0,web
S70908,C1342,13/12/2024 22:20,2024-12-13 22:51:00,,web
S70909,C1598,12/01/2023 17:06,2023-01-12 20:37:00,2.0,android app
S70910,C1028,05/08/2024 19:48,2024-08-05 23:11:00,,ios
S70911,C1322,29/02/2024 17:55,,10.0,android
S70912,C1120,2025-02-04 08:17:00,,4.0,android app
S70913,C1570,2023-11-26 13:20:00,2023-11-26 15:28:00,5.0,android app
S70914,C1128,2024-12-21 14:47:00,2024-12-21 16:24:00,4.0,web
S70915,C1216,14/12/2024 23:34,2024-12-15 01:36:00,4.0,android app
S70916,C1477,2025-03-09 02:52:00,2025-03-09 06:36:00,5.0,web
S70917,C1499,2025-01-16 14:16:00,2025-01-16 17:31:00,5.0,android app
S70918,C1174,2023-10-29 05:02:00,2023-10-29 07:57:00,4.0,desktop
S70919,C1107,19/11/2023 08:03,2023-11-19 12:03:00,10.0,mobile
S70920,C1060,13/10/2024 11:57,2024-10-13 12:35:00,4.0,desktop
S70921,C1629,2023-03-28 11:59:00,2023-03-28 13:47:00,2.0,ios
S70922,C1053,08/12/2024 21:20,2024-12-08 22:42:00,3.0,desktop
S70923,C1494,2024-03-05 15:51:00,2024-03-05 19:48:00,1.0,mobile
S70924,C1259,2023-10-15 00:36:00,2023-10-15 00:35:00,10.0,mobile
S70925,C1295,2023-06-28 01:07:00,2023-06-28 02:19:00,,ios
S70926,C1263,2025-01-16 12:41:00,2025-01-16 14:00:00,5.0,mobile
S70927,C1481,25/05/2024 10:38,2024-05-25 13:34:00,5.0,android
S70928,C1586,23/01/2025 19:43,2025-01-23 21:56:00,5.0,ios
S70929,C1707,06/09/2023 01:59,2023-09-06 05:37:00,5.0,android
S70930,C1237,25/01/2023 02:14,2023-01-25 05:46:00,2.0,desktop
S70931,C1581,2023-09-21 20:05:00,2023-09-21 21:10:00,3.0,mobile
S70932,C1109,07/11/2023 01:22,2023-11-07 01:33:00,5.0,web
S70933,C1708,25/01/2025 20:34,2025-01-25 22:47:00,3.0,android
S70934,C1073,23/02/2023 12:40,2023-02-23 12:56:00,,desktop
S70935,C1482,2024-05-05 00:36:00,2024-05-05 01:36:00,2.0,desktop
S70936,C1127,15/03/2023 08:50,2023-03-15 09:42:00,10.0,desktop
S70937,C1496,2023-10-06 13:22:00,2023-10-06 17:08:00,2.0,ios
S70938,C1257,2023-11-13 16:16:00,2023-11-13 18:56:00,1.0,android
S70939,C1731,2023-01-06 01:00:00,2023-01-06 01:10:00,5.0,android app
S70940,C1010,11/02/2023 09:02,2023-02-11 09:54:00,,desktop
S70941,C1030,24/01/2023 09:45,2023-01-24 10:58:00,4.0,ios
S70942,C1205,27/02/2024 08:54,2024-02-27 09:15:00,5.0,desktop
S70943,C1727,2024-01-03 08:39:00,2024-01-03 09:39:00,2.0,desktop
S70944,C1262,2024-04-18 12:33:00,2024-04-18 12:31:00,2.0,android app
S70945,C1365,2023-08-05 09:46:00,2023-08-05 10:23:00,10.0,ios
S70946,C1403,02/07/2024 14:22,2024-07-02 17:40:00,3.0,mobile
S70947,C1540,2023-06-24 11:26:00,2023-06-24 12:36:00,4.0,desktop
S70948,C1695,20/01/2023 09:57,2023-01-20 10:12:00,3.0,web
S70949,C1516,2024-07-18 18:38:00,2024-07-18 22:22:00,2.0,web
S70950,C1704,26/05/2023 09:25,2023-05-26 11:09:00,4.0,ios
S70951,C1283,11/03/2024 04:20,2024-03-11 07:45:00,5.0,android
S70952,C1542,30/03/2024 13:03,2024-03-30 13:20:00,1.0,ios
S70953,C1405,27/03/2023 06:33,2023-03-27 08:17:00,,android app
S70954,C1337,2023-02-10 22:30:00,2023-02-11 01:04:00,4.0,android
S70955,C1690,2024-09-08 10:47:00,2024-09-08 13:42:00,3.0,mobile
S70956,C1498,2023-03-23 02:32:00,2023-03-23 06:03:00,4.0,android app
S70957,C1772,25/04/2023 05:42,2023-04-25 08:50:00,5.0,mobile
S70958,C1213,20/04/2023 12:22,2023-04-20 13:41:00,3.0,desktop
S70959,C1490,01/07/2023 21:42,2023-07-01 21:47:00,10.0,desktop
S70960,C1300,17/01/2024 01:35,2024-01-17 02:45:00,10.0,android app
S70961,C1799,2024-11-22 03:23:00,,2.0,android
S70962,C1284,2024-08-02 10:38:00,2024-08-02 11:22:00,5.0,mobile
S70963,C1613,2023-01-24 09:15:00,2023-01-24 10:46:00,4.0,android
S70964,C1387,2023-04-22 10:01:00,2023-04-22 12:09:00,1.0,android app
S70965,C1414,2024-03-25 02:49:00,2024-03-25 04:59:00,4.0,web
S70966,C1386,2024-05-24 08:04:00,2024-05-24 11:01:00,4.0,android app
S70967,C1005,2024-10-09 13:43:00,2024-10-09 14:24:00,10.0,android
S70968,C1453,09/10/2023 15:51,2023-10-09 16:43:00,,web
S70969,C1138,2024-05-10 23:42:00,2024-05-11 03:36:00,2.0,web
S70970,C1224,01/02/2024 06:52,2024-02-01 08:46:00,5.0,web
S70971,C1403,27/02/2025 03:40,2025-02-27 06:58:00,3.0,desktop
S70972,C1387,2023-02-10 22:57:00,2023-02-11 00:59:00,5.0,ios
S70973,C1747,23/08/2023 05:44,2023-08-23 05:58:00,3.0,web
S70974,C1059,11/09/2023 03:37,2023-09-11 06:47:00,10.0,mobile
S70975,C1785,14/04/2024 12:30,2024-04-14 13:26:00,3.0,android app
S70976,C1299,2023-03-01 05:23:00,2023-03-01 07:53:00,5.0,mobile
S70977,C1481,11/11/2023 12:06,2023-11-11 14:46:00,10.0,android app
S70978,C1269,2024-02-28 16:16:00,2024-02-28 19:23:00,1.0,android
S70979,C1106,27/10/2023 08:24,2023-10-27 11:38:00,4.0,android
S70980,C1151,2024-08-30 13:18:00,2024-08-30 14:30:00,10.0,ios
S70981,C1006,2024-01-10 20:32:00,2024-01-10 23:28:00,3.0,mobile
S70982,C1571,2024-09-13 05:16:00,2024-09-13 05:17:00,4.0,android app
S70983,C1108,30/11/2024 09:05,2024-11-30 12:36:00,2.0,web
S70984,C1556,2024-11-11 17:14:00,2024-11-11 19:41:00,3.0,desktop
S70985,C1001,2023-07-09 16:57:00,2023-07-09 19:54:00,,web
S70986,C1197,02/03/2025 02:55,2025-03-02 04:39:00,4.0,ios
S70987,C1446,01/04/2023 07:55,2023-04-01 09:15:00,1.0,web
S70988,C1529,30/03/2024 20:08,2024-03-30 20:51:00,10.0,android app
S70989,C1608,06/10/2023 23:43,2023-10-07 03:30:00,,desktop
S70990,C1215,28/11/2024 08:49,2024-11-28 12:13:00,4.0,desktop
S70991,C1513,19/05/2024 22:38,2024-05-19 23:29:00,4.0,ios
S70992,C1654,2024-12-28 05:49:00,2024-12-28 07:23:00,1.0,android app
S70993,C1157,2024-08-15 14:47:00,2024-08-15 15:46:00,4.0,android app
S70994,C1364,2025-01-04 10:36:00,2025-01-04 12:02:00,,web
S70995,C1135,05/04/2023 22:54,2023-04-06 01:57:00,2.0,mobile
S70996,,2023-09-30 09:33:00,2023-09-30 11:19:00,4.0,desktop
S70997,C1546,2024-08-12 09:01:00,2024-08-12 10:06:00,5.0,desktop
S70998,C1694,2023-01-06 18:42:00,2023-01-06 21:36:00,3.0,desktop
S70999,C1599,13/11/2023 12:21,2023-11-13 13:33:00,5.0,android app
S71000,C1640,17/02/2025 17:16,2025-02-17 19:26:00,2.0,desktop
S71001,C1288,2024-02-19 07:56:00,2024-02-19 09:23:00,10.0,ios
S71002,C1004,16/08/2024 04:41,2024-08-16 04:51:00,,ios
S71003,C1313,05/02/2025 09:35,2025-02-05 13:12:00,4.0,web
S71004,C1221,29/01/2025 16:31,2025-01-29 19:17:00,3.0,web
S71005,C1594,2024-07-27 00:41:00,2024-07-27 01:54:00,1.0,desktop
S71006,C1252,03/05/2024 07:30,2024-05-03 10:56:00,10.0,android
S71007,C1792,11/02/2024 21:40,2024-02-11 23:20:00,10.0,android
S71008,C1373,20/11/2024 15:26,2024-11-20 19:12:00,,desktop
S71009,C1119,2023-09-18 18:30:00,2023-09-18 20:58:00,10.0,ios
S71010,C1411,2023-07-30 14:33:00,2023-07-30 16:22:00,5.0,mobile
S71011,C1018,2023-02-16 10:15:00,2023-02-16 12:32:00,4.0,ios
S71012,C1140,08/10/2023 04:22,2023-10-08 05:41:00,3.0,web
S71013,C1405,25/04/2023 18:06,2023-04-25 19:17:00,4.0,web
S71014,C1622,04/07/2024 14:07,2024-07-04 14:31:00,2.0,ios
S71015,C1792,09/03/2024 04:54,2024-03-09 08:33:00,1.0,mobile
S71016,C1725,2024-07-05 18:28:00,2024-07-05 21:43:00,2.0,ios
S71017,C1336,2023-11-10 14:27:00,2023-11-10 17:46:00,,desktop
S71018,C1494,2024-04-13 13:27:00,2024-04-13 14:49:00,2.0,android
S71019,C1451,2024-12-11 12:48:00,2024-12-11 15:33:00,4.0,ios
S71020,C1382,2023-02-28 22:39:00,2023-02-28 23:19:00,4.0,android app
S71021,C1135,25/03/2023 18:07,2023-03-25 19:29:00,10.0,android app
S71022,C1706,07/09/2024 06:57,,,android app
S71023,C1440,09/01/2024 05:24,2024-01-09 07:29:00,,android
S71024,C1428,2023-09-17 04:21:00,2023-09-17 06:10:00,3.0,android
S71025,C1574,13/08/2024 21:41,2024-08-13 22:36:00,4.0,desktop
S71026,C1296,17/09/2024 06:07,2024-09-17 10:02:00,2.0,mobile
S71027,C1572,04/04/2024 13:55,2024-04-04 17:29:00,5.0,android app
S71028,C1052,2024-08-16 15:54:00,2024-08-16 17:13:00,3.0,android app
S71029,C1222,16/01/2023 16:50,2023-01-16 18:26:00,3.0,android
S71030,C1682,30/12/2023 13:48,2023-12-30 16:41:00,2.0,android
S71031,C1758,2024-04-03 10:36:00,2024-04-03 13:47:00,10.0,web
S71032,C1101,30/04/2023 00:40,2023-04-30 02:58:00,10.0,desktop
S71033,C1437,2024-01-19 20:27:00,2024-01-19 23:39:00,10.0,android
S71034,C1201,2025-01-21 06:50:00,2025-01-21 08:39:00,1.0,android app
S71035,C1409,2025-01-21 18:41:00,2025-01-21 20:46:00,5.0,android app
S71036,C1481,18/11/2024 13:31,2024-11-18 14:03:00,,android
S71037,C1535,17/02/2023 21:19,2023-02-18 00:51:00,3.0,desktop
S71038,C1071,12/10/2023 14:30,2023-10-12 15:34:00,10.0,desktop
S71039,C1470,2024-05-07 03:17:00,2024-05-07 04:09:00,1.0,mobile
S71040,C1322,2023-02-04 11:51:00,2023-02-04 14:24:00,10.0,desktop
S71041,C1153,2024-04-06 14:59:00,2024-04-06 17:57:00,2.0,android
S71042,C1267,26/02/2023 04:23,2023-02-26 05:27:00,,mobile
S71043,C1663,06/02/2025 00:44,2025-02-06 00:54:00,2.0,android
S71044,C1566,2023-03-29 11:23:00,2023-03-29 14:34:00,3.0,android
S71045,C1068,16/10/2023 08:39,2023-10-16 09:51:00,10.0,ios
S71046,C1254,2023-10-16 01:40:00,2023-10-16 03:13:00,10.0,desktop
S71047,C1346,2024-09-27 22:39:00,2024-09-28 01:12:00,10.0,android
S71048,C1249,2024-07-05 10:29:00,2024-07-05 10:35:00,5.0,desktop
S71049,C1499,2023-11-28 04:23:00,2023-11-28 05:09:00,,android app
S71050,C1394,03/02/2024 20:13,2024-02-03 20:52:00,4.0,mobile
S71051,C1274,2024-05-17 08:58:00,2024-05-17 12:19:00,4.0,web
S71052,C1160,2023-10-01 23:35:00,2023-10-02 01:24:00,5.0,ios
S71053,C1624,03/10/2023 11:21,2023-10-03 14:36:00,5.0,web
S71054,C1527,2025-01-20 10:45:00,2025-01-20 12:24:00,1.0,ios
S71055,C1235,16/11/2024 20:30,2024-11-16 23:34:00,4.0,mobile
S71056,C1774,2024-02-04 21:26:00,2024-02-04 23:22:00,,web
S71057,C1627,04/08/2023 07:52,2023-08-04 10:02:00,10.0,ios
S71058,C1225,2023-12-13 22:17:00,2023-12-13 23:26:00,1.0,desktop
S71059,C1011,08/07/2023 00:45,2023-07-08 01:35:00,1.0,android
S71060,C1214,2023-12-08 00:36:00,2023-12-08 01:01:00,4.0,ios
S71061,C1639,16/12/2023 06:49,2023-12-16 10:02:00,10.0,web
S71062,C1781,2023-01-11 21:28:00,2023-01-11 22:42:00,10.0,desktop
S71063,C1366,2023-06-14 15:59:00,2023-06-14 18:32:00,10.0,android
S71064,C1246,2025-01-21 15:08:00,2025-01-21 17:30:00,10.0,desktop
S71065,C1613,24/06/2024 20:45,2024-06-25 00:25:00,4.0,mobile
S71066,C1375,13/12/2024 04:30,2024-12-13 04:44:00,5.0,mobile
S71067,C1138,03/02/2024 18:20,2024-02-03 20:13:00,5.0,desktop
S71068,C1758,2024-11-19 16:56:00,2024-11-19 17:23:00,3.0,ios
S71069,C1714,23/07/2024 15:03,2024-07-23 18:45:00,5.0,ios
S71070,C1406,2025-01-04 17:37:00,2025-01-04 20:27:00,4.0,web
S71071,C1042,07/10/2023 05:47,2023-10-07 07:35:00,1.0,desktop
S71072,C1534,22/10/2024 13:52,2024-10-22 16:37:00,5.0,android app
S71073,C1669,2024-02-17 00:15:00,2024-02-17 00:46:00,3.0,ios
S71074,C1550,2024-02-24 13:51:00,2024-02-24 16:43:00,2.0,mobile
S71075,C1354,2024-09-16 17:01:00,2024-09-16 17:34:00,5.0,android
S71076,C1192,13/10/2024 05:49,2024-10-13 05:50:00,,android
S71077,C1185,20/04/2024 13:43,2024-04-20 16:52:00,1.0,mobile
S71078,C1614,10/11/2023 08:34,2023-11-10 09:30:00,3.0,android app
S71079,C1572,2023-06-26 20:57:00,2023-06-26 22:05:00,4.0,web
S71080,C1479,27/02/2025 19:52,2025-02-27 21:15:00,3.0,android
S71081,C1242,20/10/2023 06:44,2023-10-20 10:18:00,2.0,web
S71082,C1297,2024-01-05 01:03:00,2024-01-05 04:29:00,5.0,android app
S71083,C1721,2024-05-08 19:53:00,2024-05-08 20:11:00,,android
S71084,C1030,12/02/2024 03:27,2024-02-12 05:17:00,,web
S71085,C1095,30/12/2023 07:30,2023-12-30 09:25:00,10.0,ios
S71086,C1086,2024-05-22 14:43:00,2024-05-22 17:13:00,2.0,web
S71087,C1260,22/06/2024 08:08,2024-06-22 11:26:00,,ios
S71088,C1634,2023-10-12 15:06:00,2023-10-12 16:17:00,3.0,mobile
S71089,C1616,06/03/2024 09:36,2024-03-06 10:20:00,4.0,android app
S71090,C1500,2023-03-08 18:07:00,2023-03-08 19:24:00,1.0,mobile
S71091,C1737,03/02/2024 06:43,2024-02-03 07:40:00,2.0,desktop
S71092,C1311,2024-03-14 18:21:00,2024-03-14 21:27:00,10.0,mobile
S71093,C1466,2023-01-23 21:30:00,2023-01-23 21:47:00,1.0,web
S71094,C1336,27/06/2023 10:38,2023-06-27 14:35:00,3.0,desktop
S71095,C1278,30/06/2023 11:02,2023-06-30 12:20:00,,android
S71096,C1744,12/04/2023 12:38,2023-04-12 15:01:00,5.0,desktop
S71097,C1501,2023-03-17 11:27:00,2023-03-17 14:59:00,5.0,ios
S71098,C1206,19/09/2024 15:33,2024-09-19 16:27:00,1.0,desktop
S71099,C1688,2023-03-05 15:39:00,2023-03-05 15:34:00,3.0,ios
S71100,C1669,05/06/2024 04:13,2024-06-05 07:13:00,2.0,android app
S71101,C1460,24/02/2023 15:42,2023-02-24 16:24:00,1.0,web
S71102,C1474,2023-02-17 00:33:00,2023-02-17 03:53:00,2.0,android app
S71103,C1037,06/03/2023 06:13,2023-03-06 07:47:00,,mobile
S71104,C1282,11/02/2025 23:19,2025-02-12 02:57:00,4.0,android
S71105,C1779,2025-01-24 18:01:00,2025-01-24 20:51:00,,mobile
S71106,C1602,2023-05-25 06:49:00,2023-05-25 08:34:00,2.0,ios
S71107,C1630,2024-05-06 09:14:00,2024-05-06 12:42:00,3.0,desktop
S71108,C1040,2023-07-02 13:36:00,2023-07-02 14:50:00,5.0,android
S71109,C1589,2025-01-03 05:48:00,2025-01-03 05:50:00,10.0,ios
S71110,C1427,2025-03-09 08:39:00,2025-03-09 09:23:00,,mobile
S71111,C1469,16/10/2023 03:35,2023-10-16 07:10:00,4.0,mobile
S71112,C1546,04/01/2023 02:44,2023-01-04 05:21:00,1.0,ios
S71113,C1069,24/01/2024 21:36,2024-01-25 00:51:00,1.0,android app
S71114,C1617,2024-10-16 11:58:00,2024-10-16 14:21:00,3.0,mobile
S71115,C1317,17/09/2024 19:07,2024-09-17 22:43:00,2.0,web
S71116,C1373,2023-05-01 20:44:00,2023-05-02 00:11:00,2.0,android app
S71117,C1398,2023-06-28 18:54:00,2023-06-28 22:53:00,2.0,desktop
S71118,C1344,04/11/2023 13:57,2023-11-04 16:33:00,3.0,web
S71119,C1588,2023-09-27 01:15:00,2023-09-27 03:59:00,4.0,android
S71120,C1490,2023-03-11 03:34:00,2023-03-11 03:44:00,5.0,android
S71121,C1461,2023-06-09 17:29:00,2023-06-09 19:32:00,4.0,mobile
S71122,C1238,05/09/2024 03:16,2024-09-05 03:35:00,2.0,web
S71123,C1624,2024-03-21 11:37:00,2024-03-21 12:10:00,10.0,android
S71124,C1394,24/12/2023 03:05,2023-12-24 03:49:00,5.0,android
S71125,C1096,2024-10-31 04:01:00,2024-10-31 07:50:00,1.0,web
S71126,C1798,13/07/2023 07:36,2023-07-13 07:31:00,,desktop
S71127,C1032,2025-02-06 01:23:00,2025-02-06 04:11:00,3.0,android
S71128,C1679,09/09/2024 12:27,2024-09-09 13:38:00,4.0,ios
S71129,C1205,2024-11-27 13:41:00,2024-11-27 15:59:00,,web
S71130,C1791,2024-08-16 08:09:00,2024-08-16 09:43:00,5.0,web
S71131,C1703,11/08/2023 18:59,2023-08-11 19:03:00,3.0,desktop
S71132,C1256,25/10/2023 06:35,2023-10-25 06:37:00,1.0,android app
S71133,C1021,2024-11-22 06:46:00,2024-11-22 09:39:00,3.0,ios
S71134,C1351,2024-05-08 11:56:00,2024-05-08 12:11:00,,desktop
S71135,C1481,2024-11-23 23:56:00,2024-11-24 00:21:00,,android app
S71136,C1210,21/10/2023 05:33,2023-10-21 06:29:00,4.0,web
S71137,C1411,2024-05-27 09:24:00,2024-05-27 11:25:00,3.0,mobile
S71138,C1554,2023-09-06 15:46:00,2023-09-06 18:49:00,1.0,web
S71139,C1746,05/05/2024 07:19,2024-05-05 08:42:00,3.0,android
S71140,C1594,2024-10-04 17:40:00,2024-10-04 20:16:00,10.0,desktop
S71141,C1098,2025-03-07 10:03:00,2025-03-07 10:31:00,5.0,web
S71142,C1052,22/01/2025 07:00,2025-01-22 08:56:00,5.0,desktop
S71143,C1531,18/01/2025 05:55,2025-01-18 08:22:00,4.0,android
S71144,C1763,2024-04-04 15:50:00,2024-04-04 15:57:00,5.0,web
S71145,C1020,20/05/2023 21:50,2023-05-20 22:59:00,1.0,ios
S71146,C1300,2023-03-23 14:36:00,2023-03-23 15:52:00,10.0,android
S71147,C1112,29/07/2023 02:25,2023-07-29 06:12:00,,android app
S71148,C1722,2023-06-12 11:02:00,2023-06-12 12:14:00,5.0,desktop
S71149,C1690,04/12/2023 11:12,2023-12-04 12:48:00,1.0,android
S71150,C1508,11/06/2023 13:28,2023-06-11 17:10:00,1.0,ios
S71151,C1321,24/09/2024 19:09,2024-09-24 19:07:00,1.0,web
S71152,C1439,12/10/2023 20:40,2023-10-13 00:05:00,10.0,mobile
S71153,C1639,2023-11-09 21:49:00,2023-11-09 23:30:00,1.0,android
S71154,C1654,20/12/2024 16:15,2024-12-20 17:03:00,5.0,android app
S71155,C1284,2024-12-08 14:09:00,2024-12-08 17:40:00,2.0,desktop
S71156,C1219,09/02/2024 17:45,2024-02-09 20:15:00,4.0,mobile
S71157,C1032,2024-04-17 22:31:00,2024-04-17 22:26:00,,android
S71158,C1485,26/08/2024 07:46,2024-08-26 11:43:00,1.0,android app
S71159,C1730,2024-06-06 21:33:00,2024-06-06 22:19:00,,desktop
S71160,C1165,2024-08-06 08:55:00,2024-08-06 12:12:00,1.0,android app
S71161,C1106,2024-08-31 02:51:00,2024-08-31 06:09:00,,android app
S71162,C1701,25/06/2023 16:27,2023-06-25 19:32:00,2.0,android app
S71163,C1514,2024-03-29 05:32:00,2024-03-29 07:50:00,5.0,desktop
S71164,C1676,2024-05-14 15:16:00,2024-05-14 17:56:00,10.0,android
S71165,C1518,2024-05-24 17:24:00,,,android app
S71166,C1467,2024-09-23 02:03:00,2024-09-23 04:04:00,1.0,android app
S71167,C1677,2023-10-29 00:28:00,2023-10-29 02:44:00,10.0,android app
S71168,C1464,2024-01-24 22:55:00,2024-01-24 23:14:00,10.0,ios
S71169,C1069,2023-06-19 19:24:00,2023-06-19 20:12:00,2.0,desktop
S71170,C1693,27/09/2024 12:20,2024-09-27 15:50:00,3.0,desktop
S71171,C1736,07/07/2023 23:18,2023-07-08 02:26:00,,desktop
S71172,C1434,13/04/2023 23:20,2023-04-14 00:29:00,1.0,web
S71173,C1590,12/05/2024 07:04,2024-05-12 09:23:00,2.0,android app
S71174,C1602,12/11/2024 16:03,2024-11-12 16:23:00,10.0,web
S71175,C1103,25/05/2023 00:18,2023-05-25 02:57:00,,android
S71176,C1396,2023-01-21 08:04:00,2023-01-21 09:40:00,,ios
S71177,C1327,2024-12-22 00:29:00,2024-12-22 03:19:00,1.0,android
S71178,C1518,2023-04-15 18:04:00,2023-04-15 19:31:00,2.0,web
S71179,C1473,2023-05-18 19:49:00,2023-05-18 23:37:00,,android app
S71180,C1185,2023-10-14 07:50:00,2023-10-14 11:22:00,4.0,android
S71181,C1237,05/12/2024 07:29,2024-12-05 07:34:00,3.0,desktop
S71182,C1420,2023-02-27 05:27:00,2023-02-27 07:57:00,3.0,mobile
S71183,C1253,09/01/2024 14:33,2024-01-09 14:36:00,,android
S71184,C1315,2023-04-13 09:39:00,2023-04-13 11:49:00,5.0,mobile
S71185,C1781,10/02/2024 07:51,2024-02-10 11:39:00,,android
S71186,C1071,02/01/2024 10:01,2024-01-02 11:19:00,4.0,android
S71187,C1121,2023-03-22 18:13:00,2023-03-22 20:43:00,10.0,android
S71188,C1032,2024-01-14 06:57:00,,4.0,web
S71189,C1270,06/03/2023 21:05,2023-03-06 23:00:00,2.0,web
S71190,C1550,01/02/2023 03:46,2023-02-01 05:15:00,5.0,android
S71191,C1339,2023-11-28 16:19:00,2023-11-28 18:58:00,10.0,android app
S71192,C1450,2024-01-14 12:28:00,2024-01-14 13:15:00,10.0,web
S71193,C1569,19/08/2023 02:52,2023-08-19 05:00:00,4.0,android
S71194,C1731,13/08/2023 15:03,2023-08-13 15:46:00,3.0,web
S71195,C1429,2024-12-12 01:46:00,2024-12-12 03:10:00,10.0,desktop
S71196,C1460,2024-12-15 22:04:00,2024-12-15 23:09:00,1.0,android app
S71197,C1113,2024-11-11 22:29:00,2024-11-11 22:42:00,5.0,web
S71198,C1148,2023-10-09 18:12:00,2023-10-09 21:43:00,10.0,ios
S71199,C1394,05/04/2023 14:23,2023-04-05 18:02:00,1.0,web
S71200,C1335,2024-02-29 00:51:00,,3.0,android
S71201,C1488,2024-05-26 07:00:00,2024-05-26 08:12:00,10.0,desktop
S71202,C1710,2023-07-09 03:45:00,2023-07-09 07:17:00,,desktop
S71203,C1163,18/12/2024 14:13,2024-12-18 14:57:00,10.0,android app
S71204,C1562,09/04/2024 06:15,2024-04-09 06:36:00,1.0,desktop
S71205,C1068,01/09/2024 15:51,2024-09-01 18:39:00,3.0,mobile
S71206,C1566,2024-10-10 21:02:00,2024-10-11 00:43:00,2.0,desktop
S71207,C1147,27/03/2023 00:06,2023-03-27 00:38:00,3.0,android app
S71208,C1788,07/11/2024 09:36,2024-11-07 10:40:00,3.0,web
S71209,C1600,25/06/2023 13:10,2023-06-25 15:54:00,10.0,desktop
S71210,C1120,2023-03-20 17:39:00,2023-03-20 19:58:00,5.0,ios
S71211,C1170,2023-06-11 05:46:00,2023-06-11 09:34:00,,web
S71212,C1502,24/11/2024 08:00,2024-11-24 10:44:00,2.0,web
S71213,C1776,01/01/2023 13:04,2023-01-01 15:29:00,3.0,web
S71214,C1575,02/08/2023 16:24,2023-08-02 18:09:00,1.0,web
S71215,C1638,2023-12-09 08:54:00,2023-12-09 12:26:00,3.0,android
S71216,C1656,10/12/2024 18:27,2024-12-10 19:02:00,3.0,desktop
S71217,C1546,2024-02-17 01:10:00,,4.0,desktop
S71218,C1521,27/10/2024 10:54,2024-10-27 14:02:00,2.0,desktop
S71219,C1375,29/03/2023 08:15,2023-03-29 08:29:00,2.0,web
S71220,C1664,2023-12-16 17:46:00,2023-12-16 21:02:00,4.0,desktop
S71221,C1168,2023-02-12 08:53:00,2023-02-12 11:00:00,1.0,desktop
S71222,C1264,2024-04-27 02:04:00,2024-04-27 02:14:00,1.0,web
S71223,C1591,2024-07-24 22:54:00,2024-07-25 01:50:00,2.0,mobile
S71224,C1689,2023-02-01 01:19:00,2023-02-01 01:19:00,1.0,ios
S71225,C1596,14/12/2023 01:05,2023-12-14 04:31:00,4.0,android app
S71226,C1065,2023-11-20 23:15:00,2023-11-21 01:50:00,4.0,desktop
S71227,C1639,13/03/2023 22:07,2023-03-13 23:04:00,2.0,mobile
S71228,C1414,08/08/2024 10:39,2024-08-08 13:19:00,,mobile
S71229,C1026,2024-10-04 13:03:00,2024-10-04 14:16:00,1.0,android app
S71230,C1653,04/06/2023 15:25,2023-06-04 16:32:00,4.0,mobile
S71231,C1542,2024-09-06 06:51:00,2024-09-06 08:55:00,1.0,desktop
S71232,C1299,20/12/2024 08:50,2024-12-20 11:34:00,5.0,desktop
S71233,C1102,13/02/2025 15:31,2025-02-13 16:17:00,5.0,desktop
S71234,C1736,13/09/2024 13:26,2024-09-13 16:27:00,5.0,desktop
S71235,C1712,20/02/2023 10:16,,10.0,android
S71236,C1356,29/05/2024 10:24,2024-05-29 12:56:00,,desktop
S71237,C1693,03/06/2023 10:30,2023-06-03 11:06:00,5.0,desktop
S71238,C1573,2023-12-25 00:53:00,2023-12-25 03:07:00,2.0,ios
S71239,C1797,2023-10-07 05:11:00,2023-10-07 09:09:00,4.0,ios
S71240,C1342,14/11/2023 12:55,2023-11-14 12:56:00,10.0,android
S71241,C1376,2023-09-25 01:24:00,2023-09-25 03:18:00,3.0,web
S71242,C1197,2024-08-27 08:42:00,2024-08-27 12:10:00,3.0,android
S71243,C1476,03/02/2025 22:32,2025-02-04 02:32:00,3.0,desktop
S71244,C1730,2024-02-29 03:49:00,2024-02-29 07:26:00,5.0,android
S71245,C1232,16/01/2025 15:21,2025-01-16 18:27:00,1.0,android app
S71246,C1063,22/09/2023 03:47,2023-09-22 04:05:00,5.0,android app
S71247,C1723,2024-06-14 05:31:00,2024-06-14 08:29:00,,android app
S71248,C1284,06/03/2025 15:06,2025-03-06 16:49:00,3.0,mobile
S71249,C1219,29/04/2023 09:35,2023-04-29 10:05:00,2.0,web
S71250,C1466,2024-07-25 03:24:00,2024-07-25 03:51:00,5.0,android app
S71251,C1426,2023-02-26 11:35:00,2023-02-26 14:48:00,5.0,ios
S71252,C1208,2023-01-22 02:36:00,2023-01-22 05:22:00,2.0,android
S71253,C1126,2024-05-26 21:50:00,2024-05-27 00:34:00,2.0,web
S71254,C1542,05/12/2023 11:58,2023-12-05 14:31:00,1.0,desktop
S71255,C1328,16/05/2024 01:35,2024-05-16 02:14:00,4.0,android app
S71256,C1377,2023-06-24 12:31:00,2023-06-24 15:13:00,10.0,mobile
S71257,C1579,2025-01-25 17:24:00,2025-01-25 17:56:00,1.0,android app
S71258,C1413,30/11/2023 01:16,2023-11-30 04:46:00,4.0,android
S71259,C1505,05/10/2023 23:18,2023-10-06 00:15:00,1.0,android app
S71260,C1022,04/04/2023 09:57,2023-04-04 13:07:00,,ios
S71261,C1504,2023-10-13 23:08:00,2023-10-14 00:38:00,2.0,web
S71262,C1126,2024-10-01 08:49:00,2024-10-01 12:30:00,2.0,android app
S71263,C1445,29/05/2023 23:25,2023-05-30 00:16:00,1.0,web
S71264,C1769,20/05/2024 20:01,2024-05-20 20:49:00,1.0,android app
S71265,C1637,2024-06-26 17:03:00,2024-06-26 20:31:00,3.0,mobile
S71266,C1261,2024-12-17 11:54:00,2024-12-17 12:52:00,4.0,desktop
S71267,C1261,14/02/2023 02:21,2023-02-14 05:09:00,,desktop
S71268,C1560,2023-05-07 07:28:00,,,android app
S71269,C1727,2024-11-16 16:42:00,2024-11-16 20:29:00,5.0,mobile
S71270,C1097,01/03/2024 05:26,2024-03-01 09:09:00,4.0,ios
S71271,C1277,2024-06-06 08:56:00,,10.0,mobile
S71272,C1767,2024-09-24 14:02:00,2024-09-24 17:06:00,3.0,android
S71273,C1312,28/10/2023 04:16,2023-10-28 06:50:00,10.0,ios
S71274,C1002,2023-03-06 13:46:00,2023-03-06 16:49:00,5.0,ios
S71275,C1004,30/07/2024 21:32,2024-07-30 22:56:00,4.0,desktop
S71276,C1060,2023-04-30 09:09:00,2023-04-30 11:49:00,,android app
S71277,C1764,2023-01-06 14:24:00,2023-01-06 15:13:00,3.0,web
S71278,C1751,06/11/2024 17:05,2024-11-06 19:56:00,4.0,android app
S71279,C1278,2024-03-25 20:00:00,2024-03-25 21:32:00,4.0,mobile
S71280,C1037,15/02/2023 13:34,2023-02-15 16:29:00,4.0,mobile
S71281,,21/03/2023 08:14,2023-03-21 09:54:00,5.0,web
S71282,C1455,2024-03-12 11:36:00,2024-03-12 13:24:00,1.0,web
S71283,C1378,28/04/2024 04:42,2024-04-28 05:49:00,4.0,android app
S71284,C1420,20/08/2023 19:47,,,android app
S71285,C1046,2024-10-28 14:25:00,2024-10-28 14:52:00,1.0,web
S71286,C1152,25/02/2024 23:06,2024-02-26 02:47:00,,ios
S71287,C1244,2024-11-30 01:20:00,2024-11-30 01:17:00,10.0,android app
S71288,C1792,2023-09-15 03:55:00,2023-09-15 07:54:00,10.0,android app
S71289,C1125,2024-04-15 02:20:00,2024-04-15 05:20:00,2.0,mobile
S71290,C1052,08/02/2023 00:50,2023-02-08 04:37:00,2.0,mobile
S71291,C1744,21/05/2024 13:00,2024-05-21 13:16:00,,android app
S71292,C1432,24/03/2023 22:53,2023-03-24 23:16:00,4.0,web
S71293,C1319,13/04/2024 11:48,2024-04-13 13:26:00,10.0,android
S71294,C1794,2023-04-24 22:47:00,2023-04-25 00:42:00,3.0,desktop
S71295,C1041,03/07/2024 00:00,2024-07-03 03:39:00,4.0,android
S71296,C1455,04/04/2024 15:35,2024-04-04 17:34:00,1.0,web
S71297,C1787,14/09/2023 05:32,2023-09-14 07:41:00,,desktop
S71298,C1621,18/10/2023 11:23,2023-10-18 15:07:00,1.0,web
S71299,C1497,12/04/2024 13:06,2024-04-12 15:07:00,5.0,ios
S71300,C1162,26/06/2024 20:27,2024-06-26 22:51:00,1.0,mobile
S71301,C1598,09/05/2024 15:51,2024-05-09 17:08:00,10.0,android app
S71302,C1420,16/02/2023 13:27,2023-02-16 15:34:00,4.0,web
S71303,C1536,14/05/2024 04:44,2024-05-14 05:56:00,2.0,mobile
S71304,C1758,2023-04-05 19:46:00,2023-04-05 20:26:00,10.0,android app
S71305,C1165,13/06/2023 05:35,2023-06-13 07:40:00,5.0,desktop
S71306,C1180,16/02/2025 07:19,2025-02-16 10:16:00,4.0,desktop
S71307,C1750,2024-08-23 03:16:00,2024-08-23 04:03:00,4.0,web
S71308,C1575,2023-07-30 00:40:00,2023-07-30 02:33:00,10.0,android
S71309,C1515,2024-08-29 04:07:00,2024-08-29 07:43:00,1.0,android
S71310,C1677,2024-01-07 05:28:00,2024-01-07 06:54:00,10.0,desktop
S71311,C1338,2023-06-30 23:23:00,2023-06-30 23:34:00,1.0,ios
S71312,C1767,2024-09-29 15:34:00,2024-09-29 18:10:00,3.0,android app
S71313,C1312,2023-08-16 06:27:00,,2.0,desktop
S71314,C1157,19/04/2024 08:50,2024-04-19 09:51:00,,android
S71315,C1464,2024-12-05 01:57:00,2024-12-05 02:35:00,3.0,android app
S71316,C1211,2024-06-20 21:36:00,2024-06-20 23:24:00,5.0,mobile
S71317,C1760,15/04/2023 05:43,2023-04-15 07:27:00,1.0,android app
S71318,C1273,2025-02-27 01:22:00,2025-02-27 04:30:00,4.0,desktop
S71319,C1264,2024-08-30 18:51:00,2024-08-30 19:16:00,5.0,android
S71320,C1602,02/10/2023 09:44,2023-10-02 09:56:00,5.0,mobile
S71321,C1728,21/04/2024 20:56,2024-04-21 23:54:00,4.0,desktop
S71322,C1497,2025-03-02 12:37:00,2025-03-02 16:02:00,4.0,ios
S71323,C1589,22/01/2025 17:55,2025-01-22 19:36:00,4.0,android
S71324,C1758,2024-07-06 00:05:00,2024-07-06 01:35:00,10.0,mobile
S71325,C1613,30/06/2023 21:49,2023-06-30 22:44:00,10.0,mobile
S71326,C1152,19/06/2023 10:48,2023-06-19 13:26:00,1.0,desktop
S71327,C1383,2024-02-19 04:03:00,2024-02-19 07:23:00,5.0,web
S71328,C1117,28/06/2024 06:26,2024-06-28 08:27:00,3.0,android app
S71329,C1657,2023-04-09 23:00:00,2023-04-09 23:49:00,,android app
S71330,C1610,26/07/2024 17:02,2024-07-26 20:13:00,,desktop
S71331,C1491,02/06/2023 11:31,2023-06-02 14:15:00,4.0,android
S71332,C1706,04/11/2024 01:50,2024-11-04 05:11:00,1.0,desktop
S71333,C1199,13/03/2023 12:55,2023-03-13 16:10:00,10.0,web
S71334,C1420,2024-10-26 05:45:00,2024-10-26 07:33:00,10.0,web
S71335,C1417,18/02/2023 23:41,2023-02-19 02:17:00,10.0,android app
S71336,C1646,2024-02-12 22:15:00,2024-02-12 23:03:00,1.0,web
S71337,C1329,2024-04-13 01:14:00,2024-04-13 01:59:00,1.0,android app
S71338,C1282,16/01/2024 10:39,2024-01-16 12:34:00,2.0,android app
S71339,C1456,27/12/2023 19:06,2023-12-27 19:28:00,10.0,mobile
S71340,C1750,2023-11-22 03:25:00,2023-11-22 05:41:00,3.0,ios
S71341,C1375,24/03/2024 12:48,2024-03-24 13:15:00,3.0,web
S71342,C1520,2023-03-20 13:45:00,2023-03-20 15:07:00,,desktop
S71343,C1472,28/02/2024 04:36,2024-02-28 05:12:00,3.0,web
S71344,C1573,2024-02-20 11:34:00,2024-02-20 12:42:00,10.0,android
S71345,C1719,2024-02-11 23:12:00,2024-02-12 00:29:00,2.0,desktop
S71346,C1683,31/01/2024 01:08,2024-01-31 04:56:00,2.0,desktop
S71347,C1744,10/03/2025 11:15,2025-03-10 13:02:00,3.0,mobile
S71348,C1249,20/01/2024 16:31,2024-01-20 17:00:00,,mobile
S71349,C1682,2023-07-12 04:51:00,,2.0,web
S71350,C1495,04/03/2023 19:09,2023-03-04 19:04:00,4.0,android app
S71351,C1068,2023-07-02 10:55:00,2023-07-02 12:33:00,1.0,ios
S71352,C1061,2023-10-10 11:02:00,2023-10-10 12:24:00,2.0,desktop
S71353,C1717,16/07/2024 00:24,2024-07-16 03:51:00,10.0,web
S71354,C1330,21/09/2024 08:01,2024-09-21 10:07:00,4.0,ios
S71355,C1192,2024-09-19 14:35:00,,4.0,ios
S71356,C1601,19/04/2024 06:52,2024-04-19 08:39:00,2.0,android app
S71357,C1762,2024-10-27 17:31:00,,5.0,mobile
S71358,C1712,2023-04-10 17:58:00,2023-04-10 18:23:00,10.0,android
S71359,C1146,2023-07-24 20:56:00,2023-07-24 23:55:00,,android
S71360,C1363,22/10/2023 03:48,2023-10-22 04:28:00,1.0,android app
S71361,C1663,27/02/2023 01:40,2023-02-27 03:23:00,10.0,android app
S71362,C1731,2023-01-05 13:24:00,,5.0,ios
S71363,C1604,27/11/2023 17:18,2023-11-27 17:42:00,10.0,desktop
S71364,C1056,2024-06-11 09:15:00,2024-06-11 10:35:00,5.0,android
S71365,C1440,29/12/2024 18:14,2024-12-29 21:00:00,3.0,mobile
S71366,C1709,2023-01-28 00:17:00,2023-01-28 01:16:00,5.0,android app
S71367,C1507,2024-03-16 01:14:00,2024-03-16 05:00:00,10.0,web
S71368,C1470,2024-12-19 10:53:00,2024-12-19 14:11:00,10.0,mobile
S71369,C1123,2024-10-27 22:26:00,,5.0,ios
S71370,C1571,02/01/2023 22:34,2023-01-03 01:40:00,1.0,android app
S71371,C1331,15/09/2024 22:54,2024-09-16 02:11:00,4.0,mobile
S71372,C1199,2024-10-05 15:56:00,2024-10-05 16:38:00,1.0,android app
S71373,C1731,2023-02-09 12:17:00,2023-02-09 15:44:00,4.0,android app
S71374,C1410,2024-08-01 21:15:00,2024-08-01 22:46:00,4.0,android
S71375,C1002,2024-04-26 11:39:00,2024-04-26 15:21:00,5.0,ios
S71376,C1786,2023-01-06 09:18:00,,5.0,ios
S71377,C1650,23/04/2024 19:03,2024-04-23 19:18:00,3.0,desktop
S71378,C1109,2024-10-12 10:47:00,2024-10-12 11:51:00,2.0,mobile
S71379,C1486,2024-07-21 07:03:00,,,web
S71380,C1296,2023-09-27 15:00:00,2023-09-27 15:50:00,1.0,desktop
S71381,C1229,2023-05-10 15:41:00,,4.0,ios
S71382,C1717,26/06/2024 18:01,2024-06-26 18:32:00,5.0,ios
S71383,C1020,13/06/2023 14:27,2023-06-13 18:20:00,5.0,android app
S71384,C1263,2023-09-27 11:07:00,2023-09-27 13:27:00,2.0,desktop
S71385,C1062,2023-07-12 00:43:00,2023-07-12 04:36:00,3.0,mobile
S71386,C1161,2025-02-25 01:20:00,2025-02-25 02:56:00,1.0,web
S71387,C1358,2024-10-07 01:57:00,2024-10-07 03:32:00,10.0,desktop
S71388,C1386,02/05/2023 19:34,2023-05-02 23:10:00,5.0,ios
S71389,C1060,2023-12-02 15:21:00,2023-12-02 19:07:00,5.0,android
S71390,C1047,2023-11-02 15:13:00,2023-11-02 15:34:00,1.0,mobile
S71391,C1300,2024-07-09 16:49:00,,3.0,mobile
S71392,C1123,2023-01-01 17:18:00,2023-01-01 19:41:00,2.0,mobile
S71393,C1205,2023-07-04 15:19:00,2023-07-04 16:47:00,2.0,mobile
S71394,C1101,2023-01-25 12:10:00,2023-01-25 14:11:00,3.0,web
S71395,C1418,06/06/2024 05:32,2024-06-06 08:50:00,5.0,web
S71396,C1698,2023-11-30 00:28:00,2023-11-30 01:24:00,10.0,mobile
S71397,C1406,2023-06-17 11:20:00,2023-06-17 13:35:00,10.0,android
S71398,C1506,2023-08-18 05:00:00,2023-08-18 05:59:00,4.0,web
S71399,C1476,15/01/2024 22:08,2024-01-15 22:31:00,10.0,mobile
S71400,C1360,2024-07-03 11:04:00,2024-07-03 12:40:00,10.0,desktop
S71401,C1151,2023-11-24 11:57:00,2023-11-24 14:33:00,3.0,mobile
S71402,C1491,2023-02-27 03:12:00,2023-02-27 04:10:00,2.0,desktop
S71403,C1795,2023-12-04 05:16:00,2023-12-04 07:11:00,1.0,mobile
S71404,C1000,24/04/2024 02:05,2024-04-24 05:46:00,3.0,desktop
S71405,C1448,24/03/2024 17:32,2024-03-24 20:36:00,4.0,android
S71406,C1113,2024-04-30 21:48:00,2024-05-01 00:57:00,1.0,android app
S71407,C1159,04/03/2025 11:00,2025-03-04 12:32:00,1.0,web
S71408,C1458,2025-01-06 11:07:00,2025-01-06 13:38:00,,ios
S71409,C1589,02/08/2023 19:47,2023-08-02 22:28:00,10.0,android app
S71410,C1723,09/12/2024 03:56,2024-12-09 04:12:00,5.0,desktop
S71411,C1752,27/06/2024 20:17,,,android app
S71412,C1705,31/03/2023 16:01,2023-03-31 17:55:00,,web
S71413,C1479,2024-01-03 23:05:00,2024-01-04 01:49:00,4.0,ios
S71414,C1105,2023-10-24 03:08:00,2023-10-24 03:11:00,3.0,web
S71415,C1449,23/01/2023 22:59,2023-01-24 00:39:00,,mobile
S71416,C1440,2023-01-04 15:16:00,2023-01-04 17:06:00,,mobile
S71417,C1218,09/10/2024 01:17,2024-10-09 02:22:00,4.0,desktop
S71418,C1759,2025-01-22 11:04:00,2025-01-22 12:22:00,,ios
S71419,C1333,2023-12-06 13:37:00,,5.0,android app
S71420,C1009,10/09/2024 06:13,2024-09-10 06:29:00,5.0,android
S71421,C1420,01/03/2025 04:30,,4.0,android app
S71422,C1779,21/02/2024 22:39,2024-02-22 01:41:00,2.0,mobile
S71423,C1302,2023-05-29 12:35:00,2023-05-29 15:22:00,4.0,ios
S71424,C1182,08/08/2024 18:16,2024-08-08 21:25:00,1.0,web
S71425,C1713,03/04/2024 07:32,2024-04-03 09:37:00,3.0,web
S71426,C1469,21/04/2024 19:12,2024-04-21 21:41:00,10.0,mobile
S71427,C1161,13/02/2023 18:59,2023-02-13 19:39:00,,android
S71428,C1583,04/06/2023 21:23,2023-06-04 23:50:00,3.0,mobile
S71429,C1737,02/07/2023 06:38,2023-07-02 07:06:00,,android
S71430,C1622,19/02/2023 12:03,2023-02-19 13:27:00,2.0,android
S71431,C1024,2024-01-11 13:12:00,2024-01-11 15:28:00,4.0,android app
S71432,C1704,2024-02-26 01:28:00,2024-02-26 03:25:00,4.0,web
S71433,C1301,24/03/2023 04:19,2023-03-24 05:49:00,10.0,ios
S71434,C1215,2023-05-07 06:30:00,2023-05-07 09:16:00,3.0,android app
S71435,C1524,2023-07-30 19:54:00,2023-07-30 23:38:00,,android
S71436,C1560,01/11/2023 19:05,2023-11-01 22:44:00,2.0,ios
S71437,C1644,2023-05-21 20:20:00,2023-05-21 22:22:00,5.0,android
S71438,C1103,02/07/2024 02:36,2024-07-02 05:20:00,3.0,web
S71439,C1498,16/08/2023 13:24,2023-08-16 16:26:00,,mobile
S71440,C1736,2024-08-15 09:55:00,2024-08-15 10:45:00,4.0,desktop
S71441,C1416,14/07/2023 13:19,2023-07-14 16:47:00,10.0,android
S71442,C1472,2023-08-01 13:22:00,2023-08-01 14:56:00,4.0,android
S71443,C1407,2024-11-25 22:12:00,2024-11-26 00:51:00,5.0,web
S71444,C1138,2023-03-28 21:19:00,2023-03-28 21:19:00,4.0,android
S71445,C1171,2025-01-26 10:44:00,2025-01-26 12:04:00,2.0,web
S71446,C1448,2024-09-02 08:23:00,,2.0,mobile
S71447,C1035,2024-03-06 17:48:00,2024-03-06 19:16:00,1.0,android
S71448,C1147,2023-05-01 11:02:00,2023-05-01 12:41:00,10.0,web
S71449,C1755,2025-02-11 17:37:00,2025-02-11 21:15:00,1.0,android
S71450,C1356,24/11/2023 03:58,2023-11-24 04:02:00,2.0,mobile
S71451,C1319,2023-10-28 12:44:00,2023-10-28 13:01:00,3.0,mobile
S71452,C1252,2023-08-27 20:59:00,2023-08-27 21:49:00,,ios
S71453,C1073,2023-04-21 17:28:00,2023-04-21 20:53:00,2.0,ios
S71454,C1405,24/09/2024 17:37,2024-09-24 18:30:00,5.0,mobile
S71455,C1655,2024-05-05 13:49:00,2024-05-05 16:39:00,4.0,desktop
S71456,C1237,2023-08-22 07:43:00,2023-08-22 10:17:00,3.0,android
S71457,C1588,2025-02-16 01:08:00,2025-02-16 01:43:00,4.0,ios
S71458,C1068,23/07/2023 00:17,2023-07-23 00:44:00,5.0,mobile
S71459,C1326,09/06/2023 06:15,2023-06-09 09:24:00,2.0,ios
S71460,C1522,2023-08-16 22:33:00,2023-08-17 02:11:00,5.0,mobile
S71461,C1316,2024-06-21 20:48:00,2024-06-21 22:02:00,1.0,desktop
S71462,C1431,2023-09-03 03:42:00,2023-09-03 07:01:00,5.0,web
S71463,C1279,06/08/2024 12:00,2024-08-06 14:32:00,,android app
S71464,C1494,2025-02-25 04:20:00,2025-02-25 04:41:00,10.0,desktop
S71465,C1129,28/01/2023 19:46,2023-01-28 20:00:00,10.0,android
S71466,C1343,31/12/2024 21:09,,,android
S71467,C1428,22/05/2024 00:16,2024-05-22 00:18:00,5.0,android
S71468,C1055,2023-01-06 00:49:00,2023-01-06 00:59:00,3.0,web
S71469,C1289,14/11/2023 07:49,2023-11-14 08:43:00,4.0,desktop
S71470,C1393,13/07/2024 13:59,2024-07-13 14:31:00,3.0,android app
S71471,C1478,2024-01-24 13:32:00,2024-01-24 13:59:00,2.0,ios
S71472,C1524,2023-11-07 14:02:00,2023-11-07 15:03:00,2.0,ios
S71473,C1161,26/05/2024 20:09,2024-05-26 23:28:00,2.0,desktop
S71474,C1669,2024-02-03 01:47:00,2024-02-03 04:42:00,4.0,mobile
S71475,C1045,2023-06-14 14:20:00,2023-06-14 14:52:00,1.0,android app
S71476,C1698,2024-05-03 23:32:00,2024-05-04 00:27:00,2.0,android app
S71477,C1209,2024-09-12 13:27:00,2024-09-12 13:46:00,4.0,android
S71478,C1446,27/07/2023 13:32,2023-07-27 14:15:00,,mobile
S71479,C1635,30/01/2023 11:13,2023-01-30 15:00:00,4.0,android app
S71480,C1021,2024-05-12 06:33:00,2024-05-12 06:49:00,10.0,desktop
S71481,C1400,01/03/2023 17:49,2023-03-01 21:12:00,10.0,web
S71482,C1710,2024-06-22 04:12:00,2024-06-22 06:26:00,4.0,mobile
S71483,C1110,14/07/2023 01:36,2023-07-14 02:46:00,,android
S71484,C1327,2024-04-16 00:05:00,2024-04-16 03:44:00,1.0,mobile
S71485,C1727,15/09/2024 18:34,2024-09-15 20:17:00,4.0,desktop
S71486,C1719,2023-06-23 09:29:00,,10.0,android app
S71487,C1359,26/05/2024 01:40,2024-05-26 02:57:00,,mobile
S71488,C1033,2024-12-04 14:23:00,2024-12-04 16:01:00,4.0,desktop
S71489,C1679,12/04/2023 16:44,2023-04-12 20:44:00,4.0,web
S71490,C1189,2024-02-10 04:06:00,2024-02-10 04:24:00,5.0,web
S71491,C1402,04/01/2023 18:32,2023-01-04 22:16:00,2.0,desktop
S71492,C1066,2024-11-07 20:56:00,,2.0,mobile
S71493,C1243,2024-11-02 13:53:00,2024-11-02 14:18:00,5.0,desktop
S71494,C1263,2023-07-12 12:29:00,2023-07-12 13:31:00,4.0,android app
S71495,C1030,2024-06-24 21:11:00,2024-06-25 00:46:00,1.0,ios
S71496,C1718,2024-06-01 20:41:00,2024-06-01 22:26:00,5.0,desktop
S71497,C1638,11/03/2023 13:34,2023-03-11 15:39:00,3.0,web
S71498,C1482,2024-08-10 12:00:00,2024-08-10 13:52:00,10.0,ios
S71499,C1231,15/01/2023 12:49,2023-01-15 14:16:00,3.0,android
S71500,C1095,13/02/2024 16:43,2024-02-13 19:50:00,5.0,web
S71501,C1138,20/06/2024 02:56,2024-06-20 05:23:00,4.0,ios
S71502,C1158,2023-06-13 15:37:00,2023-06-13 17:15:00,1.0,desktop
S71503,C1789,2023-02-18 09:46:00,2023-02-18 10:31:00,4.0,android app
S71504,C1688,2023-06-17 11:10:00,2023-06-17 13:31:00,10.0,android
S71505,C1056,11/07/2024 21:17,2024-07-11 22:40:00,10.0,web
S71506,C1729,22/01/2024 10:32,2024-01-22 11:27:00,4.0,desktop
S71507,C1442,2023-01-24 13:34:00,,3.0,mobile
S71508,C1393,2025-03-05 02:43:00,2025-03-05 03:42:00,2.0,android app
S71509,C1449,05/04/2024 19:08,2024-04-05 22:41:00,4.0,mobile
S71510,C1445,10/06/2023 20:18,2023-06-10 20:43:00,4.0,ios
S71511,C1415,14/04/2023 21:39,2023-04-14 22:43:00,10.0,android app
S71512,C1330,2024-09-16 14:38:00,2024-09-16 15:10:00,1.0,mobile
S71513,C1293,29/03/2024 00:13,2024-03-29 00:41:00,10.0,web
S71514,C1671,2023-05-07 01:35:00,2023-05-07 04:53:00,5.0,ios
S71515,C1004,05/03/2023 16:13,2023-03-05 18:19:00,1.0,desktop
S71516,C1332,2023-09-28 17:46:00,2023-09-28 21:06:00,10.0,android
S71517,C1239,05/01/2023 19:34,,2.0,android app
S71518,C1753,2023-12-21 23:16:00,2023-12-21 23:37:00,4.0,android app
S71519,C1650,21/09/2023 16:29,2023-09-21 19:13:00,2.0,android
S71520,C1183,2024-07-18 18:02:00,2024-07-18 20:15:00,2.0,desktop
S71521,C1284,06/10/2023 17:15,2023-10-06 17:13:00,5.0,desktop
S71522,C1160,17/07/2023 08:26,2023-07-17 09:04:00,4.0,web
S71523,C1642,2023-11-22 17:24:00,,3.0,mobile
S71524,C1667,2024-12-09 14:58:00,2024-12-09 16:15:00,1.0,mobile
S71525,C1116,23/01/2025 20:08,2025-01-23 21:52:00,10.0,mobile
S71526,C1708,01/02/2024 01:11,2024-02-01 04:07:00,3.0,mobile
S71527,C1421,13/04/2023 06:04,2023-04-13 07:51:00,1.0,android
S71528,C1578,17/11/2024 16:44,2024-11-17 19:20:00,1.0,ios
S71529,C1284,31/01/2023 13:45,2023-01-31 17:06:00,2.0,android app
S71530,C1226,08/03/2024 23:46,2024-03-09 02:21:00,1.0,desktop
S71531,C1342,29/02/2024 09:03,2024-02-29 10:04:00,,mobile
S71532,C1229,2023-11-24 20:38:00,2023-11-24 23:16:00,10.0,android
S71533,C1718,2024-08-14 15:40:00,2024-08-14 16:17:00,3.0,android app
S71534,C1170,2024-12-01 09:14:00,2024-12-01 12:34:00,4.0,android
S71535,C1512,2024-10-17 00:33:00,2024-10-17 01:04:00,10.0,desktop
S71536,C1763,2024-05-25 23:35:00,2024-05-26 01:11:00,5.0,mobile
S71537,C1444,2023-01-09 22:13:00,2023-01-10 00:53:00,5.0,desktop
S71538,C1075,2024-03-31 16:11:00,2024-03-31 19:23:00,5.0,desktop
S71539,C1477,2024-10-19 10:45:00,,5.0,android app
S71540,C1563,04/09/2023 14:06,2023-09-04 14:31:00,10.0,android
S71541,C1681,10/05/2023 13:47,2023-05-10 17:46:00,10.0,web
S71542,C1012,2024-06-22 16:31:00,2024-06-22 19:15:00,10.0,android
S71543,C1374,2023-01-24 09:57:00,2023-01-24 11:41:00,10.0,mobile
S71544,C1567,24/03/2023 10:50,2023-03-24 12:00:00,5.0,android
S71545,C1069,2023-11-24 15:34:00,2023-11-24 19:24:00,3.0,android app
S71546,C1245,2024-10-13 03:15:00,2024-10-13 04:57:00,3.0,web
S71547,C1531,2024-10-08 23:28:00,2024-10-09 03:18:00,5.0,ios
S71548,C1032,2023-07-25 22:04:00,2023-07-25 22:56:00,4.0,ios
S71549,C1340,18/10/2023 05:07,2023-10-18 08:39:00,4.0,web
S71550,C1463,04/05/2024 21:21,2024-05-04 23:05:00,,web
S71551,C1229,2024-02-02 04:17:00,2024-02-02 05:13:00,2.0,ios
S71552,C1191,2024-05-07 19:38:00,2024-05-07 21:36:00,,desktop
S71553,C1118,2023-10-10 23:16:00,2023-10-11 02:43:00,2.0,ios
S71554,C1228,10/09/2023 06:53,2023-09-10 07:20:00,4.0,desktop
S71555,C1387,2023-04-24 15:34:00,2023-04-24 15:30:00,4.0,android
S71556,C1794,12/06/2023 14:14,2023-06-12 17:47:00,3.0,mobile
S71557,C1454,09/01/2025 01:22,2025-01-09 02:01:00,1.0,ios
S71558,C1571,2024-10-26 19:30:00,2024-10-26 22:53:00,,android
S71559,C1775,2024-02-23 13:08:00,2024-02-23 13:03:00,10.0,desktop
S71560,C1669,2023-02-02 16:19:00,2023-02-02 19:31:00,4.0,mobile
S71561,C1573,15/01/2023 14:33,2023-01-15 16:17:00,4.0,mobile
S71562,C1394,2023-10-08 22:58:00,2023-10-09 00:02:00,1.0,android
S71563,C1303,2024-02-15 08:57:00,2024-02-15 11:28:00,2.0,web
S71564,C1365,2023-01-14 03:21:00,2023-01-14 03:43:00,10.0,ios
S71565,C1340,2024-03-28 14:18:00,2024-03-28 16:34:00,10.0,ios
S71566,C1381,21/02/2024 12:08,2024-02-21 14:59:00,5.0,ios
S71567,C1136,30/04/2023 19:39,2023-04-30 21:39:00,3.0,web
S71568,C1418,2024-12-15 15:32:00,2024-12-15 19:13:00,1.0,android
S71569,C1112,2024-11-09 10:53:00,2024-11-09 13:31:00,3.0,android app
S71570,C1322,13/03/2024 10:40,2024-03-13 11:05:00,4.0,android app
S71571,C1122,09/05/2023 10:57,2023-05-09 10:52:00,3.0,ios
S71572,C1030,18/12/2023 21:54,2023-12-18 23:40:00,1.0,android app
S71573,C1451,04/11/2023 04:16,2023-11-04 06:29:00,,desktop
S71574,C1011,2023-12-09 17:50:00,2023-12-09 18:54:00,1.0,mobile
S71575,C1752,2024-03-08 12:29:00,2024-03-08 14:23:00,2.0,ios
S71576,C1356,28/06/2023 19:11,2023-06-28 20:18:00,3.0,ios
S71577,C1681,2024-08-09 19:03:00,2024-08-09 21:28:00,10.0,web
S71578,C1374,19/04/2024 05:08,2024-04-19 05:25:00,3.0,mobile
S71579,C1509,2025-01-05 13:30:00,2025-01-05 16:13:00,,web
S71580,C1008,22/09/2024 08:02,2024-09-22 09:37:00,2.0,ios
S71581,C1372,19/03/2024 21:01,2024-03-19 21:10:00,2.0,android
S71582,C1160,12/04/2023 10:49,2023-04-12 12:06:00,2.0,android
S71583,C1637,24/09/2023 03:14,2023-09-24 03:56:00,2.0,web
S71584,C1382,2024-06-13 05:28:00,2024-06-13 06:01:00,5.0,android
S71585,C1036,2025-01-04 07:35:00,2025-01-04 09:34:00,5.0,mobile
S71586,C1575,2024-02-21 21:34:00,2024-02-22 01:09:00,3.0,mobile
S71587,C1408,2024-06-22 06:15:00,2024-06-22 08:27:00,10.0,desktop
S71588,C1544,22/09/2024 04:51,2024-09-22 07:24:00,5.0,web
S71589,C1504,27/07/2023 17:42,2023-07-27 19:35:00,,ios
S71590,C1273,07/02/2025 19:33,2025-02-07 21:39:00,3.0,android
S71591,C1296,2024-02-04 04:09:00,2024-02-04 07:04:00,,desktop
S71592,C1094,02/01/2024 20:56,2024-01-02 21:27:00,3.0,desktop
S71593,C1129,2023-09-16 13:41:00,2023-09-16 14:45:00,2.0,ios
S71594,C1790,2024-05-28 23:26:00,2024-05-29 00:11:00,4.0,ios
S71595,C1195,11/07/2023 18:26,2023-07-11 20:28:00,1.0,web
S71596,C1351,17/03/2024 02:03,2024-03-17 02:27:00,,ios
S71597,C1689,2023-08-21 11:25:00,2023-08-21 12:14:00,10.0,android app
S71598,C1600,2024-01-17 15:17:00,2024-01-17 16:37:00,3.0,mobile
S71599,C1596,2024-10-18 17:03:00,2024-10-18 20:54:00,3.0,web
S71600,C1715,2024-07-26 09:12:00,2024-07-26 11:32:00,5.0,android
S71601,C1559,2024-05-17 20:59:00,2024-05-18 00:13:00,10.0,mobile
S71602,C1603,2023-03-23 22:19:00,2023-03-24 00:31:00,4.0,mobile
S71603,C1444,2025-03-01 18:10:00,2025-03-01 18:20:00,5.0,android
S71604,C1671,2024-02-25 04:30:00,2024-02-25 07:25:00,2.0,android
S71605,C1177,2023-08-26 20:23:00,2023-08-26 23:15:00,10.0,android app
S71606,C1325,05/01/2023 20:25,2023-01-05 22:48:00,2.0,desktop
S71607,C1574,2023-02-02 01:46:00,2023-02-02 04:18:00,3.0,mobile
S71608,C1406,21/03/2023 04:52,2023-03-21 08:36:00,5.0,desktop
S71609,C1611,2024-03-14 13:55:00,2024-03-14 14:30:00,1.0,android app
S71610,C1154,20/10/2023 12:40,2023-10-20 15:39:00,,web
S71611,C1408,2023-02-07 18:51:00,2023-02-07 20:44:00,,ios
S71612,C1252,2024-03-20 02:18:00,2024-03-20 06:05:00,2.0,android
S71613,C1321,11/09/2024 01:36,2024-09-11 03:03:00,4.0,android app
S71614,C1441,27/03/2023 00:03,,1.0,android app
S71615,C1025,03/09/2024 03:27,2024-09-03 06:13:00,10.0,ios
S71616,C1035,06/02/2024 11:53,2024-02-06 13:47:00,,web
S71617,C1392,12/11/2024 18:55,2024-11-12 19:54:00,4.0,ios
S71618,C1663,27/11/2023 09:21,2023-11-27 12:44:00,,mobile
S71619,C1191,2023-11-15 23:15:00,,4.0,desktop
S71620,C1342,09/02/2023 01:06,2023-02-09 03:27:00,,android
S71621,C1681,30/04/2024 16:55,2024-04-30 17:09:00,10.0,desktop
S71622,C1354,2023-10-03 12:08:00,,1.0,ios
S71623,C1064,01/11/2024 23:55,2024-11-02 01:20:00,,web
S71624,C1374,2024-05-17 23:19:00,2024-05-18 00:26:00,1.0,ios
S71625,C1089,2025-02-16 20:44:00,2025-02-17 00:03:00,2.0,android app
S71626,C1494,2023-06-10 00:58:00,2023-06-10 02:37:00,1.0,android app
S71627,C1779,24/10/2024 10:11,2024-10-24 11:15:00,1.0,desktop
S71628,C1601,01/01/2025 04:21,2025-01-01 06:23:00,1.0,android
S71629,C1773,2024-11-12 21:35:00,2024-11-12 22:08:00,2.0,web
S71630,C1457,2024-08-07 16:59:00,2024-08-07 20:24:00,3.0,web
S71631,C1711,13/04/2024 21:59,2024-04-13 22:47:00,5.0,web
S71632,C1371,22/07/2023 01:31,,5.0,desktop
S71633,C1077,2025-03-03 06:10:00,2025-03-03 06:21:00,,desktop
S71634,C1599,2023-04-22 13:25:00,2023-04-22 15:12:00,3.0,desktop
S71635,C1205,18/01/2024 12:36,2024-01-18 14:25:00,2.0,android
S71636,C1486,2023-04-19 01:47:00,2023-04-19 04:43:00,3.0,android app
S71637,C1533,03/04/2024 01:40,2024-04-03 02:36:00,4.0,android
S71638,C1256,2024-06-28 21:42:00,2024-06-29 00:15:00,1.0,android app
S71639,C1602,2024-02-18 02:55:00,2024-02-18 06:44:00,4.0,android app
S71640,C1342,2023-05-01 15:05:00,2023-05-01 18:17:00,3.0,android app
S71641,C1223,2023-08-07 21:58:00,2023-08-08 00:12:00,3.0,android app
S71642,C1068,2023-09-16 00:40:00,2023-09-16 02:12:00,2.0,mobile
S71643,C1176,2023-05-31 11:02:00,2023-05-31 14:58:00,2.0,desktop
S71644,C1465,23/01/2023 13:17,2023-01-23 17:00:00,3.0,desktop
S71645,C1202,30/06/2023 04:29,2023-06-30 05:51:00,1.0,android
S71646,C1273,06/03/2024 08:15,2024-03-06 09:03:00,10.0,android app
S71647,C1783,2023-11-14 18:41:00,2023-11-14 21:58:00,1.0,android
S71648,C1257,10/11/2023 21:26,2023-11-10 21:43:00,2.0,web
S71649,C1342,2023-12-13 04:58:00,2023-12-13 08:16:00,1.0,ios
S71650,C1542,17/03/2024 21:43,2024-03-18 01:00:00,3.0,desktop
S71651,C1661,2023-12-31 01:54:00,2023-12-31 02:56:00,,android
S71652,C1020,24/11/2023 06:18,,3.0,desktop
S71653,C1685,26/05/2024 15:43,2024-05-26 16:40:00,,android app
S71654,C1067,27/09/2023 02:05,2023-09-27 02:30:00,4.0,desktop
S71655,C1639,26/02/2024 00:10,2024-02-26 03:51:00,10.0,mobile
S71656,C1504,04/06/2024 11:44,2024-06-04 14:42:00,10.0,desktop
S71657,C1433,2024-08-09 11:12:00,2024-08-09 14:19:00,10.0,desktop
S71658,C1704,2025-01-04 17:34:00,,,desktop
S71659,C1163,08/01/2025 15:21,2025-01-08 19:10:00,4.0,web
S71660,C1114,2024-01-03 19:40:00,2024-01-03 23:04:00,2.0,web
S71661,C1202,28/07/2024 15:59,2024-07-28 18:10:00,2.0,web
S71662,C1275,2023-11-21 18:59:00,2023-11-21 21:45:00,1.0,ios
S71663,C1426,2025-01-26 05:03:00,2025-01-26 07:23:00,2.0,mobile
S71664,C1781,24/09/2023 23:04,2023-09-25 02:56:00,4.0,ios
S71665,C1091,20/11/2024 11:56,2024-11-20 14:41:00,5.0,web
S71666,C1406,2023-11-27 05:50:00,2023-11-27 08:34:00,,web
S71667,C1283,2024-06-26 23:50:00,2024-06-27 03:47:00,1.0,mobile
S71668,C1699,18/06/2023 07:03,2023-06-18 07:58:00,5.0,android
S71669,C1385,12/04/2023 12:59,2023-04-12 14:36:00,5.0,desktop
S71670,C1078,08/10/2023 23:14,2023-10-08 23:10:00,,desktop
S71671,C1327,2023-01-21 21:15:00,2023-01-22 00:45:00,10.0,android app
S71672,C1152,04/10/2024 04:38,2024-10-04 08:18:00,3.0,mobile
S71673,C1716,21/05/2024 14:45,2024-05-21 16:28:00,3.0,android app
S71674,C1441,13/10/2023 09:41,2023-10-13 13:27:00,1.0,android
S71675,C1788,2025-03-04 09:14:00,2025-03-04 09:57:00,3.0,android app
S71676,C1343,22/08/2023 22:09,2023-08-22 23:59:00,10.0,mobile
S71677,C1254,30/08/2024 22:19,2024-08-30 23:17:00,5.0,android
S71678,C1154,20/12/2023 21:29,2023-12-20 22:05:00,3.0,web
S71679,C1144,2024-06-21 13:58:00,2024-06-21 14:52:00,5.0,desktop
S71680,C1130,2024-05-25 22:41:00,2024-05-26 01:15:00,2.0,web
S71681,C1691,2025-01-19 09:56:00,2025-01-19 11:52:00,10.0,android app
S71682,,25/12/2024 01:18,2024-12-25 02:19:00,3.0,web
S71683,C1267,2024-04-28 14:08:00,2024-04-28 16:36:00,10.0,web
S71684,C1792,26/09/2023 20:40,2023-09-26 23:14:00,10.0,android app
S71685,C1460,2025-02-21 12:46:00,2025-02-21 13:16:00,5.0,ios
S71686,C1040,2023-10-08 19:30:00,2023-10-08 22:02:00,3.0,mobile
S71687,C1759,2023-06-03 23:51:00,2023-06-04 02:29:00,,web
S71688,C1692,06/06/2024 06:42,,,desktop
S71689,C1522,2025-03-03 09:06:00,2025-03-03 09:57:00,2.0,android
S71690,C1097,30/07/2024 00:26,2024-07-30 01:59:00,3.0,mobile
S71691,C1002,06/04/2024 20:57,2024-04-06 22:07:00,5.0,desktop
S71692,C1109,2024-11-05 02:01:00,2024-11-05 02:41:00,10.0,android app
S71693,C1276,02/02/2023 19:36,2023-02-02 21:11:00,5.0,android
S71694,C1540,2024-03-28 17:18:00,2024-03-28 17:56:00,2.0,android
S71695,C1707,2023-10-26 05:39:00,2023-10-26 07:02:00,10.0,android app
S71696,C1110,2024-06-04 05:37:00,2024-06-04 05:38:00,1.0,web
S71697,C1171,2024-08-06 07:04:00,2024-08-06 07:27:00,10.0,desktop
S71698,C1596,2024-01-24 20:16:00,2024-01-24 23:08:00,,desktop
S71699,C1737,15/05/2023 03:08,2023-05-15 04:22:00,3.0,android app
S71700,C1453,2024-05-29 04:27:00,2024-05-29 05:41:00,4.0,android
S71701,C1074,31/12/2023 16:22,2023-12-31 18:11:00,3.0,web
S71702,C1630,10/09/2024 15:49,2024-09-10 19:08:00,10.0,desktop
S71703,C1571,21/02/2023 05:18,2023-02-21 07:12:00,1.0,mobile
S71704,C1548,2024-06-12 18:04:00,2024-06-12 18:42:00,1.0,desktop
S71705,C1279,02/01/2023 10:41,2023-01-02 12:32:00,3.0,android
S71706,C1044,2024-01-08 15:36:00,2024-01-08 16:05:00,3.0,android app
S71707,C1792,2024-08-09 18:05:00,2024-08-09 20:40:00,5.0,android
S71708,C1568,06/01/2024 16:47,2024-01-06 17:01:00,1.0,mobile
S71709,C1615,2023-09-25 07:16:00,2023-09-25 10:07:00,3.0,web
S71710,C1674,25/11/2024 11:57,2024-11-25 12:50:00,10.0,ios
S71711,C1257,23/01/2024 11:07,2024-01-23 14:17:00,1.0,web
S71712,C1252,2024-10-28 04:49:00,2024-10-28 08:36:00,,android
S71713,C1458,17/08/2023 09:13,2023-08-17 11:40:00,3.0,ios
S71714,C1786,29/09/2023 08:03,2023-09-29 09:29:00,1.0,mobile
S71715,,2025-01-03 14:44:00,2025-01-03 16:37:00,1.0,desktop
S71716,C1309,28/01/2023 16:49,2023-01-28 19:59:00,5.0,ios
S71717,C1567,21/01/2023 13:54,2023-01-21 17:47:00,10.0,desktop
S71718,C1682,2024-10-29 06:04:00,2024-10-29 08:58:00,1.0,mobile
S71719,C1782,2025-01-21 07:37:00,2025-01-21 07:58:00,4.0,ios
S71720,C1663,03/12/2023 19:41,2023-12-03 23:09:00,5.0,android
S71721,C1744,27/10/2023 07:20,2023-10-27 07:45:00,2.0,ios
S71722,C1750,05/04/2024 17:47,2024-04-05 18:23:00,1.0,mobile
S71723,C1122,02/11/2024 08:54,2024-11-02 10:22:00,5.0,desktop
S71724,C1139,30/11/2023 19:01,2023-11-30 19:41:00,10.0,android
S71725,C1411,30/01/2025 15:13,2025-01-30 16:49:00,3.0,ios
S71726,C1527,2024-12-08 23:53:00,2024-12-09 02:16:00,2.0,android
S71727,C1112,07/05/2023 04:33,2023-05-07 05:51:00,,android
S71728,C1499,17/06/2023 02:40,,10.0,android
S71729,C1772,14/04/2023 02:11,2023-04-14 03:22:00,1.0,android app
S71730,C1615,07/02/2024 09:40,2024-02-07 13:30:00,2.0,ios
S71731,C1255,05/06/2023 03:42,2023-06-05 04:27:00,,ios
S71732,C1008,07/06/2024 02:20,2024-06-07 06:07:00,10.0,mobile
S71733,C1745,2023-09-20 08:49:00,2023-09-20 10:30:00,3.0,android
S71734,C1014,22/05/2024 17:32,2024-05-22 19:16:00,3.0,ios
S71735,C1533,20/08/2024 06:49,2024-08-20 09:13:00,3.0,desktop
S71736,C1018,2024-04-20 20:29:00,2024-04-20 22:31:00,4.0,desktop
S71737,C1331,2023-02-23 15:03:00,,1.0,android
S71738,C1527,2024-01-14 00:28:00,2024-01-14 01:56:00,,web
S71739,C1554,2023-01-26 19:23:00,2023-01-26 21:51:00,10.0,android
S71740,C1606,2024-10-22 23:01:00,2024-10-23 00:07:00,,android app
S71741,C1622,15/10/2024 12:59,2024-10-15 14:29:00,5.0,desktop
S71742,C1012,2023-05-14 12:42:00,,5.0,mobile
S71743,C1337,2023-08-11 05:28:00,2023-08-11 08:58:00,3.0,ios
S71744,C1670,2024-02-19 05:59:00,2024-02-19 05:54:00,3.0,mobile
S71745,C1520,19/09/2023 22:42,2023-09-20 00:13:00,5.0,ios
S71746,C1042,2025-02-20 06:08:00,2025-02-20 06:14:00,,desktop
S71747,C1559,13/03/2024 10:28,2024-03-13 13:44:00,,android app
S71748,C1123,06/06/2023 00:49,2023-06-06 02:28:00,,web
S71749,C1274,22/05/2024 19:33,2024-05-22 22:08:00,4.0,mobile
S71750,C1016,2023-02-23 08:47:00,2023-02-23 12:02:00,,mobile
S71751,C1197,17/05/2024 01:30,2024-05-17 01:33:00,10.0,android app
S71752,C1221,2024-06-09 19:50:00,2024-06-09 20:21:00,,ios
S71753,C1289,30/01/2025 20:15,2025-01-30 23:49:00,,desktop
S71754,C1729,27/03/2024 19:59,2024-03-27 20:01:00,10.0,android
S71755,C1025,2024-06-13 15:31:00,2024-06-13 16:51:00,2.0,web
S71756,C1348,10/11/2024 10:10,2024-11-10 13:23:00,,mobile
S71757,C1034,18/12/2024 20:12,2024-12-18 20:51:00,5.0,desktop
S71758,C1566,27/09/2024 18:39,2024-09-27 19:41:00,10.0,ios
S71759,C1758,2024-03-21 06:24:00,2024-03-21 10:03:00,,mobile
S71760,C1115,02/08/2024 03:51,2024-08-02 05:22:00,2.0,android app
S71761,C1711,2024-06-15 09:23:00,2024-06-15 09:42:00,,android app
S71762,C1739,2023-10-11 08:06:00,2023-10-11 09:08:00,5.0,ios
S71763,C1049,2024-11-26 18:34:00,2024-11-26 19:49:00,10.0,web
S71764,C1347,20/11/2024 07:32,2024-11-20 09:59:00,3.0,android app
S71765,C1385,07/01/2024 14:45,2024-01-07 18:06:00,5.0,android
S71766,C1727,2024-08-05 04:33:00,2024-08-05 06:47:00,3.0,mobile
S71767,C1226,19/06/2023 12:51,2023-06-19 16:27:00,2.0,android app
S71768,C1349,2023-05-31 23:38:00,2023-06-01 02:22:00,3.0,android
S71769,C1656,19/01/2023 03:26,2023-01-19 06:55:00,5.0,desktop
S71770,C1530,2023-12-27 03:20:00,2023-12-27 06:27:00,1.0,ios
S71771,C1737,2024-09-09 23:36:00,2024-09-10 00:28:00,3.0,desktop
S71772,C1673,18/11/2023 05:30,2023-11-18 08:27:00,3.0,mobile
S71773,C1442,2023-10-18 14:54:00,2023-10-18 17:52:00,4.0,desktop
S71774,C1605,10/07/2024 23:31,2024-07-10 23:46:00,2.0,web
S71775,C1604,2023-04-12 11:41:00,2023-04-12 11:47:00,1.0,android
S71776,C1038,2023-12-06 23:14:00,2023-12-07 01:59:00,3.0,android
S71777,C1649,17/07/2023 06:04,2023-07-17 09:15:00,1.0,web
S71778,C1188,25/10/2024 14:36,2024-10-25 18:19:00,5.0,ios
S71779,C1108,2025-03-03 07:04:00,2025-03-03 08:47:00,,web
S71780,C1796,2024-11-12 06:41:00,2024-11-12 09:12:00,10.0,web
S71781,C1241,2023-11-02 15:21:00,2023-11-02 15:29:00,3.0,desktop
S71782,C1070,2024-01-28 02:39:00,,10.0,android app
S71783,C1099,2024-03-09 23:06:00,2024-03-10 00:40:00,10.0,web
S71784,C1420,2024-04-20 12:23:00,2024-04-20 14:13:00,10.0,android app
S71785,C1718,2024-10-07 01:09:00,2024-10-07 04:40:00,10.0,android app
S71786,C1424,2023-04-26 00:51:00,2023-04-26 02:19:00,,android
S71787,C1582,2023-01-21 01:10:00,2023-01-21 04:58:00,10.0,android app
S71788,C1310,2024-05-25 16:27:00,2024-05-25 19:30:00,3.0,mobile
S71789,C1428,12/11/2023 21:39,2023-11-13 00:37:00,3.0,mobile
S71790,C1022,2025-02-28 18:22:00,,5.0,android app
S71791,C1140,2024-06-18 21:58:00,2024-06-19 01:37:00,5.0,mobile
S71792,C1651,2025-02-12 14:03:00,2025-02-12 17:55:00,4.0,android app
S71793,C1076,25/02/2025 00:22,2025-02-25 00:26:00,,ios
S71794,C1164,04/05/2023 20:08,2023-05-04 20:47:00,3.0,android app
S71795,C1297,30/11/2023 07:32,,3.0,android app
S71796,C1440,29/10/2024 01:55,2024-10-29 05:37:00,1.0,android
S71797,C1458,2024-10-27 13:12:00,,2.0,ios
S71798,C1432,2023-04-08 19:44:00,2023-04-08 21:33:00,,ios
S71799,C1794,03/01/2023 10:57,2023-01-03 14:26:00,,ios
S71800,C1264,2023-08-09 15:53:00,2023-08-09 18:16:00,4.0,desktop
S71801,C1147,28/01/2024 19:13,2024-01-28 22:47:00,10.0,ios
S71802,C1517,24/06/2023 23:35,2023-06-25 02:21:00,4.0,android
S71803,C1117,23/04/2024 20:36,2024-04-23 21:25:00,,android app
S71804,C1152,2024-12-01 05:45:00,2024-12-01 06:23:00,,android
S71805,C1722,2024-05-24 09:43:00,2024-05-24 13:18:00,5.0,mobile
S71806,C1701,30/01/2024 05:11,2024-01-30 07:39:00,3.0,android app
S71807,C1741,09/02/2024 16:43,2024-02-09 18:11:00,5.0,mobile
S71808,C1744,17/09/2024 15:20,2024-09-17 18:23:00,1.0,desktop
S71809,C1355,2023-07-19 02:04:00,2023-07-19 04:37:00,,mobile
S71810,C1579,2025-02-03 11:10:00,2025-02-03 12:51:00,5.0,desktop
S71811,C1536,15/11/2024 08:48,2024-11-15 10:18:00,4.0,android
S71812,C1194,2023-07-31 17:31:00,2023-07-31 21:14:00,3.0,android
S71813,C1406,2023-05-18 21:01:00,,1.0,android
S71814,C1795,31/03/2024 10:28,2024-03-31 12:30:00,4.0,web
S71815,C1162,2024-09-09 06:46:00,,2.0,desktop
S71816,C1052,10/04/2023 09:55,2023-04-10 13:18:00,1.0,desktop
S71817,C1468,28/10/2024 09:16,2024-10-28 13:07:00,5.0,android app
S71818,C1273,2024-10-31 19:17:00,2024-10-31 21:42:00,10.0,ios
S71819,C1636,28/04/2023 18:45,2023-04-28 20:05:00,,ios
S71820,C1521,2024-08-01 12:42:00,2024-08-01 13:43:00,5.0,android app
S71821,C1573,2023-10-04 10:43:00,2023-10-04 13:01:00,3.0,desktop
S71822,,2024-08-11 20:24:00,2024-08-11 21:10:00,2.0,ios
S71823,C1269,30/06/2023 20:16,2023-06-30 23:52:00,5.0,desktop
S71824,C1598,16/11/2024 06:35,2024-11-16 09:01:00,10.0,web
S71825,C1706,2023-10-12 00:36:00,2023-10-12 02:49:00,10.0,ios
S71826,C1741,03/01/2025 04:49,2025-01-03 06:59:00,4.0,web
S71827,C1328,2024-05-19 14:42:00,2024-05-19 16:49:00,1.0,desktop
S71828,C1613,18/03/2023 11:28,2023-03-18 14:19:00,,desktop
S71829,C1076,23/08/2023 21:40,2023-08-23 22:05:00,10.0,mobile
S71830,C1176,2024-02-28 16:21:00,2024-02-28 18:17:00,5.0,android app
S71831,C1398,06/01/2023 20:28,2023-01-07 00:22:00,2.0,mobile
S71832,C1004,2023-03-02 10:43:00,2023-03-02 11:46:00,2.0,mobile
S71833,C1592,23/04/2023 17:09,2023-04-23 19:45:00,4.0,web
S71834,C1152,24/12/2023 02:41,2023-12-24 06:20:00,,web
S71835,C1000,02/05/2023 00:12,2023-05-02 02:15:00,4.0,android
S71836,C1250,2023-04-02 20:34:00,2023-04-02 21:31:00,10.0,android
S71837,C1229,20/03/2024 14:08,2024-03-20 17:31:00,5.0,desktop
S71838,C1080,20/01/2023 15:22,,5.0,desktop
S71839,C1741,15/08/2024 03:17,2024-08-15 06:04:00,2.0,mobile
S71840,C1265,2023-10-12 23:23:00,2023-10-13 02:50:00,5.0,mobile
S71841,C1762,29/02/2024 13:58,2024-02-29 14:06:00,3.0,android app
S71842,C1443,21/03/2023 19:26,2023-03-21 22:09:00,,desktop
S71843,C1378,2024-02-17 23:29:00,2024-02-18 00:45:00,1.0,android
S71844,C1427,03/12/2024 12:50,2024-12-03 16:03:00,,android
S71845,C1703,2023-01-10 02:46:00,2023-01-10 06:26:00,3.0,android
S71846,C1362,07/12/2023 01:45,2023-12-07 02:08:00,,web
S71847,C1507,04/10/2023 07:17,2023-10-04 07:48:00,10.0,android app
S71848,C1732,02/01/2023 02:00,2023-01-02 04:26:00,1.0,web
S71849,C1122,2023-07-09 12:41:00,2023-07-09 16:17:00,10.0,mobile
S71850,C1777,16/01/2024 10:29,2024-01-16 11:06:00,2.0,android app
S71851,C1429,2024-01-23 22:19:00,2024-01-24 00:21:00,1.0,desktop
S71852,C1400,2024-04-17 11:26:00,2024-04-17 14:45:00,,desktop
S71853,C1362,19/10/2024 12:23,2024-10-19 13:15:00,,desktop
S71854,C1502,02/02/2025 14:56,2025-02-02 15:52:00,4.0,ios
S71855,C1524,2023-07-17 23:08:00,2023-07-17 23:56:00,3.0,web
S71856,C1646,25/08/2024 20:30,2024-08-26 00:12:00,1.0,android app
S71857,C1098,06/05/2024 09:05,2024-05-06 11:01:00,5.0,mobile
S71858,C1216,2025-02-21 01:21:00,2025-02-21 04:42:00,10.0,web
S71859,C1023,03/01/2023 13:33,2023-01-03 14:25:00,2.0,android app
S71860,C1292,2023-11-29 19:01:00,2023-11-29 19:55:00,4.0,android
S71861,C1588,09/02/2025 23:09,2025-02-09 23:45:00,1.0,web
S71862,C1638,05/09/2023 07:03,2023-09-05 08:23:00,,mobile
S71863,C1353,18/09/2024 09:57,2024-09-18 13:49:00,10.0,ios
S71864,C1058,2024-03-12 22:11:00,2024-03-13 00:27:00,3.0,android app
S71865,C1310,01/05/2023 09:44,2023-05-01 09:59:00,1.0,ios
S71866,C1240,11/05/2024 20:01,2024-05-11 19:58:00,10.0,web
S71867,C1513,2024-03-04 03:53:00,2024-03-04 03:59:00,5.0,mobile
S71868,C1583,20/01/2024 10:14,2024-01-20 13:39:00,2.0,android app
S71869,C1691,18/04/2024 07:53,,,desktop
S71870,C1771,2023-01-13 10:13:00,2023-01-13 11:20:00,10.0,desktop
S71871,C1405,05/03/2025 09:10,2025-03-05 11:55:00,,mobile
S71872,C1297,10/07/2024 19:00,2024-07-10 22:27:00,5.0,mobile
S71873,C1664,17/05/2024 22:33,2024-05-18 01:26:00,2.0,desktop
S71874,C1102,2023-03-13 20:57:00,2023-03-13 23:34:00,,web
S71875,C1407,2024-03-03 04:37:00,2024-03-03 05:41:00,3.0,android
S71876,C1277,2023-07-27 01:59:00,2023-07-27 05:49:00,10.0,android
S71877,C1360,2024-08-12 20:24:00,2024-08-12 22:50:00,2.0,android
S71878,C1040,2023-04-25 11:55:00,2023-04-25 15:21:00,5.0,android app
S71879,C1541,27/02/2023 15:07,2023-02-27 17:31:00,5.0,android app
S71880,C1394,2023-02-21 13:25:00,2023-02-21 16:11:00,10.0,android
S71881,C1147,05/05/2023 12:38,2023-05-05 15:05:00,4.0,mobile
S71882,C1741,25/02/2023 07:27,2023-02-25 09:21:00,,mobile
S71883,C1723,2024-04-15 01:21:00,2024-04-15 04:31:00,1.0,android app
S71884,C1577,13/08/2024 01:17,2024-08-13 04:33:00,,android app
S71885,C1330,2023-05-02 03:29:00,2023-05-02 06:17:00,1.0,ios
S71886,C1194,2024-11-03 18:40:00,2024-11-03 20:20:00,2.0,android
S71887,C1133,2024-11-28 15:28:00,2024-11-28 15:23:00,3.0,ios
S71888,C1787,2024-09-15 13:43:00,2024-09-15 17:21:00,3.0,android app
S71889,C1130,27/07/2023 03:38,2023-07-27 05:20:00,10.0,android app
S71890,C1231,12/08/2024 09:26,2024-08-12 11:33:00,1.0,android app
S71891,C1023,2024-03-29 01:36:00,2024-03-29 02:11:00,3.0,mobile
S71892,C1483,2024-09-28 12:43:00,2024-09-28 14:48:00,,android
S71893,C1151,2023-02-19 17:29:00,2023-02-19 20:48:00,4.0,android app
S71894,C1277,05/10/2023 19:26,2023-10-05 23:02:00,1.0,android
S71895,C1744,2023-03-12 04:09:00,2023-03-12 07:53:00,1.0,android app
S71896,C1565,11/09/2024 16:14,2024-09-11 16:30:00,4.0,android
S71897,C1500,19/01/2023 16:42,2023-01-19 16:56:00,2.0,android
S71898,C1394,2025-02-07 15:34:00,2025-02-07 18:47:00,4.0,desktop
S71899,C1260,13/06/2024 09:45,2024-06-13 13:42:00,4.0,android app
S71900,C1096,25/04/2024 14:54,2024-04-25 15:45:00,5.0,mobile
S71901,C1190,30/07/2024 17:32,2024-07-30 19:30:00,2.0,desktop
S71902,C1423,2024-05-31 04:16:00,2024-05-31 06:03:00,10.0,web
S71903,C1101,07/03/2025 06:29,2025-03-07 07:28:00,,mobile
S71904,C1222,23/12/2023 19:25,2023-12-23 19:49:00,2.0,android app
S71905,C1685,2024-06-27 23:25:00,2024-06-28 02:43:00,1.0,desktop
S71906,C1582,2024-07-04 21:27:00,2024-07-04 23:36:00,10.0,mobile
S71907,C1372,01/07/2023 14:16,2023-07-01 14:36:00,2.0,android app
S71908,C1797,2024-05-29 05:44:00,2024-05-29 06:25:00,2.0,ios
S71909,C1371,28/08/2023 00:55,2023-08-28 01:01:00,4.0,android app
S71910,C1501,2025-03-09 01:36:00,2025-03-09 04:04:00,4.0,android app
S71911,C1257,2024-12-31 14:04:00,2024-12-31 16:01:00,1.0,desktop
S71912,C1328,2023-11-29 08:31:00,2023-11-29 10:15:00,2.0,mobile
S71913,C1557,2023-12-07 18:22:00,2023-12-07 22:11:00,5.0,android
S71914,C1406,2023-01-17 03:51:00,2023-01-17 06:08:00,4.0,ios
S71915,C1121,19/07/2023 06:24,2023-07-19 10:23:00,3.0,mobile
S71916,C1516,08/04/2024 04:46,2024-04-08 04:41:00,5.0,android app
S71917,C1763,04/11/2024 02:04,2024-11-04 02:47:00,10.0,ios
S71918,C1013,02/12/2023 12:28,2023-12-02 15:17:00,5.0,mobile
S71919,C1704,22/02/2025 23:33,2025-02-23 03:29:00,2.0,mobile
S71920,C1330,09/03/2023 08:01,2023-03-09 10:11:00,5.0,android app
S71921,C1516,2024-07-02 05:58:00,2024-07-02 09:10:00,,android app
S71922,C1204,2024-07-01 05:18:00,2024-07-01 08:19:00,1.0,android
S71923,C1590,2025-02-09 12:19:00,2025-02-09 15:29:00,5.0,android
S71924,C1251,2024-09-15 20:53:00,2024-09-15 23:16:00,5.0,desktop
S71925,C1319,02/05/2023 20:15,2023-05-02 22:25:00,1.0,web
S71926,C1037,05/04/2024 02:26,2024-04-05 04:55:00,5.0,android app
S71927,C1530,30/11/2023 01:36,2023-11-30 02:01:00,4.0,desktop
S71928,C1224,13/10/2023 21:40,2023-10-13 22:48:00,2.0,desktop
S71929,C1377,2023-06-21 21:51:00,,3.0,mobile
S71930,C1277,10/08/2023 21:06,2023-08-11 00:56:00,5.0,desktop
S71931,C1648,18/01/2024 18:26,2024-01-18 19:42:00,3.0,mobile
S71932,C1285,2024-10-16 07:30:00,2024-10-16 08:15:00,2.0,android app
S71933,C1144,2024-07-05 02:50:00,2024-07-05 04:41:00,10.0,web
S71934,C1691,17/08/2023 03:56,2023-08-17 05:44:00,2.0,desktop
S71935,C1654,2024-10-31 19:04:00,,1.0,android
S71936,C1485,2024-01-09 03:32:00,2024-01-09 04:22:00,2.0,android app
S71937,C1527,14/01/2025 02:45,2025-01-14 05:58:00,2.0,desktop
S71938,C1543,05/09/2023 12:51,2023-09-05 16:20:00,,web
S71939,C1361,17/08/2024 00:01,2024-08-17 02:32:00,10.0,web
S71940,C1578,10/10/2023 14:38,2023-10-10 17:48:00,4.0,mobile
S71941,C1558,2023-02-19 09:27:00,2023-02-19 10:11:00,2.0,mobile
S71942,C1522,21/01/2025 09:18,2025-01-21 10:11:00,1.0,desktop
S71943,C1127,2024-09-04 08:03:00,2024-09-04 11:21:00,10.0,ios
S71944,C1603,27/02/2025 11:43,2025-02-27 12:21:00,3.0,android app
S71945,C1176,2024-07-13 02:21:00,2024-07-13 03:17:00,,android
S71946,C1015,2023-04-11 19:48:00,2023-04-11 23:39:00,4.0,web
S71947,C1443,2023-08-17 19:16:00,2023-08-17 19:32:00,2.0,android app
S71948,C1626,2023-06-09 15:35:00,2023-06-09 18:57:00,5.0,android
S71949,C1392,01/08/2024 02:55,2024-08-01 05:23:00,1.0,web
S71950,C1381,21/12/2024 20:04,2024-12-21 23:36:00,1.0,android
S71951,C1390,2024-09-29 21:10:00,2024-09-30 00:39:00,,desktop
S71952,C1627,20/03/2024 17:38,2024-03-20 20:48:00,2.0,android app
S71953,C1200,25/02/2023 00:39,2023-02-25 03:13:00,3.0,mobile
S71954,C1182,27/05/2024 13:43,2024-05-27 15:30:00,4.0,android
S71955,C1379,2023-02-21 20:27:00,2023-02-21 23:50:00,1.0,android app
S71956,C1680,2024-06-19 02:57:00,2024-06-19 06:43:00,5.0,mobile
S71957,C1612,2023-10-26 09:55:00,2023-10-26 13:49:00,,android
S71958,C1424,2023-03-24 13:57:00,2023-03-24 16:01:00,5.0,android app
S71959,C1145,2024-10-16 13:55:00,2024-10-16 15:33:00,3.0,web
S71960,C1469,2025-01-09 12:06:00,2025-01-09 15:46:00,5.0,web
S71961,C1446,16/04/2023 15:48,2023-04-16 16:53:00,3.0,web
S71962,C1704,22/04/2024 21:09,2024-04-22 23:03:00,4.0,ios
S71963,C1167,15/09/2024 08:10,2024-09-15 10:55:00,,mobile
S71964,C1142,03/01/2023 13:56,2023-01-03 15:30:00,2.0,android app
S71965,C1245,2024-04-25 01:35:00,2024-04-25 03:04:00,1.0,web
S71966,C1424,2023-01-31 10:47:00,2023-01-31 10:46:00,2.0,ios
S71967,C1551,2024-06-15 23:22:00,2024-06-16 02:29:00,5.0,android app
S71968,C1241,21/07/2024 04:17,2024-07-21 05:31:00,2.0,android
S71969,C1084,25/11/2024 00:16,2024-11-25 02:12:00,10.0,mobile
S71970,C1178,30/09/2024 20:30,2024-10-01 00:04:00,,ios
S71971,C1481,2024-05-11 22:43:00,2024-05-12 02:07:00,,web
S71972,C1348,26/08/2024 22:20,2024-08-27 00:34:00,3.0,android app
S71973,C1236,19/12/2024 15:11,2024-12-19 18:47:00,4.0,mobile
S71974,C1260,19/10/2023 00:02,2023-10-19 03:54:00,2.0,web
S71975,C1125,2023-08-25 01:12:00,2023-08-25 04:33:00,1.0,android
S71976,C1545,2023-03-27 11:04:00,2023-03-27 12:43:00,2.0,ios
S71977,C1210,03/02/2025 16:55,2025-02-03 18:14:00,,web
S71978,C1627,28/02/2024 02:28,2024-02-28 04:55:00,10.0,android
S71979,C1757,2023-12-22 18:35:00,2023-12-22 21:40:00,,mobile
S71980,C1621,15/09/2024 13:11,2024-09-15 16:10:00,1.0,web
S71981,C1720,02/03/2025 04:43,2025-03-02 05:17:00,2.0,ios
S71982,C1770,14/11/2023 19:19,,1.0,ios
S71983,C1352,2024-10-10 14:26:00,2024-10-10 17:13:00,3.0,android
S71984,C1347,2023-09-28 20:06:00,2023-09-28 20:45:00,10.0,android app
S71985,C1650,2024-09-16 08:37:00,2024-09-16 09:11:00,5.0,mobile
S71986,C1481,2023-12-21 16:59:00,2023-12-21 20:31:00,,ios
S71987,C1574,2023-08-05 05:23:00,2023-08-05 08:47:00,,desktop
S71988,C1766,19/03/2023 19:36,2023-03-19 21:37:00,4.0,mobile
S71989,C1797,08/02/2023 02:00,2023-02-08 03:45:00,5.0,web
S71990,C1033,2023-05-20 12:14:00,2023-05-20 13:39:00,5.0,web
S71991,C1164,2023-08-06 08:59:00,2023-08-06 10:20:00,2.0,android app
S71992,,2024-09-29 04:09:00,2024-09-29 08:00:00,,android app
S71993,C1137,29/03/2024 15:44,2024-03-29 19:37:00,2.0,ios
S71994,C1526,2025-02-17 15:03:00,2025-02-17 16:03:00,4.0,ios
S71995,C1018,28/06/2024 10:36,2024-06-28 12:09:00,10.0,mobile
S71996,C1090,2023-11-10 21:10:00,2023-11-11 00:58:00,10.0,ios
S71997,C1465,2024-03-08 16:11:00,2024-03-08 18:12:00,3.0,desktop
S71998,C1509,2023-08-29 19:42:00,2023-08-29 19:40:00,3.0,android app
S71999,C1082,31/01/2025 11:47,2025-01-31 13:07:00,2.0,mobile
S72000,C1694,15/01/2024 08:12,2024-01-15 11:20:00,2.0,desktop
S72001,C1027,2024-12-11 08:16:00,,5.0,ios
S72002,C1430,05/07/2024 05:05,2024-07-05 05:37:00,3.0,android app
S72003,C1133,2023-09-04 16:40:00,2023-09-04 18:51:00,1.0,ios
S72004,C1577,2023-01-05 03:07:00,2023-01-05 05:05:00,1.0,android
S72005,C1303,2023-11-17 20:54:00,2023-11-18 00:54:00,10.0,ios
S72006,C1371,2023-12-14 15:25:00,,10.0,mobile
S72007,C1018,08/09/2024 08:49,2024-09-08 11:56:00,,android
S72008,C1136,2023-04-13 21:23:00,2023-04-14 01:11:00,2.0,web
S72009,C1766,2023-04-16 06:39:00,2023-04-16 06:45:00,1.0,android app
S72010,C1395,2024-07-12 11:23:00,2024-07-12 12:45:00,2.0,android
S72011,C1676,12/09/2023 05:57,2023-09-12 06:39:00,1.0,web
S72012,C1776,29/07/2023 15:23,2023-07-29 18:01:00,10.0,desktop
S72013,C1585,15/01/2023 16:48,2023-01-15 20:10:00,2.0,android app
S72014,C1293,09/08/2023 19:31,,3.0,web
S72015,C1273,06/09/2023 03:29,2023-09-06 04:30:00,2.0,desktop
S72016,C1465,24/11/2023 05:52,2023-11-24 09:08:00,1.0,desktop
S72017,C1228,24/11/2023 04:43,2023-11-24 08:12:00,5.0,web
S72018,C1795,04/01/2025 07:09,2025-01-04 09:15:00,2.0,android app
S72019,C1373,13/10/2023 07:16,2023-10-13 10:22:00,3.0,android app
S72020,C1682,16/12/2024 04:06,2024-12-16 06:46:00,2.0,ios
S72021,C1218,2025-01-26 06:36:00,2025-01-26 07:38:00,10.0,android
S72022,C1284,2023-12-24 23:30:00,2023-12-25 02:40:00,5.0,ios
S72023,C1097,12/08/2024 13:20,2024-08-12 16:32:00,,desktop
S72024,C1657,2024-03-23 05:35:00,2024-03-23 06:04:00,3.0,desktop
S72025,C1288,07/01/2023 15:12,2023-01-07 15:48:00,10.0,android
S72026,C1713,17/08/2023 11:01,2023-08-17 11:10:00,10.0,android app
S72027,C1252,2023-01-13 13:45:00,2023-01-13 15:55:00,2.0,ios
S72028,C1636,23/09/2023 22:20,2023-09-24 00:26:00,3.0,android
S72029,C1074,2025-02-28 10:46:00,2025-02-28 14:27:00,10.0,android
S72030,C1031,19/06/2024 01:57,2024-06-19 05:18:00,10.0,ios
S72031,C1760,09/11/2023 16:10,2023-11-09 18:49:00,,ios
S72032,C1222,19/09/2024 09:02,2024-09-19 11:00:00,2.0,android app
S72033,C1190,02/05/2024 21:34,2024-05-03 00:43:00,5.0,web
S72034,C1244,13/06/2023 16:24,2023-06-13 16:20:00,5.0,ios
S72035,C1753,11/07/2023 11:47,2023-07-11 13:55:00,10.0,android
S72036,C1717,22/12/2023 16:28,2023-12-22 16:50:00,1.0,android
S72037,C1126,05/02/2025 05:36,2025-02-05 08:24:00,,mobile
S72038,C1541,13/07/2023 23:47,2023-07-14 01:27:00,4.0,web
S72039,C1441,07/04/2024 00:49,2024-04-07 03:28:00,5.0,android
S72040,C1678,14/03/2024 05:40,2024-03-14 07:33:00,3.0,mobile
S72041,C1766,17/10/2024 11:55,2024-10-17 15:40:00,1.0,web
S72042,C1437,02/06/2024 14:46,2024-06-02 17:46:00,2.0,desktop
S72043,C1479,2023-08-11 12:01:00,2023-08-11 15:18:00,3.0,android
S72044,C1586,2024-06-20 01:23:00,2024-06-20 02:06:00,3.0,web
S72045,C1652,27/12/2023 17:08,2023-12-27 19:26:00,,ios
S72046,C1051,2024-11-23 04:26:00,2024-11-23 04:35:00,3.0,mobile
S72047,C1434,28/05/2023 06:59,2023-05-28 07:04:00,5.0,desktop
S72048,C1432,2024-12-24 21:05:00,2024-12-24 21:19:00,2.0,desktop
S72049,C1655,23/02/2024 14:23,2024-02-23 14:34:00,3.0,android app
S72050,C1498,21/01/2023 02:05,2023-01-21 03:10:00,,web
S72051,C1762,2024-01-14 06:54:00,2024-01-14 08:52:00,2.0,desktop
S72052,C1263,19/05/2023 20:28,2023-05-19 23:11:00,3.0,web
S72053,C1481,2025-02-04 00:49:00,2025-02-04 01:38:00,4.0,ios
S72054,C1493,09/08/2023 09:49,2023-08-09 13:47:00,1.0,ios
S72055,C1661,08/04/2023 09:59,2023-04-08 12:58:00,2.0,mobile
S72056,C1649,2024-03-30 15:59:00,2024-03-30 19:11:00,,desktop
S72057,C1139,2023-12-12 12:54:00,2023-12-12 15:20:00,3.0,web
S72058,C1769,15/12/2024 17:32,2024-12-15 17:50:00,4.0,web
S72059,C1052,2024-12-14 21:26:00,2024-12-15 01:07:00,1.0,mobile
S72060,C1729,05/08/2023 23:31,2023-08-06 01:30:00,1.0,android
S72061,C1099,2023-04-02 07:28:00,2023-04-02 09:38:00,3.0,ios
S72062,C1081,2024-08-27 18:34:00,2024-08-27 21:00:00,1.0,android
S72063,C1677,28/04/2024 00:33,2024-04-28 03:52:00,10.0,mobile
S72064,C1062,01/02/2023 22:54,2023-02-02 01:32:00,1.0,ios
S72065,C1302,07/12/2023 07:32,2023-12-07 10:50:00,2.0,ios
S72066,C1001,2023-07-08 17:59:00,2023-07-08 18:37:00,4.0,android app
S72067,C1564,20/08/2024 17:47,2024-08-20 17:54:00,1.0,web
S72068,C1235,2023-03-19 05:45:00,,4.0,desktop
S72069,C1521,03/06/2023 20:50,2023-06-03 23:31:00,,ios
S72070,C1256,06/03/2025 07:42,2025-03-06 07:50:00,1.0,android
S72071,C1252,18/09/2024 12:51,2024-09-18 13:00:00,1.0,android
S72072,C1759,05/12/2023 14:44,2023-12-05 16:13:00,10.0,desktop
S72073,C1479,04/02/2025 11:54,2025-02-04 13:30:00,4.0,desktop
S72074,C1571,19/07/2023 20:31,2023-07-19 22:45:00,1.0,ios
S72075,C1177,16/02/2025 12:17,2025-02-16 14:26:00,3.0,mobile
S72076,C1403,23/10/2023 10:07,2023-10-23 10:12:00,1.0,ios
S72077,C1018,2023-06-12 20:20:00,2023-06-12 20:20:00,1.0,web
S72078,C1086,28/01/2024 04:10,2024-01-28 07:17:00,2.0,mobile
S72079,C1657,2023-06-06 00:34:00,2023-06-06 01:12:00,10.0,ios
S72080,C1559,2024-11-03 06:50:00,2024-11-03 07:40:00,,android
S72081,C1457,2023-10-15 13:53:00,,1.0,desktop
S72082,C1480,2023-09-20 21:17:00,,,web
S72083,C1728,15/05/2023 18:36,2023-05-15 22:19:00,5.0,web
S72084,C1487,2024-12-04 23:24:00,2024-12-05 01:43:00,2.0,android app
S72085,,05/05/2023 06:33,2023-05-05 06:56:00,1.0,ios
S72086,C1635,28/02/2023 14:04,2023-02-28 15:50:00,5.0,android
S72087,C1771,26/07/2024 21:56,2024-07-27 01:26:00,1.0,web
S72088,C1354,2024-01-21 01:58:00,2024-01-21 02:21:00,3.0,android
S72089,C1659,16/01/2025 13:36,2025-01-16 13:51:00,,ios
S72090,C1227,29/08/2024 20:12,2024-08-29 20:52:00,5.0,mobile
S72091,C1192,11/09/2024 19:16,2024-09-11 20:43:00,1.0,android
S72092,C1764,15/12/2023 02:02,2023-12-15 05:14:00,2.0,android
S72093,C1289,2024-01-29 21:54:00,2024-01-29 23:58:00,10.0,ios
S72094,C1145,2024-06-25 06:33:00,2024-06-25 08:22:00,2.0,web
S72095,C1136,07/01/2025 04:39,2025-01-07 08:17:00,4.0,web
S72096,C1332,2023-05-25 02:24:00,2023-05-25 02:58:00,,android app
S72097,C1216,30/05/2023 18:33,2023-05-30 19:45:00,,android
S72098,C1605,18/01/2025 12:00,2025-01-18 13:18:00,1.0,mobile
S72099,C1231,10/11/2023 22:11,2023-11-11 02:02:00,10.0,mobile
S72100,C1630,11/05/2024 16:23,2024-05-11 16:39:00,,android
S72101,C1132,2024-12-18 15:50:00,2024-12-18 19:07:00,2.0,android app
S72102,C1137,2023-04-19 01:15:00,2023-04-19 02:17:00,10.0,android
S72103,C1270,2024-03-07 20:12:00,2024-03-07 23:05:00,4.0,android app
S72104,C1131,11/10/2024 00:23,2024-10-11 01:42:00,1.0,mobile
S72105,C1368,2024-01-21 19:21:00,2024-01-21 20:20:00,10.0,mobile
S72106,C1782,28/10/2024 20:48,2024-10-28 21:45:00,3.0,mobile
S72107,C1504,01/03/2024 05:20,2024-03-01 08:03:00,4.0,desktop
S72108,C1488,03/10/2024 01:43,2024-10-03 03:46:00,4.0,ios
S72109,C1461,2024-08-18 12:39:00,2024-08-18 16:10:00,10.0,mobile
S72110,C1788,04/11/2023 02:08,2023-11-04 02:42:00,1.0,ios
S72111,C1185,08/08/2023 10:10,2023-08-08 10:57:00,5.0,desktop
S72112,C1466,2024-07-14 16:34:00,2024-07-14 17:29:00,1.0,android
S72113,C1467,21/09/2024 18:43,2024-09-21 20:26:00,,desktop
S72114,C1258,2023-01-02 21:35:00,2023-01-02 23:28:00,3.0,android app
S72115,C1370,2024-06-10 16:59:00,2024-06-10 17:36:00,2.0,android
S72116,C1456,2024-01-28 00:33:00,2024-01-28 02:49:00,1.0,ios
S72117,C1690,2023-03-12 02:56:00,2023-03-12 05:28:00,1.0,web
S72118,C1347,04/01/2023 14:06,2023-01-04 17:51:00,3.0,android
S72119,C1049,2023-10-17 19:47:00,2023-10-17 19:50:00,10.0,android
S72120,C1168,2023-06-28 06:45:00,2023-06-28 08:26:00,4.0,ios
S72121,C1109,2024-02-14 00:15:00,2024-02-14 02:01:00,2.0,android
S72122,C1674,09/03/2025 13:32,2025-03-09 16:08:00,2.0,desktop
S72123,C1533,2023-01-31 16:41:00,2023-01-31 18:27:00,10.0,android app
S72124,C1538,08/12/2023 17:42,2023-12-08 20:10:00,1.0,desktop
S72125,C1352,01/06/2024 09:16,,,desktop
S72126,C1191,11/03/2025 08:13,2025-03-11 09:54:00,3.0,android
S72127,C1095,2024-05-14 04:49:00,2024-05-14 05:49:00,,android app
S72128,C1102,26/04/2023 06:11,2023-04-26 09:43:00,3.0,desktop
S72129,C1288,17/03/2024 22:45,2024-03-18 00:24:00,3.0,ios
S72130,C1538,21/05/2024 15:54,2024-05-21 19:51:00,1.0,mobile
S72131,C1316,2024-03-02 06:55:00,2024-03-02 10:40:00,10.0,ios
S72132,C1442,2024-07-26 07:49:00,2024-07-26 08:34:00,3.0,mobile
S72133,C1035,16/03/2023 22:37,2023-03-17 01:43:00,5.0,mobile
S72134,C1232,2023-03-19 21:59:00,2023-03-19 22:38:00,5.0,ios
S72135,C1728,31/05/2024 01:51,2024-05-31 02:23:00,,mobile
S72136,C1387,2023-11-08 07:32:00,2023-11-08 10:43:00,4.0,ios
S72137,C1194,01/11/2023 22:15,2023-11-01 23:15:00,,desktop
S72138,C1543,17/02/2023 18:30,2023-02-17 19:39:00,2.0,ios
S72139,C1235,2024-08-06 15:21:00,2024-08-06 18:32:00,5.0,android app
S72140,C1596,2025-02-28 12:32:00,2025-02-28 15:23:00,3.0,android app
S72141,C1405,03/01/2025 08:11,2025-01-03 10:51:00,1.0,mobile
S72142,C1728,01/05/2023 17:07,2023-05-01 17:09:00,10.0,web
S72143,C1784,2024-07-23 01:04:00,2024-07-23 01:24:00,,android app
S72144,C1547,2024-06-22 23:30:00,2024-06-23 01:11:00,3.0,android
S72145,C1500,13/10/2023 14:10,2023-10-13 17:55:00,2.0,android
S72146,C1555,04/09/2024 02:45,2024-09-04 03:24:00,2.0,mobile
S72147,C1517,2024-12-10 07:06:00,2024-12-10 08:19:00,,android app
S72148,C1304,2023-05-06 05:24:00,2023-05-06 06:14:00,3.0,ios
S72149,C1180,01/01/2024 19:44,2024-01-01 23:06:00,2.0,mobile
S72150,,27/03/2024 09:24,2024-03-27 11:33:00,5.0,desktop
S72151,C1016,08/01/2023 06:03,2023-01-08 09:26:00,3.0,ios
S72152,C1776,15/05/2023 21:13,2023-05-15 22:25:00,5.0,desktop
S72153,C1766,2023-04-20 04:04:00,2023-04-20 04:00:00,,mobile
S72154,C1683,16/05/2024 16:07,2024-05-16 18:39:00,5.0,web
S72155,C1292,03/04/2024 00:19,2024-04-03 01:13:00,,desktop
S72156,C1473,01/07/2023 22:15,2023-07-01 23:51:00,1.0,android
S72157,C1339,2023-05-24 15:54:00,2023-05-24 17:22:00,10.0,ios
S72158,C1704,19/11/2023 16:34,2023-11-19 16:31:00,1.0,android app
S72159,C1640,2024-07-18 02:55:00,2024-07-18 03:19:00,1.0,android app
S72160,C1708,23/03/2023 17:20,2023-03-23 19:30:00,1.0,desktop
S72161,C1601,2024-09-17 05:01:00,2024-09-17 05:35:00,2.0,web
S72162,C1790,2024-02-29 06:01:00,2024-02-29 08:32:00,3.0,mobile
S72163,C1573,2023-09-25 03:24:00,2023-09-25 03:47:00,3.0,android
S72164,C1252,2023-12-19 04:55:00,2023-12-19 07:54:00,4.0,android app
S72165,C1377,2024-04-09 05:56:00,,,web
S72166,C1679,10/02/2024 02:35,2024-02-10 06:19:00,5.0,ios
S72167,C1515,2024-08-03 03:00:00,2024-08-03 04:28:00,1.0,android app
S72168,C1608,2024-08-11 11:14:00,2024-08-11 14:38:00,10.0,android
S72169,C1318,2023-04-10 01:01:00,2023-04-10 04:10:00,2.0,web
S72170,C1457,2023-03-13 14:38:00,2023-03-13 16:07:00,1.0,web
S72171,C1770,2024-11-05 05:48:00,2024-11-05 08:17:00,5.0,web
S72172,C1486,2023-11-28 02:14:00,2023-11-28 04:53:00,5.0,android app
S72173,C1057,2024-02-11 20:10:00,2024-02-11 20:08:00,1.0,mobile
S72174,C1392,2023-06-09 06:34:00,2023-06-09 07:26:00,2.0,web
S72175,C1590,29/10/2024 00:04,2024-10-29 01:24:00,4.0,android
S72176,C1718,2023-08-09 21:28:00,2023-08-09 23:17:00,10.0,ios
S72177,C1739,2023-02-02 05:01:00,2023-02-02 07:17:00,1.0,desktop
S72178,C1250,02/08/2024 20:56,2024-08-02 22:28:00,,mobile
S72179,C1698,27/07/2024 02:53,2024-07-27 06:31:00,4.0,ios
S72180,C1603,03/09/2024 09:00,2024-09-03 09:52:00,10.0,desktop
S72181,C1181,18/03/2023 08:24,2023-03-18 09:38:00,2.0,web
S72182,C1538,22/09/2024 12:05,2024-09-22 13:57:00,3.0,mobile
S72183,C1348,22/12/2024 07:52,2024-12-22 09:55:00,,ios
S72184,C1247,17/02/2024 01:59,2024-02-17 03:04:00,1.0,android app
S72185,C1133,2024-04-21 15:09:00,2024-04-21 15:51:00,4.0,desktop
S72186,C1660,17/05/2024 05:02,2024-05-17 05:31:00,5.0,mobile
S72187,C1654,2024-10-09 23:18:00,,4.0,desktop
S72188,C1055,2024-01-09 01:44:00,2024-01-09 02:44:00,10.0,ios
S72189,C1153,2024-12-31 18:35:00,2024-12-31 19:42:00,2.0,android
S72190,C1324,2023-01-08 13:47:00,2023-01-08 17:15:00,10.0,android
S72191,C1317,2023-07-29 22:43:00,2023-07-29 22:54:00,4.0,ios
S72192,C1417,2023-12-26 07:15:00,2023-12-26 10:15:00,2.0,desktop
S72193,C1083,2023-07-31 11:01:00,2023-07-31 13:28:00,,android app
S72194,C1429,2023-04-25 12:45:00,2023-04-25 16:23:00,1.0,android app
S72195,C1729,2023-07-11 13:08:00,2023-07-11 15:51:00,4.0,android app
S72196,C1681,30/11/2023 02:02,2023-11-30 05:19:00,5.0,android app
S72197,C1720,16/11/2023 18:17,2023-11-16 19:38:00,2.0,android
S72198,C1660,22/01/2024 03:31,2024-01-22 05:29:00,,mobile
S72199,C1485,2023-09-08 01:56:00,2023-09-08 03:16:00,,android
S72200,C1606,07/01/2024 21:04,2024-01-07 23:23:00,5.0,android
S72201,C1296,2025-01-16 10:06:00,2025-01-16 10:48:00,,android app
S72202,C1421,31/07/2023 07:42,2023-07-31 10:34:00,3.0,web
S72203,C1764,09/05/2023 00:37,2023-05-09 04:32:00,3.0,mobile
S72204,C1455,10/02/2024 14:12,2024-02-10 14:09:00,1.0,android app
S72205,C1660,2023-02-26 18:53:00,2023-02-26 21:24:00,4.0,web
S72206,C1463,2023-06-03 09:00:00,2023-06-03 12:27:00,,ios
S72207,C1537,04/05/2024 09:05,2024-05-04 10:22:00,,android app
S72208,C1680,15/10/2024 06:21,2024-10-15 08:40:00,10.0,desktop
S72209,C1069,03/08/2024 20:43,,3.0,ios
S72210,C1532,05/03/2024 13:21,2024-03-05 15:35:00,4.0,ios
S72211,C1779,02/09/2023 07:36,2023-09-02 10:41:00,4.0,android
S72212,C1583,2023-02-21 07:50:00,2023-02-21 11:05:00,2.0,mobile
S72213,C1529,29/01/2024 07:42,2024-01-29 11:02:00,2.0,desktop
S72214,,2024-06-13 11:30:00,2024-06-13 11:33:00,10.0,desktop
S72215,C1444,2023-10-12 06:14:00,2023-10-12 06:41:00,10.0,android app
S72216,C1220,11/09/2024 03:37,2024-09-11 07:33:00,2.0,android
S72217,C1734,2023-11-24 16:01:00,2023-11-24 18:44:00,2.0,desktop
S72218,C1424,2024-12-20 00:01:00,2024-12-20 02:53:00,2.0,ios
S72219,C1764,19/07/2024 09:06,2024-07-19 11:05:00,10.0,desktop
S72220,C1080,06/02/2024 04:43,2024-02-06 05:22:00,,android app
S72221,C1230,22/01/2024 15:23,2024-01-22 16:50:00,5.0,desktop
S72222,C1587,14/02/2023 02:45,2023-02-14 06:06:00,1.0,web
S72223,C1333,14/11/2023 13:33,2023-11-14 13:52:00,10.0,web
S72224,C1633,2023-09-04 20:07:00,2023-09-04 21:31:00,1.0,ios
S72225,C1735,2023-10-02 12:23:00,2023-10-02 13:10:00,3.0,android
S72226,C1297,06/01/2023 00:14,2023-01-06 00:45:00,3.0,android
S72227,C1798,14/08/2024 08:49,2024-08-14 09:15:00,3.0,web
S72228,C1652,2024-10-10 11:55:00,2024-10-10 14:18:00,3.0,android app
S72229,C1335,05/01/2024 16:45,2024-01-05 18:46:00,5.0,ios
S72230,,22/11/2024 23:45,2024-11-23 03:38:00,1.0,mobile
S72231,C1599,2023-10-25 12:55:00,2023-10-25 15:45:00,5.0,mobile
S72232,C1138,2025-01-30 09:41:00,2025-01-30 12:34:00,10.0,android
S72233,C1721,15/06/2023 01:06,2023-06-15 01:22:00,1.0,android app
S72234,C1066,2024-05-29 03:48:00,2024-05-29 04:54:00,5.0,mobile
S72235,C1117,23/10/2024 19:01,2024-10-23 19:36:00,10.0,ios
S72236,C1729,24/05/2023 06:10,2023-05-24 07:53:00,,android app
S72237,C1573,03/01/2023 03:24,2023-01-03 06:38:00,2.0,web
S72238,C1343,23/12/2023 03:38,2023-12-23 06:49:00,2.0,web
S72239,C1766,18/06/2024 17:59,2024-06-18 20:31:00,2.0,android
S72240,C1448,2024-09-10 00:25:00,2024-09-10 02:36:00,10.0,desktop
S72241,C1177,31/01/2025 00:53,2025-01-31 03:10:00,3.0,mobile
S72242,C1235,31/08/2024 03:54,2024-08-31 05:49:00,4.0,android app
S72243,C1647,13/05/2024 11:02,2024-05-13 11:53:00,4.0,desktop
S72244,C1340,12/04/2024 10:07,2024-04-12 10:37:00,1.0,desktop
S72245,C1645,2025-01-30 18:59:00,2025-01-30 22:34:00,10.0,android app
S72246,C1052,2023-06-15 12:52:00,,4.0,ios
S72247,C1089,2024-04-17 15:40:00,2024-04-17 16:01:00,10.0,desktop
S72248,C1633,29/12/2023 00:17,2023-12-29 03:19:00,5.0,android app
S72249,C1287,2024-02-15 03:56:00,2024-02-15 06:59:00,4.0,android
S72250,C1471,2024-02-05 20:10:00,2024-02-05 23:45:00,3.0,android app
S72251,C1218,2024-11-08 04:43:00,2024-11-08 05:51:00,,android
S72252,C1506,14/10/2024 16:40,2024-10-14 17:00:00,,web
S72253,C1499,18/10/2023 06:46,2023-10-18 08:18:00,,desktop
S72254,C1584,2024-09-10 21:27:00,2024-09-10 22:43:00,3.0,web
S72255,C1432,2023-12-21 13:34:00,2023-12-21 16:40:00,,mobile
S72256,C1140,2025-01-31 20:35:00,2025-01-31 20:40:00,4.0,desktop
S72257,C1410,2025-02-15 20:31:00,2025-02-15 23:46:00,1.0,desktop
S72258,C1690,2023-06-18 00:09:00,2023-06-18 01:48:00,2.0,mobile
S72259,C1201,2023-01-04 08:54:00,2023-01-04 10:23:00,10.0,web
S72260,C1517,2024-07-23 15:05:00,2024-07-23 18:41:00,2.0,mobile
S72261,,2023-01-31 07:24:00,2023-01-31 07:41:00,4.0,android app
S72262,C1597,2024-11-20 10:14:00,2024-11-20 11:00:00,10.0,web
S72263,C1388,19/10/2023 15:24,2023-10-19 18:27:00,,mobile
S72264,C1361,2025-02-09 09:05:00,2025-02-09 11:11:00,4.0,web
S72265,C1299,2023-09-16 09:50:00,2023-09-16 10:59:00,5.0,android app
S72266,C1784,27/05/2023 23:45,2023-05-28 03:44:00,3.0,android app
S72267,C1576,2025-02-03 15:07:00,2025-02-03 15:52:00,1.0,web
S72268,C1637,2024-12-03 18:59:00,2024-12-03 20:08:00,,android app
S72269,C1505,24/03/2024 09:21,2024-03-24 12:31:00,4.0,desktop
S72270,C1695,12/08/2023 02:55,2023-08-12 06:45:00,3.0,web
S72271,C1475,2023-10-31 11:37:00,2023-10-31 12:47:00,4.0,desktop
S72272,C1583,13/01/2024 11:00,2024-01-13 12:23:00,,web
S72273,C1087,27/07/2024 01:03,2024-07-27 01:22:00,4.0,mobile
S72274,C1724,2023-05-29 20:39:00,2023-05-29 21:18:00,3.0,mobile
S72275,C1490,19/01/2023 13:46,2023-01-19 17:44:00,2.0,desktop
S72276,C1567,19/08/2024 11:19,2024-08-19 11:24:00,3.0,ios
S72277,C1642,2024-04-26 06:20:00,2024-04-26 08:13:00,10.0,android
S72278,C1646,2024-03-10 08:08:00,2024-03-10 09:46:00,,web
S72279,C1157,04/04/2024 22:08,2024-04-04 22:17:00,2.0,android app
S72280,C1138,2024-08-30 08:13:00,,10.0,ios
S72281,C1020,2024-02-27 20:05:00,2024-02-27 20:11:00,4.0,android
S72282,C1045,08/02/2023 19:01,2023-02-08 20:27:00,1.0,android
S72283,C1563,02/08/2024 16:10,2024-08-02 19:07:00,2.0,ios
S72284,C1735,25/09/2023 10:03,2023-09-25 10:10:00,4.0,android
S72285,C1660,22/10/2024 16:07,2024-10-22 17:37:00,3.0,desktop
S72286,C1126,2023-09-28 22:27:00,2023-09-29 00:00:00,,android app
S72287,C1023,2024-11-11 09:28:00,2024-11-11 13:04:00,1.0,desktop
S72288,,2023-02-12 04:53:00,2023-02-12 05:04:00,2.0,desktop
S72289,C1030,2023-07-22 13:00:00,2023-07-22 15:47:00,,android app
S72290,C1099,2024-03-26 09:07:00,2024-03-26 10:53:00,5.0,android app
S72291,C1760,2024-05-18 01:50:00,2024-05-18 02:38:00,3.0,android
S72292,C1261,14/03/2024 00:10,2024-03-14 01:44:00,1.0,web
S72293,C1182,2023-06-27 11:10:00,,1.0,android
S72294,C1516,10/12/2023 10:58,2023-12-10 11:32:00,1.0,android
S72295,C1417,2023-07-27 21:42:00,2023-07-27 23:16:00,10.0,mobile
S72296,C1683,24/03/2023 06:16,2023-03-24 08:32:00,1.0,android
S72297,C1426,30/01/2025 02:28,2025-01-30 05:16:00,5.0,desktop
S72298,C1610,07/03/2024 05:11,2024-03-07 07:08:00,1.0,android
S72299,C1059,2024-07-13 00:58:00,2024-07-13 03:24:00,5.0,mobile
S72300,C1404,2024-08-12 11:19:00,2024-08-12 14:53:00,1.0,android
S72301,C1186,12/03/2023 15:23,2023-03-12 19:02:00,5.0,mobile
S72302,C1327,30/09/2023 21:02,2023-09-30 22:22:00,1.0,web
S72303,C1087,09/04/2023 12:15,2023-04-09 16:14:00,1.0,ios
S72304,C1329,04/04/2024 19:02,2024-04-04 20:53:00,4.0,desktop
S72305,C1500,26/12/2023 17:17,,5.0,web
S72306,C1331,21/07/2024 05:35,2024-07-21 07:20:00,10.0,ios
S72307,C1600,2023-04-27 14:12:00,2023-04-27 15:28:00,10.0,mobile
S72308,C1348,2024-09-20 06:13:00,2024-09-20 06:41:00,3.0,android
S72309,C1110,2025-02-12 19:47:00,2025-02-12 21:07:00,2.0,desktop
S72310,C1259,2024-02-20 19:40:00,2024-02-20 20:32:00,2.0,android
S72311,C1596,2023-04-16 00:48:00,2023-04-16 04:06:00,,ios
S72312,C1785,2025-02-20 17:10:00,2025-02-20 18:31:00,,desktop
S72313,C1772,2024-08-22 13:41:00,2024-08-22 17:38:00,4.0,mobile
S72314,C1779,07/11/2024 11:27,2024-11-07 11:43:00,,android
S72315,C1043,22/04/2023 04:51,2023-04-22 06:43:00,3.0,android
S72316,C1578,2023-03-04 12:18:00,2023-03-04 13:14:00,3.0,mobile
S72317,C1716,31/01/2024 08:46,2024-01-31 12:04:00,10.0,ios
S72318,C1407,23/02/2024 15:24,2024-02-23 17:08:00,,mobile
S72319,C1455,23/09/2023 14:35,2023-09-23 15:58:00,3.0,android
S72320,C1100,2023-12-31 12:10:00,2023-12-31 14:10:00,4.0,desktop
S72321,C1647,2023-12-05 01:35:00,2023-12-05 01:53:00,,android
S72322,C1714,25/09/2023 11:03,2023-09-25 12:20:00,4.0,ios
S72323,,01/02/2025 21:04,2025-02-01 22:25:00,1.0,ios
S72324,C1686,2024-10-26 09:15:00,2024-10-26 09:38:00,4.0,mobile
S72325,C1014,2024-08-10 18:36:00,2024-08-10 21:47:00,3.0,android app
S72326,C1679,08/06/2023 11:29,2023-06-08 12:13:00,4.0,mobile
S72327,C1523,16/01/2023 18:37,2023-01-16 22:14:00,10.0,mobile
S72328,C1008,24/06/2023 16:27,2023-06-24 17:21:00,,android app
S72329,C1001,03/05/2023 00:09,,2.0,android app
S72330,C1730,2024-06-17 11:40:00,2024-06-17 14:37:00,4.0,android app
S72331,C1271,2023-12-09 03:16:00,2023-12-09 04:57:00,,desktop
S72332,C1646,02/09/2023 16:43,2023-09-02 18:30:00,3.0,ios
S72333,C1361,2023-06-06 10:43:00,2023-06-06 13:48:00,3.0,ios
S72334,C1527,2023-12-08 04:00:00,2023-12-08 05:12:00,10.0,android app
S72335,C1711,2023-09-10 05:59:00,2023-09-10 06:23:00,5.0,ios
S72336,C1495,2024-11-19 23:34:00,2024-11-20 01:51:00,10.0,mobile
S72337,C1187,2025-02-18 13:21:00,2025-02-18 13:48:00,3.0,android app
S72338,C1279,31/07/2024 03:34,2024-07-31 07:29:00,4.0,ios
S72339,C1160,19/02/2025 03:55,2025-02-19 04:00:00,,android app
S72340,C1674,2024-07-30 16:02:00,2024-07-30 19:13:00,1.0,android app
S72341,C1178,2025-03-08 11:11:00,2025-03-08 12:25:00,,desktop
S72342,C1495,2024-06-26 06:51:00,2024-06-26 06:59:00,5.0,desktop
S72343,C1689,2024-09-11 01:54:00,2024-09-11 03:11:00,10.0,ios
S72344,C1656,13/12/2023 06:00,2023-12-13 09:50:00,4.0,desktop
S72345,C1300,2024-03-19 15:14:00,2024-03-19 17:28:00,4.0,android app
S72346,C1737,16/01/2023 23:42,2023-01-17 03:23:00,4.0,web
S72347,C1708,2024-07-08 07:51:00,2024-07-08 08:08:00,2.0,android app
S72348,C1603,2023-02-24 07:35:00,2023-02-24 10:14:00,,android
S72349,C1403,23/06/2024 09:01,2024-06-23 12:52:00,,desktop
S72350,C1433,18/04/2023 23:27,2023-04-19 03:03:00,,web
S72351,C1357,2024-10-14 15:29:00,,3.0,ios
S72352,C1720,16/02/2024 18:09,2024-02-16 18:38:00,5.0,desktop
S72353,C1675,13/12/2024 22:55,2024-12-14 01:28:00,4.0,ios
S72354,C1131,2023-03-08 18:55:00,2023-03-08 20:23:00,4.0,mobile
S72355,C1634,24/10/2024 03:47,2024-10-24 06:59:00,1.0,ios
S72356,C1304,18/01/2023 10:00,2023-01-18 12:36:00,1.0,mobile
S72357,C1528,2024-05-16 03:37:00,2024-05-16 04:31:00,2.0,ios
S72358,C1203,14/04/2024 01:38,2024-04-14 04:27:00,4.0,ios
S72359,C1045,29/12/2023 15:18,2023-12-29 18:49:00,1.0,web
S72360,C1353,16/02/2025 09:22,2025-02-16 13:06:00,10.0,android
S72361,C1117,24/12/2024 08:01,2024-12-24 10:25:00,4.0,web
S72362,C1467,22/03/2024 18:07,2024-03-22 21:17:00,1.0,android
S72363,C1127,13/11/2023 07:32,2023-11-13 10:27:00,1.0,web
S72364,C1600,10/04/2024 13:30,2024-04-10 17:19:00,3.0,web
S72365,C1475,2023-08-01 17:41:00,2023-08-01 18:38:00,3.0,desktop
S72366,C1159,2023-11-09 07:07:00,2023-11-09 07:48:00,4.0,desktop
S72367,C1760,2025-03-01 22:59:00,2025-03-02 02:49:00,4.0,mobile
S72368,C1339,2024-10-10 10:47:00,2024-10-10 14:37:00,2.0,web
S72369,C1065,17/01/2024 13:31,2024-01-17 16:16:00,1.0,ios
S72370,C1184,10/03/2024 19:20,2024-03-10 20:27:00,4.0,desktop
S72371,C1668,05/09/2024 14:39,2024-09-05 18:09:00,5.0,android app
S72372,C1222,2023-06-17 18:24:00,2023-06-17 21:41:00,5.0,ios
S72373,C1262,2023-07-04 23:26:00,2023-07-05 02:05:00,5.0,ios
S72374,C1210,2023-08-21 05:45:00,2023-08-21 07:51:00,3.0,android app
S72375,C1777,2024-05-02 06:10:00,2024-05-02 08:45:00,10.0,desktop
S72376,C1240,28/09/2023 07:31,2023-09-28 10:33:00,3.0,ios
S72377,C1335,2025-02-13 01:12:00,2025-02-13 03:09:00,1.0,web
S72378,C1237,23/11/2024 20:39,2024-11-23 23:07:00,1.0,ios
S72379,C1442,22/03/2023 18:42,2023-03-22 21:11:00,,android app
S72380,C1474,11/02/2023 10:26,2023-02-11 13:06:00,,android
S72381,C1382,20/02/2024 10:43,2024-02-20 12:14:00,5.0,desktop
S72382,C1691,2023-04-22 08:04:00,2023-04-22 08:44:00,,mobile
S72383,C1458,02/12/2024 07:19,2024-12-02 09:40:00,,android app
S72384,C1696,15/07/2023 00:57,2023-07-15 03:09:00,,desktop
S72385,C1495,04/04/2024 12:33,2024-04-04 15:33:00,,desktop
S72386,C1509,29/10/2024 07:09,2024-10-29 11:06:00,2.0,ios
S72387,C1454,2024-08-14 16:28:00,2024-08-14 18:04:00,4.0,android
S72388,C1217,2024-01-29 22:35:00,2024-01-30 00:48:00,10.0,android
S72389,C1256,2023-03-29 20:40:00,2023-03-29 21:52:00,2.0,web
S72390,C1739,2025-02-05 13:02:00,,2.0,ios
S72391,,2023-12-29 23:40:00,2023-12-30 00:59:00,1.0,desktop
S72392,C1133,30/03/2023 18:06,2023-03-30 18:13:00,3.0,mobile
S72393,C1397,27/04/2024 00:10,2024-04-27 00:29:00,3.0,mobile
S72394,C1787,28/11/2024 08:11,,4.0,ios
S72395,C1342,2023-09-01 13:47:00,2023-09-01 14:06:00,,mobile
S72396,C1544,04/09/2023 14:16,2023-09-04 14:56:00,,android
S72397,C1493,2025-01-16 21:13:00,2025-01-16 22:43:00,4.0,ios
S72398,C1330,2024-04-18 07:34:00,2024-04-18 10:31:00,10.0,android
S72399,C1049,16/02/2023 02:13,2023-02-16 05:04:00,1.0,web
S72400,C1211,19/03/2023 16:16,2023-03-19 19:32:00,10.0,desktop
S72401,C1681,2023-07-17 09:04:00,2023-07-17 12:12:00,10.0,android
S72402,C1071,2023-07-12 11:55:00,2023-07-12 13:07:00,,android app
S72403,C1009,21/11/2024 15:45,2024-11-21 19:44:00,4.0,android
S72404,C1306,2023-05-03 13:47:00,2023-05-03 13:59:00,2.0,desktop
S72405,C1725,2024-07-29 04:26:00,2024-07-29 06:15:00,4.0,ios
S72406,C1662,08/05/2023 02:06,2023-05-08 02:30:00,10.0,mobile
S72407,C1604,28/01/2025 09:29,2025-01-28 12:05:00,3.0,ios
S72408,C1448,2024-01-26 05:01:00,2024-01-26 06:07:00,10.0,mobile
S72409,C1613,2024-03-31 06:16:00,2024-03-31 06:41:00,3.0,desktop
S72410,C1094,2024-04-17 17:30:00,2024-04-17 20:15:00,5.0,desktop
S72411,C1262,2025-02-07 07:46:00,2025-02-07 11:26:00,3.0,android
S72412,C1001,2023-12-19 09:07:00,2023-12-19 11:46:00,5.0,android
S72413,C1481,15/10/2023 10:59,2023-10-15 12:26:00,2.0,web
S72414,C1488,2023-12-24 13:55:00,2023-12-24 17:43:00,1.0,web
S72415,C1076,2023-11-09 14:57:00,2023-11-09 16:16:00,5.0,web
S72416,C1644,18/07/2023 02:41,2023-07-18 05:55:00,1.0,mobile
S72417,C1702,2023-04-11 12:32:00,2023-04-11 15:20:00,4.0,web
S72418,C1642,30/06/2024 10:37,2024-06-30 13:35:00,3.0,mobile
S72419,C1186,30/06/2023 12:25,2023-06-30 15:44:00,4.0,desktop
S72420,C1522,25/08/2023 15:40,2023-08-25 15:54:00,2.0,android app
S72421,C1030,13/01/2025 00:00,2025-01-13 00:33:00,3.0,web
S72422,,2024-07-12 20:33:00,2024-07-12 23:08:00,4.0,web
S72423,C1422,10/09/2024 08:14,2024-09-10 10:35:00,4.0,ios
S72424,C1087,15/07/2024 06:02,2024-07-15 06:16:00,,ios
S72425,C1676,2023-05-08 09:35:00,2023-05-08 11:30:00,5.0,desktop
S72426,C1590,2024-11-14 11:30:00,2024-11-14 14:31:00,3.0,desktop
S72427,C1610,03/06/2024 23:56,2024-06-04 03:53:00,10.0,android
S72428,C1036,17/04/2023 12:23,2023-04-17 12:26:00,,web
S72429,C1492,2024-03-19 00:33:00,2024-03-19 02:34:00,3.0,android
S72430,C1270,2024-06-26 01:56:00,2024-06-26 02:11:00,10.0,android app
S72431,C1403,25/11/2024 08:57,2024-11-25 12:43:00,4.0,android app
S72432,C1402,12/03/2023 16:43,2023-03-12 19:45:00,4.0,desktop
S72433,C1724,2024-09-27 01:48:00,2024-09-27 02:43:00,1.0,mobile
S72434,C1422,2024-11-18 04:18:00,2024-11-18 07:08:00,1.0,desktop
S72435,C1618,19/10/2023 12:51,2023-10-19 16:45:00,3.0,android
S72436,C1781,2025-01-02 05:35:00,2025-01-02 05:50:00,5.0,ios
S72437,C1509,2024-06-23 05:27:00,2024-06-23 08:04:00,3.0,web
S72438,C1684,2023-03-09 14:13:00,2023-03-09 15:48:00,2.0,ios
S72439,C1279,2023-09-26 22:24:00,2023-09-26 23:48:00,4.0,web
S72440,C1485,2023-02-04 17:29:00,2023-02-04 18:45:00,10.0,android
S72441,C1155,11/08/2023 13:53,2023-08-11 15:38:00,,android
S72442,C1767,2023-07-26 02:16:00,2023-07-26 05:44:00,,mobile
S72443,C1092,2024-07-31 06:44:00,2024-07-31 08:14:00,10.0,ios
S72444,C1470,2023-04-06 16:05:00,2023-04-06 18:53:00,4.0,web
S72445,C1122,2023-07-14 14:58:00,2023-07-14 17:20:00,5.0,android
S72446,C1768,2023-05-17 04:37:00,2023-05-17 08:10:00,10.0,desktop
S72447,C1174,2025-01-25 06:33:00,2025-01-25 09:49:00,1.0,ios
S72448,C1296,2025-02-01 00:19:00,2025-02-01 03:24:00,4.0,web
S72449,C1786,2023-12-14 00:41:00,2023-12-14 03:48:00,4.0,desktop
S72450,C1235,23/08/2023 00:49,,2.0,mobile
S72451,C1377,2024-10-19 16:50:00,2024-10-19 19:12:00,,ios
S72452,C1399,2025-01-26 07:17:00,2025-01-26 10:20:00,3.0,android app
S72453,C1433,2024-08-04 03:41:00,2024-08-04 05:29:00,5.0,android app
S72454,C1512,2023-03-24 12:18:00,2023-03-24 12:13:00,10.0,web
S72455,C1672,2024-05-16 13:16:00,2024-05-16 15:30:00,4.0,android
S72456,C1250,17/08/2024 05:46,2024-08-17 05:51:00,4.0,android app
S72457,,03/05/2024 06:35,2024-05-03 10:33:00,3.0,android
S72458,C1752,2024-12-08 13:35:00,2024-12-08 16:02:00,1.0,desktop
S72459,C1051,2023-04-09 06:56:00,2023-04-09 09:09:00,4.0,android
S72460,C1223,28/08/2023 23:30,2023-08-29 02:55:00,,android app
S72461,C1157,26/10/2024 04:56,2024-10-26 07:01:00,4.0,desktop
S72462,C1356,16/12/2024 05:40,2024-12-16 08:36:00,2.0,desktop
S72463,C1775,2024-05-14 22:49:00,2024-05-14 23:37:00,10.0,android
S72464,C1201,25/07/2024 03:35,2024-07-25 05:06:00,5.0,ios
S72465,C1396,2023-03-18 11:22:00,2023-03-18 11:23:00,10.0,desktop
S72466,C1586,2023-08-01 21:37:00,2023-08-01 23:05:00,3.0,desktop
S72467,C1380,2023-07-09 11:44:00,2023-07-09 13:55:00,3.0,android app
S72468,C1732,30/05/2024 17:15,2024-05-30 20:10:00,10.0,ios
S72469,C1147,04/02/2023 05:05,2023-02-04 05:54:00,1.0,android
S72470,C1371,2023-07-24 12:31:00,2023-07-24 15:37:00,4.0,android app
S72471,C1333,06/03/2023 13:03,2023-03-06 16:51:00,5.0,web
S72472,C1544,29/10/2024 07:15,2024-10-29 07:48:00,2.0,android app
S72473,C1456,30/05/2024 09:04,2024-05-30 10:33:00,1.0,android app
S72474,C1745,2025-01-13 15:48:00,2025-01-13 16:24:00,4.0,ios
S72475,C1753,2024-06-17 14:25:00,2024-06-17 15:21:00,10.0,android app
S72476,C1388,14/01/2023 04:32,2023-01-14 04:27:00,5.0,android app
S72477,C1501,2024-05-19 09:38:00,2024-05-19 10:53:00,3.0,desktop
S72478,C1211,2023-01-15 15:10:00,2023-01-15 16:58:00,2.0,web
S72479,C1327,28/02/2024 22:43,2024-02-29 01:03:00,2.0,desktop
S72480,C1746,14/09/2023 16:32,2023-09-14 18:15:00,2.0,mobile
S72481,C1010,14/03/2023 00:21,2023-03-14 01:20:00,4.0,ios
S72482,C1485,2024-12-12 00:15:00,2024-12-12 01:01:00,5.0,mobile
S72483,C1573,24/08/2024 02:26,2024-08-24 04:29:00,1.0,ios
S72484,C1777,07/05/2024 17:04,2024-05-07 17:14:00,1.0,mobile
S72485,C1095,27/06/2023 16:32,2023-06-27 18:41:00,,desktop
S72486,C1764,16/11/2024 07:28,2024-11-16 10:37:00,4.0,android app
S72487,C1056,2024-09-16 20:14:00,2024-09-16 22:06:00,10.0,android
S72488,C1677,2024-09-08 20:34:00,2024-09-08 23:03:00,,ios
S72489,C1511,03/12/2023 20:36,2023-12-03 23:05:00,2.0,desktop
S72490,C1180,2023-08-17 01:49:00,2023-08-17 05:04:00,,desktop
S72491,C1535,2024-07-23 04:50:00,2024-07-23 08:08:00,5.0,mobile
S72492,C1705,08/07/2023 14:41,2023-07-08 15:26:00,10.0,mobile
S72493,C1229,2024-06-13 03:17:00,2024-06-13 06:41:00,4.0,android
S72494,C1668,2024-03-11 18:22:00,2024-03-11 20:38:00,10.0,ios
S72495,C1609,13/09/2023 18:20,2023-09-13 21:37:00,5.0,mobile
S72496,C1304,2023-09-08 13:37:00,2023-09-08 14:03:00,4.0,mobile
S72497,C1472,2024-06-12 23:09:00,2024-06-13 02:08:00,4.0,android
S72498,C1395,06/09/2023 05:02,2023-09-06 06:33:00,3.0,mobile
S72499,C1274,25/03/2024 05:40,2024-03-25 06:38:00,3.0,web
